,title,subreddit,name,num_comments,is_video,pinned,id,selftext
0,R/AWW OFFICIAL DISCORD!!! JOIN NOW!,aww,t3_97vuvt,135,False,False,97vuvt,[Join here!](https://discord.gg/c9YAqy3)
1,r/catsandchristmastrees: /r/Aww Subreddit of the Week!,aww,t3_a7yh12,1,False,False,a7yh12,
2,All aboard the Catbus,aww,t3_a89bnc,138,False,False,a89bnc,
3,Just happy to see you,aww,t3_a88393,161,True,False,a88393,
4,Meeeeeelk!,aww,t3_a87fhb,202,True,False,a87fhb,
5,Little girl meets Michelle Obama at a book signing event,aww,t3_a870m8,1746,False,False,a870m8,
6,Andy has slept in my bed with me for the past 8 years and he still puts his head on the edge of the bed to ask permission to jump on,aww,t3_a868ri,568,False,False,a868ri,
7,This is Anna! She turned 18 October 12!,aww,t3_a86a0s,167,False,False,a86a0s,
8,Almost two years ago this good boy showed up at my front door.,aww,t3_a868o5,258,False,False,a868o5,
9,Just like spiderman meme,aww,t3_a88a4j,19,False,False,a88a4j,
10,"My wife with no dogs, who loves dogs, gets to watch family's dogs over the holidays. Merry Christmas Baby.",aww,t3_a869pd,214,False,False,a869pd,
11,My cat is now 20 years old. Here is a pic of her as a kitten (around a few months old) and now. She has always been tiny for her age!,aww,t3_a891qa,26,False,False,a891qa,
12,Take a lil rest on my hand buddy.,aww,t3_a860tt,47,False,False,a860tt,
13,This sweet girl was a little nervous on her first day with her new family 😌,aww,t3_a856k6,173,False,False,a856k6,
14,A picture full of floof. Someone clearly put a lot more effort in the group picture than the others.,aww,t3_a85bjd,123,False,False,a85bjd,
15,Pupper is submissive to show she’s ready to meet the newest member of the family.,aww,t3_a84v90,304,True,False,a84v90,
16,"Corgi is terrified of going to the vet, so he brings his companion along for comfort",aww,t3_a8484m,624,True,False,a8484m,
17,My step dad is a vet and one of his patients looked a little different today..,aww,t3_a84k3f,290,False,False,a84k3f,
18,It was -20F when u took this,aww,t3_a84oo6,125,False,False,a84oo6,
19,Is my bread,aww,t3_a862pn,40,False,False,a862pn,
20,89-year-old WWII veteran who played college football for Kansas in the 1940s gets to score one last touchdown,aww,t3_a852lg,145,False,False,a852lg,
21,"When he was a puppy, my mom refused to even touch him for months. Now, she cooks and gives him sweet potatoes every day.",aww,t3_a83xyd,421,False,False,a83xyd,
22,The shelter staff said they do this ALL DAY.,aww,t3_a89ntg,14,False,False,a89ntg,
23,"My older brother brought home a surprise! Reddit, meet Ghost.",aww,t3_a88zbf,10,False,False,a88zbf,
24,The signs of True love,aww,t3_a8482h,130,False,False,a8482h,
25,Dapper as F**K,aww,t3_a88voo,5,False,False,a88voo,
26,c o m f y,aww,t3_a876zc,29,True,False,a876zc,
27,Meeting his hero,aww,t3_a86suk,12,False,False,a86suk,
28,A sheep cat...a shat? A sheep kitty...a shitty?,aww,t3_a831s4,376,False,False,a831s4,
29,Master of Balance,aww,t3_a88deo,16,False,False,a88deo,
30,"As the manager of a doggie daycare, this is how I can tell if I'm hiring the right people.",aww,t3_a82m90,314,False,False,a82m90,
31,Good girl doin a High Five,aww,t3_a82jbf,233,True,False,a82jbf,
32,"Everyone is posting their older cats, this is Rascal (22 years old)",aww,t3_a84r3o,56,False,False,a84r3o,
33,"""I wanna be a kwaken when I grow up""",aww,t3_a87aor,24,False,False,a87aor,
34,"“Oh h*ck, next time tell us sooner that you have the camera out!”",aww,t3_a867dv,14,True,False,a867dv,
35,"When Squid was a puppy, he would follow me around the house. As soon as I stopped walking, he would immediately sit down as if he wasn’t just following me.",aww,t3_a85kxp,33,False,False,a85kxp,
36,When the UPS man spots the security camera...,aww,t3_a82jzp,422,False,False,a82jzp,
37,Baby chinchillas literally melt my heart.,aww,t3_a85wpk,52,False,False,a85wpk,
38,"r/cats seemed to like Link, so I hope you guys do, too!",aww,t3_a84gjt,54,False,False,a84gjt,
39,My bro thought he got sneakers for Christmas,aww,t3_a890va,11,True,False,a890va,
40,Bandit turned 25 years old on December 7th!,aww,t3_a814sv,2012,False,False,a814sv,
41,"""Ladies don't start fights, but they can finish them.""",aww,t3_a89h7u,9,False,False,a89h7u,
42,Heading home,aww,t3_a84ijv,39,False,False,a84ijv,
43,My cat didn't want to be at the vet so she hid in my sweatshirt,aww,t3_a83nha,26,False,False,a83nha,
44,Dad wears an Upsee for his son with Cerebral Palsy so he can experience playing sports,aww,t3_a81obn,172,True,False,a81obn,
45,Artie and her duckie,aww,t3_a85pvh,12,False,False,a85pvh,
46,Adopting her tonight!,aww,t3_a81ner,121,False,False,a81ner,
47,Twin kitty sisters.,aww,t3_a810oo,141,True,False,a810oo,
48,Cat taking shelter under hachiko's statue.,aww,t3_a88lq8,16,False,False,a88lq8,
49,sunset,aww,t3_a80fbf,511,False,False,a80fbf,
50,"We found this girl wandering my neighborhood completely covered in dirt and oil. I dont know who's more happy to be a part of each other's life, her or me.",aww,t3_a83vso,48,False,False,a83vso,
51,He licks. He winks. He pets.,aww,t3_a80xp1,87,True,False,a80xp1,
52,She thinks she's a human baby,aww,t3_a80cex,194,False,False,a80cex,
53,I only had dogs till now and never thought I would raise a cat... but here's Bella,aww,t3_a89igo,8,False,False,a89igo,
54,It was going smoothly,aww,t3_a86iwv,31,False,False,a86iwv,
55,He said he wanted to hug the evil out of the Evil Queen. Her face says it all.,aww,t3_a804aq,275,False,False,a804aq,
56,Puppy eyes,aww,t3_a87zbg,4,False,False,a87zbg,
57,rare photo of every cat's inner demon,aww,t3_a80k41,59,False,False,a80k41,
58,Just signed the adoption papers for this 13 year old beauty! Christmas came early for us both!,aww,t3_a7zo2g,311,False,False,a7zo2g,
59,"This is Apollo, he's annihilated every toy we've given him except for his warthog he got the day we picked him up :)",aww,t3_a88t7k,6,False,False,a88t7k,
60,Absence makes the heart grow fonder,aww,t3_a89bkz,2,False,False,a89bkz,
61,Looking good for 23!!,aww,t3_a7z8or,892,False,False,a7z8or,
62,His morning exercises spot,aww,t3_a88gau,4,False,False,a88gau,
63,Me walking to my bed after a long day,aww,t3_a88k5t,5,True,False,a88k5t,
64,This is Max. He loves to meet new people.,aww,t3_a83i5i,34,False,False,a83i5i,
65,Two big baby bottles for two big hungry babies,aww,t3_a875sg,7,False,False,a875sg,
66,"Finally came home from college for winter break, I think it’s safe to say my (big) boy missed me!",aww,t3_a88rpg,4,True,False,a88rpg,
67,This made my day. Can't stop watching,aww,t3_a8a9jm,7,False,False,a8a9jm,
68,"After begging my husband for 6 years, i finally got to get ""my"" cat. Meet Nala, she loves HIM.",aww,t3_a86u6b,28,False,False,a86u6b,
69,"We’re gonna build a wall, okay👌, and we’re gonna make the dogs pay for it.",aww,t3_a7zvuj,162,False,False,a7zvuj,
70,"Roses are red, he’s a good boy",aww,t3_a89xpa,10,False,False,a89xpa,
71,My name is Chip! I’m a baby shepherd and also the new “Branch Manager” at my mum and dads business!,aww,t3_a83ex4,16,False,False,a83ex4,
72,this little dude on my flight,aww,t3_a7za7u,206,False,False,a7za7u,
73,Just so darn cute!,aww,t3_a86v3k,1,False,False,a86v3k,
74,Sometimes a picture is worth a thousand words,aww,t3_a87ht0,2,False,False,a87ht0,
75,Such a majestic kitteh,aww,t3_a7zlb1,37,False,False,a7zlb1,
76,New addition to the family,aww,t3_a7z906,64,False,False,a7z906,
77,He would make a good assassin. Way to blend in.,aww,t3_a7yyrx,77,False,False,a7yyrx,
78,I don't think he minds,aww,t3_a864le,3,False,False,a864le,
79,"Well, this just happened.",aww,t3_a89lx1,2,False,False,a89lx1,
80,I meant to do that,aww,t3_a89zip,5,True,False,a89zip,
81,Sleeping Hamster Falling Into Hole,aww,t3_a889v2,4,False,False,a889v2,
82,This was one of the cutest things ever!! They’re puppies in a smooth floor,aww,t3_a85wsv,19,True,False,a85wsv,
83,dog of the year award goes to.,aww,t3_a88xj0,17,True,False,a88xj0,
84,Smile and be HAPPY!!!,aww,t3_a87w32,2,False,False,a87w32,
85,If I fit,aww,t3_a8a9fz,7,True,False,a8a9fz,
86,:) :) :) :),aww,t3_a84v4l,11,False,False,a84v4l,
87,Wassup?,aww,t3_a7yjnk,57,True,False,a7yjnk,
88,Just this...,aww,t3_a899ci,9,False,False,a899ci,
89,He is so proud that he cornered and disabled the Roomba.,aww,t3_a7zlo9,40,False,False,a7zlo9,
90,My dog thinks he can sneak up on you by tip-toeing,aww,t3_a85uwr,13,True,False,a85uwr,
91,Passing biker waves. Dog waves back :),aww,t3_a7xue5,193,True,False,a7xue5,
92,No one will see this but I love the way my black kitty looks on this dark red!!,aww,t3_a86zrd,8,False,False,a86zrd,
93,Kitty guarding the chicks,aww,t3_a85qu0,32,False,False,a85qu0,
94,"I haven’t seen baby yaks here before, but they are still cute",aww,t3_a7xlft,411,False,False,a7xlft,
95,This is my cat Jackson. He was returned to the shelter twice before we adopted him. Ours forever now 12 yrs old,aww,t3_a85fun,9,False,False,a85fun,
96,Update: There are no fire alarms to rain on his parade today.,aww,t3_a7y84j,65,True,False,a7y84j,
97,how can you ever hate cats?,aww,t3_a85vns,14,True,False,a85vns,
98,Lion cub calls it quits,aww,t3_a7zqff,24,True,False,a7zqff,
99,When I made him a Christmas jumper out of my sock 🎄,aww,t3_a8997y,1,False,False,a8997y,
100,"At 13 years old, Kitty doesn’t look a day past 1.",aww,t3_a86ujc,9,False,False,a86ujc,
101,Dense Boi,aww,t3_a8ab0a,9,True,False,a8ab0a,
102,This is hershey,aww,t3_a84m2d,14,False,False,a84m2d,
103,new curious fren!,aww,t3_a88ps8,5,True,False,a88ps8,
104,Playing soccer with a pony,aww,t3_a89nfh,2,False,False,a89nfh,
105,Meet Lily: This old gal is 17 years old and loves to boss her brother around.,aww,t3_a85hdj,13,False,False,a85hdj,
106,This little guy sitting in front of me on the ferry.,aww,t3_a86k0y,6,False,False,a86k0y,
107,Dog jumps into an unknowingly deep pile of leaves to 'save' boy,aww,t3_a8aadd,5,False,False,a8aadd,
108,One of them will stare right into your soul.,aww,t3_a89931,2,False,False,a89931,
109,Sleepy owl,aww,t3_a866hb,1,True,False,a866hb,
110,Hope his name is Totoro,aww,t3_a87r6g,6,False,False,a87r6g,
111,Baby turtles are adorable,aww,t3_a89tds,4,False,False,a89tds,
112,Crash,aww,t3_a8agxo,9,True,False,a8agxo,
113,Purr-mione,aww,t3_a8ajo9,7,False,False,a8ajo9,
114,Baby pup,aww,t3_a8aj6o,3,False,False,a8aj6o,
115,"Rescued him at 12 years old. Junior gave us 7 wonderful years...will miss you, pal.",aww,t3_a8adnq,6,False,False,a8adnq,
116,Marine big brother's return takes little brother by surprise.,aww,t3_a7xup3,123,False,False,a7xup3,
117,My baby turned 23 today 🎁🎉,aww,t3_a86zat,5,False,False,a86zat,
118,5 little pups melts my heart.,aww,t3_a87vkc,4,False,False,a87vkc,
119,The doctor will see you meow.,aww,t3_a7xgxb,84,False,False,a7xgxb,
120,My cat so chill,aww,t3_a89dap,7,False,False,a89dap,
121,Bunny out for a walk,aww,t3_a8as54,5,False,False,a8as54,
122,"""This is my hole! It was made for me!""",aww,t3_a8a4yu,3,False,False,a8a4yu,
123,That hits the spot!,aww,t3_a89uhz,1,False,False,a89uhz,
124,Still aww,aww,t3_a880si,5,False,False,a880si,
125,Puppy shuffle,aww,t3_a88zys,3,False,False,a88zys,
126,Her little paws ❤️❤️,aww,t3_a7ytyn,17,False,False,a7ytyn,
127,Taking her home tonight!,aww,t3_a88uf4,5,False,False,a88uf4,
128,awwww So cute,aww,t3_a88ttg,2,True,False,a88ttg,
129,mother dog playing with pups in the snow.,aww,t3_a7x281,132,True,False,a7x281,
130,Nighty night,aww,t3_a89xls,3,True,False,a89xls,
131,Santa's On His Way,aww,t3_a88xdq,3,True,False,a88xdq,
132,"“Just three cats down here, three treats for us plz”",aww,t3_a8a9ib,7,False,False,a8a9ib,
133,"Good Morning, Can't move or the little one will awake",aww,t3_a7y3h6,16,False,False,a7y3h6,
134,"University of Kansas alumni Bryan Sperry played in the 1948 Orange Bowl. In 2015, he got the chance to put on his jersey again.",aww,t3_a8a3le,7,False,False,a8a3le,
135,This little guy turned one today!,aww,t3_a83udj,12,False,False,a83udj,
136,The proudest doggo,aww,t3_a86fuu,4,False,False,a86fuu,
137,I don't think Truman cares for the label maker much.,aww,t3_a89psk,1,False,False,a89psk,
138,Look at those ears 😍,aww,t3_a89tcn,3,False,False,a89tcn,
139,:3,aww,t3_a8anr2,0,False,False,a8anr2,
140,Rose has a new little friend who thinks Rosie is a pillow. Good dog Rose will lie there until the puppy moves or wakes up. Rose is a good doggo.,aww,t3_a7xheu,57,False,False,a7xheu,
141,"Jumping on the old cat train. I adopted Nikki when she was 17, gonna be 22 sometime next year!",aww,t3_a87nl6,8,False,False,a87nl6,
142,So playful. I love him.,aww,t3_a7wgc0,319,True,False,a7wgc0,
143,Reddit meet Ramen,aww,t3_a8agcs,4,False,False,a8agcs,
144,Aww,aww,t3_a89w03,0,False,False,a89w03,
145,The cutest little sleeping donkey,aww,t3_a8aat2,2,False,False,a8aat2,
146,Being the only puppy in the litter makes for one chubby boy,aww,t3_a85dsm,7,False,False,a85dsm,
147,completely exhausted after playing all day long,aww,t3_a88udg,0,False,False,a88udg,
148,But I caught it already?!,aww,t3_a8afel,1,False,False,a8afel,
149,Dogsitting my godpup is serious business.,aww,t3_a82okb,6,False,False,a82okb,
150,11 years old and still a prince,aww,t3_a88bqb,1,False,False,a88bqb,
151,The owner let me take a photo of this lil cutie!,aww,t3_a88erw,3,False,False,a88erw,
152,Doggo huggo,aww,t3_a7wxj2,38,False,False,a7wxj2,
153,Romantic moment,aww,t3_a8ao1h,2,False,False,a8ao1h,
154,Tongue's out gut's out,aww,t3_a8ar0q,3,False,False,a8ar0q,
155,My baby Chicken Nugget after being rescued from under a house!,aww,t3_a86i48,7,False,False,a86i48,
156,My cat doesnt really undersrand how to cat,aww,t3_a89qw8,4,True,False,a89qw8,
157,I found out why my internet kept on going down.,aww,t3_a88b3g,7,False,False,a88b3g,
158,This little guy :3,aww,t3_a8409f,3,False,False,a8409f,
159,Let me introduce you to Ginger!,aww,t3_a88ws3,3,False,False,a88ws3,
160,Ready for the rain,aww,t3_a833m2,13,False,False,a833m2,
161,What a difference a year (and proper veterinary care) makes!,aww,t3_a88363,9,False,False,a88363,
162,My friend’s dog doesn’t understand glass doors,aww,t3_a88ia6,10,True,False,a88ia6,
163,I don’t think our cat approves of her new costume,aww,t3_a82txs,21,True,False,a82txs,
164,"Found this little guy stranded in our warehouse escaping the cold. One week later he’s clean, in his new home, watching football.",aww,t3_a8asza,6,False,False,a8asza,
165,Kitty,aww,t3_a87veu,5,False,False,a87veu,
166,Guess I’m done working for the night,aww,t3_a87qi0,4,False,False,a87qi0,
167,Weeeee,aww,t3_a8adxk,1,False,False,a8adxk,
168,Hey there ! Watcha doin' ?,aww,t3_a88t10,1,False,False,a88t10,
169,A little too eager,aww,t3_a8aby0,1,False,False,a8aby0,
170,This counts as a shoulder cat right?,aww,t3_a8ae2x,1,False,False,a8ae2x,
171,She’ll only sleep in the bed I bought her if I put my sweatshirt in it,aww,t3_a87kgj,5,False,False,a87kgj,
172,cat enjoying life with loads of chicks,aww,t3_a89st1,5,True,False,a89st1,
173,"Meet Basil (M/4). Hobbies include being seal like, being the softest and sleeping 20 hours a day. Basil was rescued from Lithuania and now lives in the UK with his hooman slave, me.",aww,t3_a89go4,1,False,False,a89go4,
174,Nap over. Time to play.,aww,t3_a89vd5,0,False,False,a89vd5,
175,Funny Cat Annoying Baby SO CUUUUUUUUUUTE,aww,t3_a8ah2i,1,True,False,a8ah2i,
176,"From my recent trip to Thailand, when I made a new friend who liked to cuddle",aww,t3_a7zf6m,42,False,False,a7zf6m,
177,"Not a cute animal, but this makes me go aww",aww,t3_a896b0,3,False,False,a896b0,
178,Picked up my Uncle’s Christmas gift (Chiweenie pup),aww,t3_a8a8tk,0,False,False,a8a8tk,
179,Trying To Fit In,aww,t3_a8aeoy,1,False,False,a8aeoy,
180,Dont leave me 😭,aww,t3_a89z2n,3,False,False,a89z2n,
181,I thought she was missing but instead she was just sleeping in the shoe rack.,aww,t3_a80kha,11,False,False,a80kha,
182,This is my 19 year old boy. He’s covering his face as he knows he’s getting old!,aww,t3_a88rzy,2,False,False,a88rzy,
183,Awwww that faceeee ❤️❤️❤️,aww,t3_a88aax,1,False,False,a88aax,
184,Merry Christmas from us!,aww,t3_a8allv,2,False,False,a8allv,
185,I don’t know what I’m doing but I’m having fun,aww,t3_a80zvv,6,False,False,a80zvv,
186,Soulja boy tell ‘em,aww,t3_a8asth,3,False,False,a8asth,
187,Finley wishes you all a Merry Christmas! (First reddit post...),aww,t3_a8agwe,2,False,False,a8agwe,
188,What a fluffy boy.,aww,t3_a8ao0v,1,False,False,a8ao0v,
189,All you need is love!,aww,t3_a7ws5y,30,False,False,a7ws5y,
190,One beautifully colorful cat right here,aww,t3_a80dwj,16,False,False,a80dwj,
191,Ape Trick,aww,t3_a8a45g,3,False,False,a8a45g,
192,My wife found her behind one the EMS bases a few years ago with part of her tail missing. She can be sweet when she wants.,aww,t3_a8as6b,1,False,False,a8as6b,
193,Merlin,aww,t3_a8avgj,2,False,False,a8avgj,
194,"Caught them sleeping like this. I think it’s safe to say Sassy loves her new little sister, Jinx!",aww,t3_a8ahtk,0,False,False,a8ahtk,
195,"Meet Haley, our newest family member!",aww,t3_a84c7t,3,False,False,a84c7t,
196,My Grandpa has never heard of Netflix and I found out today he's got a smart TV. I got him on my account and the first show he wants to watch is Cheers.,aww,t3_a86ckj,9,False,False,a86ckj,
197,Cooper got his Christmas bath and was feeling handsome,aww,t3_a8ardp,4,False,False,a8ardp,
198,"Oliver meet reddit, reddit meet Oliver!",aww,t3_a8af4t,3,False,False,a8af4t,
199,My husky Aspen really loves ice cream!,aww,t3_a8aing,5,True,False,a8aing,
200,little pupper,aww,t3_a84qkr,9,False,False,a84qkr,
201,Got a Christmas pupper for the family today!,aww,t3_a89qib,5,False,False,a89qib,
202,My cat ate a bunch of plastic leaves and had to get his tummy shaved for an ultrasound. He doesn't seem to mind...,aww,t3_a8as3v,1,False,False,a8as3v,
203,This is blacky. Sorry if that's a racist name i was 8 and just learned colors in English class. He's 19 years old,aww,t3_a85vv9,30,False,False,a85vv9,
204,Thi is the cutes thing i have seen,aww,t3_a88x4h,5,True,False,a88x4h,
205,"I've only had him for 5 days and hes already found ""the spot""",aww,t3_a7wost,111,False,False,a7wost,
206,When you’re laying a sidewalk run out of bricks.,aww,t3_a8avfi,0,False,False,a8avfi,
207,Adopted these old men today. They were bonded so I had to take them both!,aww,t3_a83kef,16,False,False,a83kef,
208,Puss in Boots,aww,t3_a8axo8,1,False,False,a8axo8,
209,My granddad and his best friend,aww,t3_a89gqi,1,False,False,a89gqi,
210,"Reddit, meet MooMoo! The wife and I adopted her two-ish years ago and she’s our baby. She loves feather stick, leafy friends and helping her mommies with any work that needs to be done around the house. 💜",aww,t3_a8aitc,0,False,False,a8aitc,
211,"Yeah that's our Madeleine, not a real princess but close to it.",aww,t3_a88nuk,2,False,False,a88nuk,
212,"He may be a little chubby, but he’s Ben my boy for 18 of his last 19 years, still as loving as always.",aww,t3_a8a8kn,1,False,False,a8a8kn,
213,My little potato had tater tots!,aww,t3_a8aokb,1,False,False,a8aokb,
214,Nacho isn't sure about christmas,aww,t3_a89q99,1,False,False,a89q99,
215,They didn't get along at first.,aww,t3_a8ayed,1,False,False,a8ayed,
216,"This is Hazel, she is almost 6 weeks old now, and she is coming to live with us in another 3 =) can't wait =)",aww,t3_a89d2n,0,False,False,a89d2n,
217,Picture of a baby skunk I took.,aww,t3_a87i1w,5,False,False,a87i1w,
218,Beef's Rainbow,aww,t3_a89v5t,0,False,False,a89v5t,
219,My sister took this of me and my cat,aww,t3_a85c6n,4,False,False,a85c6n,
220,She’s always smiling,aww,t3_a8a52p,1,False,False,a8a52p,
221,Why are you playing games and not loving me?,aww,t3_a87s1l,8,False,False,a87s1l,
222,Helping with the Christmas baking,aww,t3_a8avhd,2,False,False,a8avhd,
223,Floof 100,aww,t3_a87bek,3,False,False,a87bek,
224,SO CUUUUUUUTE !,aww,t3_a89ceb,2,True,False,a89ceb,
225,"lueeee ,lueee",aww,t3_a88i2u,5,False,False,a88i2u,
226,Lovebirds pulling a tiny chariot makes my heart melt,aww,t3_a8as6m,2,True,False,a8as6m,
227,"Thanks, Dad!",aww,t3_a7wn3x,37,False,False,a7wn3x,
228,Still cute though,aww,t3_a89trd,2,False,False,a89trd,
229,"Freckles when he was a baby in a shelter and today, almost two years later",aww,t3_a7z0ut,50,False,False,a7z0ut,
230,Here’s Elton. He’s a little derpy but I love him.,aww,t3_a872pe,4,False,False,a872pe,
231,his muscles are too big,aww,t3_a89mc1,0,False,False,a89mc1,
232,He insists on joining me in the bathroom...,aww,t3_a8apub,4,False,False,a8apub,
233,Mr. Jud turned 16 last month. He's happy in his new home.,aww,t3_a84c2s,4,False,False,a84c2s,
234,And they say black cats don't photograph well,aww,t3_a8audw,2,False,False,a8audw,
235,"In honor of my cake day, here’s the moment my brother bent down at the shelter to meet our 5th senior dog rescue,",aww,t3_a8aovd,1,False,False,a8aovd,
236,My boyfriend struggling to walk our little rebel.,aww,t3_a89y5e,12,True,False,a89y5e,
237,"Meet Lasagna. This cutie shows up at my friend's house every evening, get some cuddles, spend the night there and then the morning is off to her business",aww,t3_a88u3j,2,False,False,a88u3j,
238,I found this babushka hiding in my bed.,aww,t3_a8a54b,0,False,False,a8a54b,
239,Mama elephant teaching her baby how to use its trunk,aww,t3_a8aifh,0,False,False,a8aifh,
240,Guarding the Chicks,aww,t3_a876nx,12,True,False,a876nx,
241,This is Bentley.,aww,t3_a8ahs7,1,False,False,a8ahs7,
242,I think this dog might be broken,aww,t3_a8a4a7,0,False,False,a8a4a7,
243,Drying off after a bath...,aww,t3_a82ge4,10,False,False,a82ge4,
244,He hasn’t seen his best friend since... yesterday.,aww,t3_a89946,1,False,False,a89946,
245,How do I game with this?,aww,t3_a8a7cq,10,False,False,a8a7cq,
246,My grumpy old man is turning 18 this year,aww,t3_a852q7,4,False,False,a852q7,
247,My sassy child,aww,t3_a8alfe,0,False,False,a8alfe,
248,"I was walking down some train tracks, I saw 3 or 4 of theses little guys.",aww,t3_a8al0f,4,False,False,a8al0f,
249,Our little doggo the first day we adopted her.,aww,t3_a8avad,0,False,False,a8avad,
250,My little fluff.,aww,t3_a8aa9w,1,False,False,a8aa9w,
251,Jiji's first Christmas. He particularly likes the big green activity centre.,aww,t3_a874vg,7,False,False,a874vg,
252,"It wasn't me, I was outside.",aww,t3_a8aut6,1,False,False,a8aut6,
253,10/10 would wait in this line,aww,t3_a8a0ut,2,False,False,a8a0ut,
254,A curious little fish encounters a shell,aww,t3_a87imh,6,True,False,a87imh,
255,Baby koala or ewok?,aww,t3_a87mll,4,False,False,a87mll,
256,My cat is not feeling the Christmas spirit,aww,t3_a80mbx,27,True,False,a80mbx,
257,"This is Samael, my fluffy orange devil angel, he likes to eat veggies.",aww,t3_a8aija,5,False,False,a8aija,
258,This is Mia,aww,t3_a8ayai,1,False,False,a8ayai,
259,"Almost 3 years ago my local Humane Society rescued this precious girl from a horrible place, she was found with a broken jaw. I'm so lucky to have her, I love her so much. Thank you Humane Society for everything that you do.",aww,t3_a8arzm,0,False,False,a8arzm,
260,"My wife, who is a die-hard cat person, decided that she can be a dog person too after we adopted a 5 months puppy",aww,t3_a8abo5,1,False,False,a8abo5,
261,Condensed loaf anyone?,aww,t3_a8axkp,0,False,False,a8axkp,
262,Sweet boy at 15,aww,t3_a89y90,1,False,False,a89y90,
263,She’s becoming an expert beggar,aww,t3_a8aw1h,0,False,False,a8aw1h,
264,Snuggly Kneading,aww,t3_a8a08m,1,True,False,a8a08m,
265,Scout would like you to know about her pretty scarf,aww,t3_a89og2,1,False,False,a89og2,
266,Nice Corgi in the Sea Beach,aww,t3_a89vva,0,False,False,a89vva,
267,"She is very concerned for her kitty friends, this is how she politely asks to go outside to join them 💕",aww,t3_a8aupk,0,False,False,a8aupk,
268,These 2 birds are in love and it makes me so happy to see them together all day! Aqua and Amy.,aww,t3_a8acvp,4,False,False,a8acvp,
269,My contribution to the old cats crew: Lucky @ 20f.,aww,t3_a89jpu,2,False,False,a89jpu,
270,A new Christmas ornament!,aww,t3_a82juo,4,False,False,a82juo,
271,Say Cheese!,aww,t3_a8amf6,0,False,False,a8amf6,
272,You couldn't ask for a warmer blanket.,aww,t3_a8as2y,0,False,False,a8as2y,
273,"First day on her new home, i think she likes it here",aww,t3_a8a687,1,True,False,a8a687,
274,Took a selfie with her and she smiled,aww,t3_a8arc0,0,False,False,a8arc0,
275,That cute little smirk,aww,t3_a86a9z,3,False,False,a86a9z,
276,Rescue mutt in a sunbeam 😊,aww,t3_a85zk7,4,False,False,a85zk7,
277,Loch Ness Whippet,aww,t3_a8akj5,1,False,False,a8akj5,
278,"Rescued this girl 2 years ago, she likes to praise the sun",aww,t3_a8a07e,2,False,False,a8a07e,
279,Snuggling close,aww,t3_a86upp,2,False,False,a86upp,
280,How is it possible that such little thing can give you so much love?,aww,t3_a8apld,0,False,False,a8apld,
281,Gimme dat!,aww,t3_a89nb0,6,True,False,a89nb0,
282,WOW AMAZING !,aww,t3_a89d50,4,False,False,a89d50,
283,K9 Sonny says smile!,aww,t3_a89yey,1,False,False,a89yey,
284,Ringtail Possum (Pseudocheirus peregrinus) joey,aww,t3_a89d24,1,False,False,a89d24,
285,Christmas with the best boy,aww,t3_a894ke,3,False,False,a894ke,
286,Trying to fit in,aww,t3_a89lvz,0,False,False,a89lvz,
287,Mmm creamy,aww,t3_a8b09x,2,True,False,a8b09x,
288,Lovely Dog and Cats,aww,t3_a89h4t,2,False,False,a89h4t,
289,Kitty girl missed me,aww,t3_a8afh5,0,False,False,a8afh5,
290,Namaste people ☮️,aww,t3_a8a9tm,3,False,False,a8a9tm,
291,How he wakes me up,aww,t3_a8a00g,1,False,False,a8a00g,
292,All I want for Christmas....is a letter to Hogwarts🧙🏻‍♂️| 5 days till Christmas🎄,aww,t3_a89ai3,2,False,False,a89ai3,
293,Smiling sleepy puppy,aww,t3_a89g6h,1,False,False,a89g6h,
294,Little Miss Remy,aww,t3_a88t74,0,False,False,a88t74,
295,Our school has a support dog and he's all dressed up for Christmas on the last day,aww,t3_a8921o,2,False,False,a8921o,
296,My girlfriend and I are visiting my brother and his family for the holidays. This is what I woke up to. Apparently I've been replaced.,aww,t3_a8aqmd,0,False,False,a8aqmd,
297,A cat sneezing,aww,t3_a8ax3i,0,False,False,a8ax3i,
