,title,subreddit,name,num_comments,is_video,pinned,id,selftext
602,I met a baby alpaca today and got photobombed by a proud mama,aww,t3_a7tgop,89,False,False,a7tgop,
603,Don't wake the baby,aww,t3_a88y5t,0,False,False,a88y5t,
604,Sweet Pupper’s First Snow,aww,t3_a87n23,0,False,False,a87n23,
605,A normal day in... Vietnam,aww,t3_a89ath,1,False,False,a89ath,
606,Chonk,aww,t3_a88e5z,0,False,False,a88e5z,
607,Henry found the catnip,aww,t3_a87ph3,1,True,False,a87ph3,
608,The way this ball of fluff always covers her eyes when she sleeps,aww,t3_a88igc,0,False,False,a88igc,
609,My dad likes to let both dogs ride shotgun,aww,t3_a82tdh,5,False,False,a82tdh,
610,Seal pupper,aww,t3_a8533p,4,False,False,a8533p,
611,Reddit meet Luna.,aww,t3_a86dtw,2,False,False,a86dtw,
612,Where did the time go~,aww,t3_a85s74,2,False,False,a85s74,
613,Choose one,aww,t3_a884im,5,False,False,a884im,
614,woof irl,aww,t3_a880sc,1,False,False,a880sc,
615,This little girl is getting some outdoor exercise because she feeds too much is much fatter than her brothers,aww,t3_a88glw,0,False,False,a88glw,
616,:D &lt;3,aww,t3_a86xbo,0,False,False,a86xbo,
617,Sleepy boofer,aww,t3_a87h93,1,False,False,a87h93,
618,slep,aww,t3_a87271,0,False,False,a87271,
619,"He ate cat poop like it was a breadstick five minutes ago (before getting caught), and now he thinks he’s a cat.",aww,t3_a897vd,2,False,False,a897vd,
620,Wait that’s not a hamster...,aww,t3_a86dm1,5,False,False,a86dm1,
621,My first grandpupper. Meet Willow aka Gooby.,aww,t3_a86dko,5,False,False,a86dko,
622,Thomas and I having cuddle time,aww,t3_a87gjo,0,False,False,a87gjo,
623,Look at my Jaime! Very photogenic,aww,t3_a8arl3,0,False,False,a8arl3,
624,"The smaller cat loves the dog. She only eats out of the dog's dish, and only whole the dog is eating. She also likes to sleep on top of the dog. The larger fluffy cat rules with an iron paw, and the dog just wants to be loved.",aww,t3_a88608,1,False,False,a88608,
625,Roommate's cat forever lurking,aww,t3_a85oir,2,False,False,a85oir,
626,This is Zoee. She likes to stick her tongue out,aww,t3_a85r50,4,False,False,a85r50,
627,Cosy winter mornings,aww,t3_a89lq8,0,False,False,a89lq8,
628,I think Hercules likes my heated blanket.,aww,t3_a88dcj,1,False,False,a88dcj,
629,Can you be my friends?,aww,t3_a7wig1,22,False,False,a7wig1,
630,Moose is darn shy about his new tie.,aww,t3_a88cx2,1,False,False,a88cx2,
631,His first day out at a park.,aww,t3_a8ao87,4,False,False,a8ao87,
632,I’m comingggg!,aww,t3_a85fu7,6,False,False,a85fu7,
633,Omg you’re back!!!,aww,t3_a7vdq0,41,True,False,a7vdq0,
634,Doggy Yoga. Doga.,aww,t3_a887o8,2,False,False,a887o8,
635,I might have the cutest kitten ever,aww,t3_a854ln,3,False,False,a854ln,
636,Timber takes a selfie,aww,t3_a886ww,6,False,False,a886ww,
637,Top 10 Dilemmas: How to wear your shoes without disturbing your cat,aww,t3_a87oqj,3,False,False,a87oqj,
638,"My nearly 16 year old cat, Raika, who just decided to be a lap cat this past week.",aww,t3_a7zhxt,11,False,False,a7zhxt,
639,Cat in a box in a box,aww,t3_a8869b,0,False,False,a8869b,
640,"If you want something done cute, do it yourself!",aww,t3_a8b4g7,0,False,False,a8b4g7,
641,My cat faceplants when sleeping,aww,t3_a88ezo,0,False,False,a88ezo,
642,A chimpanzee living at a zoo in Miami was reunited with his former foster parents,aww,t3_a7sax5,396,True,False,a7sax5,
643,She’s fitting in right at home! First day of adopting her! She jumps into my lap and purrs!,aww,t3_a87gmn,3,False,False,a87gmn,
644,RHCP Flea and his doggo,aww,t3_a8b3jq,0,False,False,a8b3jq,
645,A day in the life of a polar bear baby,aww,t3_a843fd,7,True,False,a843fd,
646,"""Awww, cute little ducks...""",aww,t3_a8b39j,0,True,False,a8b39j,
647,Baby octopus gets the thumbs up,aww,t3_a7zro0,9,False,False,a7zro0,
648,88-year-old grandma bakes more than 30 kg of cookies each December. She donates the majority of them to the Christmas market from the local disability home. This is what they look like.,aww,t3_a858gb,4,False,False,a858gb,
649,"Christmas crib with baby on hay, dyi version.",aww,t3_a880lg,0,False,False,a880lg,
650,Ferret with a foamy pompadour,aww,t3_a87eh0,2,False,False,a87eh0,
651,My mom hand feeding chicken to our 15 year old lab/husky puppy. She said she hates pets.... yeah ok.,aww,t3_a86awi,2,False,False,a86awi,
652,Good boy &amp; good girl,aww,t3_a87ho0,1,False,False,a87ho0,
653,The legendary pillow guardian,aww,t3_a87z0o,0,False,False,a87z0o,
654,This is my dog when he was little - just thought I'd share🐶🐧,aww,t3_a87no3,2,False,False,a87no3,
655,This goofball is almost fifteen.,aww,t3_a88lgf,1,False,False,a88lgf,
656,A photo I took of my friends cat. She has the bluest eyes!!,aww,t3_a88665,0,False,False,a88665,
657,She's got her own couch and pillows,aww,t3_a8axzy,0,False,False,a8axzy,
658,Sewer backed up in my condo yesterday. My neighbor’s kid just knocked on my door to give me homemade peppermint meringue and say “I’m sorry your house is full of poo water” ❤️,aww,t3_a85uco,3,False,False,a85uco,
659,Crazy old pupper.,aww,t3_a89m12,0,False,False,a89m12,
660,My kitten 'Scottish Fold' is having fun before bedtime 🔴 😻,aww,t3_a8awas,0,False,False,a8awas,
661,Cozied up to the fire with Loosey,aww,t3_a87wvs,0,False,False,a87wvs,
662,Puppy climb,aww,t3_a889li,6,False,False,a889li,
663,this is the best looking dog I have ever seen,aww,t3_a7xpsd,8,False,False,a7xpsd,
664,My dog is in love with her new little tube of floof.,aww,t3_a86gbp,2,False,False,a86gbp,
665,Furniture box is best box,aww,t3_a87ovd,0,False,False,a87ovd,
666,"This years holiday card featured Daisy, our new pug puppy.",aww,t3_a8acdo,1,False,False,a8acdo,
667,Making my way downtown,aww,t3_a862ef,2,False,False,a862ef,
668,My pup,aww,t3_a88dy4,0,False,False,a88dy4,
669,This is Button,aww,t3_a8649p,7,False,False,a8649p,
670,Them beans,aww,t3_a879wk,1,False,False,a879wk,
671,"My beautiful little one eyed rescue kitty. Reddit, meet Nina.",aww,t3_a86ffj,0,False,False,a86ffj,
672,I also have pets who are very much in love,aww,t3_a85x9t,2,False,False,a85x9t,
673,Sooo Cute,aww,t3_a865i7,3,False,False,a865i7,
674,"Ries went to the groomer for the first time today, now he’s a B I G P U F F",aww,t3_a867po,2,False,False,a867po,
675,Today marks 3 years since rescuing this handsome fella who was left behind during an eviction. We named him Kylo.,aww,t3_a878na,1,False,False,a878na,
676,sleepy kitty,aww,t3_a86v95,0,False,False,a86v95,
677,"Nah, I'm good. Why u ask?",aww,t3_a89uwu,0,False,False,a89uwu,
678,She’s so proud of her new aloe plants,aww,t3_a87qmd,0,False,False,a87qmd,
679,Ducklings at Play,aww,t3_a846ci,3,True,False,a846ci,
680,Kitty in a Christmas tree.,aww,t3_a85em6,2,False,False,a85em6,
681,My cat Choco’s 6 month growth (July 2018 on left and December 2018 on right),aww,t3_a85pqx,6,False,False,a85pqx,
682,My mom and her new pup being serious,aww,t3_a864ac,4,False,False,a864ac,
683,Atlas is not impressed with us,aww,t3_a87ma8,0,False,False,a87ma8,
684,Beautiful two faced cat,aww,t3_a7s6tu,269,True,False,a7s6tu,
685,Why you scritch my ear?,aww,t3_a85lvi,1,True,False,a85lvi,
686,Toby looking like a lil teenager T^T,aww,t3_a86yp4,0,False,False,a86yp4,
687,When the pup doesn’t want to wake up!,aww,t3_a896kg,0,True,False,a896kg,
688,If I fits I sits... Or squish. Cats dont obey physics.,aww,t3_a87crv,4,False,False,a87crv,
689,This would definitely be his tinder profile pic,aww,t3_a83isn,6,False,False,a83isn,
690,santa brought us an early gift :),aww,t3_a87g2v,1,False,False,a87g2v,
691,Can I has pizza? (Bonus story in comments),aww,t3_a88r4y,3,False,False,a88r4y,
692,How I start my day every day.,aww,t3_a895j5,0,True,False,a895j5,
693,The Pibble who stole Christmas,aww,t3_a86nk2,1,False,False,a86nk2,
694,Merry Christmas,aww,t3_a873km,1,False,False,a873km,
695,Cocoa ❤️,aww,t3_a87mfv,2,False,False,a87mfv,
696,Luna has discovered the new heat blanket,aww,t3_a873g7,1,False,False,a873g7,
697,Spaghetti? Never heard of it. That mess must of been the cats.,aww,t3_a868qc,3,False,False,a868qc,
698,Mork has had a long night.,aww,t3_a8878l,1,False,False,a8878l,
699,I got a new home robot today and my cat has been like this the whole time...,aww,t3_a86157,7,False,False,a86157,
700,Hiding in his little fort.,aww,t3_a88ce9,0,False,False,a88ce9,
701,"Since we’re posting pictures of our oldies, this is Angel! She turned 16 on October 23rd!",aww,t3_a87h8b,0,False,False,a87h8b,
702,Say cheese!,aww,t3_a88cb8,0,False,False,a88cb8,
703,Overloaded Cuteness.,aww,t3_a87d7p,2,False,False,a87d7p,
704,"Adopted this 10 year old ""puppy"" last month!",aww,t3_a862nm,2,False,False,a862nm,
705,He called shotgun,aww,t3_a84vyd,3,False,False,a84vyd,
706,"Today I become the luckiest guy in the world and I adopted this magnificent beast. Reddit, meet Jaime",aww,t3_a857e7,5,False,False,a857e7,
707,"Pupper doggos on cleanup duty, strong immune system here we come.",aww,t3_a88hj7,1,False,False,a88hj7,
708,When you need to sleep with big sis and it makes you happy...,aww,t3_a85ikw,0,False,False,a85ikw,
709,This is my kitten Milo she is a main Coon and will sleep anywhere. Just thought you guys might like her,aww,t3_a85xhu,0,False,False,a85xhu,
710,Sticky tongue,aww,t3_a82w9a,2,True,False,a82w9a,
711,Shop dog,aww,t3_a86iyy,3,False,False,a86iyy,
712,Adopted these two four years ago today!,aww,t3_a85y8f,0,False,False,a85y8f,
713,Celebrating cake day with cuddles!,aww,t3_a86p0i,2,False,False,a86p0i,
714,Fresh kittens: Maine Coon &amp; Ragdoll,aww,t3_a85iiz,1,False,False,a85iiz,
715,My good boy!,aww,t3_a88t3z,1,False,False,a88t3z,
716,Someone wanted to sneak the cookie dough.,aww,t3_a8b4v1,0,False,False,a8b4v1,
717,I'll do anything for a treat!,aww,t3_a86rl2,0,False,False,a86rl2,
718,You just gotta get that belly,aww,t3_a8b4r6,0,False,False,a8b4r6,
719,"I may be a little biased, but I think she is the prettiest girl in the world!",aww,t3_a85a0n,5,False,False,a85a0n,
720,THIS IS REAL 😱😱😱 ???,aww,t3_a875ul,1,False,False,a875ul,
721,This cute doggo i saw,aww,t3_a86elq,3,False,False,a86elq,
722,Basket of Floof,aww,t3_a87yy7,1,False,False,a87yy7,
723,Hey reddit! Meet Maple ❤,aww,t3_a855n1,2,False,False,a855n1,
724,Me IRL on a first date,aww,t3_a88zjx,2,False,False,a88zjx,
725,My dog learning how to play like a cat,aww,t3_a8664e,4,True,False,a8664e,
726,My 1 year old cat Lizzy loves this chair,aww,t3_a8837b,0,False,False,a8837b,
727,The face my pup makes when I give that good scratch,aww,t3_a87cs2,0,False,False,a87cs2,
728,Getting a coffee and saw these two cuties chilling in the back of a car,aww,t3_a87tkb,1,False,False,a87tkb,
729,Snow Snoopy!,aww,t3_a7sbhz,43,False,False,a7sbhz,
730,"She’s a big ball of fluff so we call her flufferbutt, happy holidays from my fury friends to yours!",aww,t3_a86irp,0,False,False,a86irp,
731,Wanted to share a picture of my GF whippet/Seal,aww,t3_a84kfg,3,False,False,a84kfg,
732,my kitten likes to purr w her mouth open when she’s super happy,aww,t3_a82mai,6,False,False,a82mai,
733,My girl and me every night. She snores so loud!,aww,t3_a85m54,2,False,False,a85m54,
734,When you meet your new best friend. 1 week old Standard Poodle Pup,aww,t3_a86fll,0,False,False,a86fll,
735,I’m comingggg!,aww,t3_a85x66,4,False,False,a85x66,
736,Bean massage,aww,t3_a87f58,1,False,False,a87f58,
737,She’s a good conversationalist,aww,t3_a8azsq,0,True,False,a8azsq,
738,Coco the workshop dog loves to help the boys with end of year clean up,aww,t3_a851we,3,True,False,a851we,
739,Zoey is amused by the new penguin yard decoration.,aww,t3_a880ue,0,False,False,a880ue,
740,New puppy time! My nephew is going to love his Christmas present.,aww,t3_a86qlk,0,False,False,a86qlk,
741,Sleep well! 🐈,aww,t3_a880jv,2,False,False,a880jv,
742,Got a little something on your face ...,aww,t3_a86inz,3,False,False,a86inz,
743,Boop the snoot,aww,t3_a855t1,6,False,False,a855t1,
744,"He’s prettier than me, it’s not fair.",aww,t3_a88v02,0,False,False,a88v02,
745,Lizards are adorable. Fight me!!!,aww,t3_a84s81,5,False,False,a84s81,
746,"She's not the easiest to make smile, but when she does... :)",aww,t3_a85plp,1,True,False,a85plp,
747,"13 years of madness! My Jack Russell - Pit Bull Mix... Yep, you read it right.",aww,t3_a89d8z,1,False,False,a89d8z,
748,"Rufus the pig &amp; Henry the cat, best friends.",aww,t3_a86n2z,5,False,False,a86n2z,
749,Snugglers sleeping on my wife's face,aww,t3_a87szw,0,False,False,a87szw,
750,No Fence (AKA teeth.),aww,t3_a85ovt,1,False,False,a85ovt,
751,Trying to help out,aww,t3_a86itp,1,False,False,a86itp,
752,Meet Lucky. She will be turning 18 in March,aww,t3_a86tqz,5,False,False,a86tqz,
753,Who’s ready for bed?,aww,t3_a8at9u,0,False,False,a8at9u,
754,Opie the snowpug ❄️,aww,t3_a86385,0,False,False,a86385,
755,"Anne saw me carry a new bag of cat food into the house this evening, and she wants to know why they have to finish the old bag before they get the new flavor. Shouldn’t they have choices?",aww,t3_a86opm,2,False,False,a86opm,
756,Loki being lazy,aww,t3_a85w66,0,False,False,a85w66,
757,Mouse Berry,aww,t3_a869ui,3,False,False,a869ui,
758,A sweet old gal i hung out with while waiting outside the grocery store,aww,t3_a87l73,1,False,False,a87l73,
759,"This is Lily, my new co-worker. 'Nuff said.",aww,t3_a86cq4,0,False,False,a86cq4,
760,This video is aww filled,aww,t3_a899ji,2,False,False,a899ji,
761,Rescued good'ol Chester at the beginning of this year and he has finally settled in nicely,aww,t3_a855i3,0,False,False,a855i3,
762,He Loves the snow!,aww,t3_a7r8r2,264,False,False,a7r8r2,
763,My potato is ready for Christmas,aww,t3_a876oj,0,False,False,a876oj,
764,Happy first b day little man!,aww,t3_a8632d,7,False,False,a8632d,
765,SO FUZZY 😻😻🐮,aww,t3_a80rsz,2,False,False,a80rsz,
766,My favorite tripawd in the world turns 4 today! She will always look like a puppy. And I love it.,aww,t3_a832dl,4,False,False,a832dl,
767,"Big brother, little brother",aww,t3_a7yy1c,7,False,False,a7yy1c,
768,Rufus the miniature schnauzer,aww,t3_a867y9,1,False,False,a867y9,
769,Pure comfort,aww,t3_a870pi,2,False,False,a870pi,
770,My best friend and her boyfriend got a new dog. Say hello to Yogi Bear!,aww,t3_a87ebs,1,False,False,a87ebs,
771,Have a great day!,aww,t3_a883ug,0,False,False,a883ug,
772,My tuxedo buddy had a real glow up after being rescued from the lake. Look at those whiskers,aww,t3_a83n4e,7,False,False,a83n4e,
773,Have a bit of Chinchilla,aww,t3_a7yymd,6,True,False,a7yymd,
774,Let's go home,aww,t3_a87y1b,0,False,False,a87y1b,
775,I think she likes it,aww,t3_a82kc1,3,True,False,a82kc1,
776,Meet Stella. My rambunctious 4 year old.,aww,t3_a8am9a,0,False,False,a8am9a,
777,Sunbathing on her bench,aww,t3_a87xgu,1,False,False,a87xgu,
778,"This is Edith. She’s my best friend and loves everybody, everything, and everywhere.",aww,t3_a877xx,1,False,False,a877xx,
779,The lion shall lie down with the... teddy bear?,aww,t3_a85zww,1,False,False,a85zww,
780,"This is Heckles, I've had her for two years, and she loves to watch hockey with me!",aww,t3_a85wko,1,False,False,a85wko,
781,35mm of my dog Sergeant Pupper 🤗,aww,t3_a85z9h,0,False,False,a85z9h,
782,She's saying hello to the car behind at the drive thru,aww,t3_a85z7d,1,False,False,a85z7d,
783,An angel,aww,t3_a88euo,2,False,False,a88euo,
784,Wally being a brave boy for his medicine,aww,t3_a7swcp,64,True,False,a7swcp,
785,"""Hey why don't you put ornaments on the tree anymore?""",aww,t3_a7x3lr,5,False,False,a7x3lr,
786,Thanks for my early Christmas present Santa!,aww,t3_a85n9g,0,False,False,a85n9g,
787,She's stolen my heart.,aww,t3_a854b7,3,False,False,a854b7,
788,An argie cat,aww,t3_a86wxd,5,False,False,a86wxd,
789,Albino alligator,aww,t3_a86gts,3,False,False,a86gts,
790,Came home to my dog walking around the backyard like this,aww,t3_a85sfs,5,False,False,a85sfs,
791,Car rides are a love-hate relationship,aww,t3_a8aj6i,1,False,False,a8aj6i,
792,Peek-A-Boo,aww,t3_a8282e,7,False,False,a8282e,
793,Forecast: windy,aww,t3_a85xnh,4,True,False,a85xnh,
794,He flew home and surprised his little brother,aww,t3_a7y4vq,9,False,False,a7y4vq,
795,Husband and I encountered a cat named Battle Cat at our local Pet Smart. Would have adopted her if we could~,aww,t3_a86d1f,11,False,False,a86d1f,
796,Just plain cute,aww,t3_a85jtj,3,False,False,a85jtj,
797,These two in their matching sweaters.,aww,t3_a870m7,0,False,False,a870m7,
798,Walking into Whole Foods for lunch when...,aww,t3_a85322,1,False,False,a85322,
799,Another adorable pose. Too tired to do any more work!,aww,t3_a82xgp,1,False,False,a82xgp,
800,A little Snacc,aww,t3_a83gr0,5,False,False,a83gr0,
801,"Minerva turned 93 back in October, but forgot to share! Here she is in all her glory!",aww,t3_a84ir5,8,False,False,a84ir5,
802,My boyfriend's Majestic Cat,aww,t3_a84d2w,3,False,False,a84d2w,
803,I was told there would be treats!?!,aww,t3_a863z1,0,False,False,a863z1,
804,I always said I'd never use my kid for internet points...so here's the other sweetheart in my life!,aww,t3_a85boq,6,False,False,a85boq,
805,Day Dreaming,aww,t3_a87hfj,3,False,False,a87hfj,
806,Photo of my shiba with a photo of him on a blanket,aww,t3_a86gdp,3,False,False,a86gdp,
807,My dog stays white for about 2 days,aww,t3_a85li4,4,False,False,a85li4,
808,"My cat after getting out this morning when I didn’t want him too. Came home from my lunch break to find a very unhappy, soggy moggy 😂",aww,t3_a8195u,6,False,False,a8195u,
809,Kitty guarding the chicks,aww,t3_a85myd,2,False,False,a85myd,
810,My dog is cute but I don’t trust him,aww,t3_a89b6g,1,False,False,a89b6g,
811,This is Gee my mom's bow tie kitty.,aww,t3_a86mm4,0,False,False,a86mm4,
812,"My golden retriever , Maple",aww,t3_a82xlv,4,False,False,a82xlv,
813,Best boy will drop his toys for Gundam.,aww,t3_a888cy,5,False,False,a888cy,
814,My dog being a good boy about 5 minutes before the doctor says he's going to get a shot,aww,t3_a85d2m,4,False,False,a85d2m,
815,"Floof King: ""You minion, need moar scritches!""",aww,t3_a869wd,0,True,False,a869wd,
816,Not ready to get up yet,aww,t3_a85ff3,0,True,False,a85ff3,
817,"My good boy, Finn",aww,t3_a86tvk,1,False,False,a86tvk,
818,Brothers from another mother,aww,t3_a8b4mu,0,False,False,a8b4mu,
819,"Reddit, meet my best girl!",aww,t3_a85n7a,1,False,False,a85n7a,
820,Mommy?,aww,t3_a8b3oz,0,False,False,a8b3oz,
821,Happiness in little things ❤️,aww,t3_a7r0fu,269,True,False,a7r0fu,
822,This little guy bounced up to say hi,aww,t3_a7r98c,152,False,False,a7r98c,
823,My dog had the sleepy hiccups,aww,t3_a87hj9,1,True,False,a87hj9,
824,Mama bunny lines nest with her own fur. Bonus pics of more bunnies and mama.,aww,t3_a8b1xr,0,False,False,a8b1xr,
825,"Believe it or not, there’s a nearly 90 pound beast under that blanket.",aww,t3_a86axw,3,False,False,a86axw,
826,Pretty kitty!,aww,t3_a84pan,0,False,False,a84pan,
827,Comforts his wife even though he fell as well.,aww,t3_a7qmmk,2140,True,False,a7qmmk,
828,Prissy was only 2.2 lbs when we rescued her. A pic of her first try at solid food. Size 12 boot for scale,aww,t3_a870tu,2,False,False,a870tu,
829,Who can resist this cuteness?,aww,t3_a7zdk2,5,True,False,a7zdk2,
830,Cheeky squirrel was so determined to get the bird seed!,aww,t3_a88lkz,1,False,False,a88lkz,
831,Give me pets,aww,t3_a86aga,0,False,False,a86aga,
832,"She really likes the dogs stroller. Every time it is in the house, she jumps into it and usually goes to sleep. Lol. I have to force her out to put it back in my trunk. I love this darn kitty.",aww,t3_a85zwt,2,False,False,a85zwt,
833,Different from a cat or dog :),aww,t3_a82xkz,2,False,False,a82xkz,
834,"My spoiled boy, Zeus, all cozy in front of the *artificial* fire.",aww,t3_a86hpe,1,False,False,a86hpe,
835,Murphy looks like he belongs in a Pixar movie,aww,t3_a7ymis,5,False,False,a7ymis,
836,"He’s always around, hovering",aww,t3_a8b082,0,True,False,a8b082,
837,Even lops can enjoy an ugly sweater party,aww,t3_a86dil,0,False,False,a86dil,
838,"""I'm not eating dry food again.""",aww,t3_a7us1w,40,False,False,a7us1w,
839,my dog took my juice box,aww,t3_a86h2t,4,False,False,a86h2t,
840,"This meowjestic fluff monster turns 4 today! Reddit, say hello to Ronin.",aww,t3_a83978,0,False,False,a83978,
841,Anyone here think a Betta and his snail are cute?,aww,t3_a86g7x,1,False,False,a86g7x,
842,"Both of our girls were extremely happy with our early xmas, one in particular",aww,t3_a88b3d,0,False,False,a88b3d,
843,She cleans her stuffies as though they’re her puppies!,aww,t3_a85kr2,1,True,False,a85kr2,
844,Pretty much,aww,t3_a854ey,1,False,False,a854ey,
845,I decided to help with the lack of yak by posting a bunch of the little guys!,aww,t3_a8378x,7,False,False,a8378x,
846,Tanks deserve love too,aww,t3_a84fgb,5,False,False,a84fgb,
847,Look closely. Not all the lights are as they seem,aww,t3_a84yzj,6,False,False,a84yzj,
848,This is Wally,aww,t3_a85bm0,1,False,False,a85bm0,
849,Waiting for xmas!✨🐰🎄,aww,t3_a88ioo,0,False,False,a88ioo,
850,TBT when puppers wasn’t so big,aww,t3_a862xc,1,False,False,a862xc,
851,He's a good boi,aww,t3_a85g5t,1,False,False,a85g5t,
852,Caught this trash panda in action!,aww,t3_a862nb,4,False,False,a862nb,
853,Just a little hair snack,aww,t3_a876r6,2,True,False,a876r6,
854,Festive baby moo,aww,t3_a7y28n,3,False,False,a7y28n,
855,It's impossible to win an argument with Suji,aww,t3_a8573e,1,False,False,a8573e,
856,Each one year apart they are all best friends!,aww,t3_a7xo30,2,False,False,a7xo30,
857,Illustration I did for a client’s tattoo design of their cat and Luna. Based on a previous drawing of Luna and Artemis. #illustration #art #design #tattoodesign #cute #cats #moon #sailormoon #lunaandArtemis #luna,aww,t3_a891zc,0,False,False,a891zc,
858,"The cats don’t get along with the dog too well, but they’ll all tolerate each other long enough to all lay on me and watch Netflix",aww,t3_a861bo,1,False,False,a861bo,
859,Meet Farley.,aww,t3_a85emb,0,False,False,a85emb,
860,What my postmates guy sees trough the window when he rings the bell,aww,t3_a89fy9,1,False,False,a89fy9,
861,"Heidi, 8 yr old Persian x.",aww,t3_a86k20,1,False,False,a86k20,
862,Heard y’all like farm animals,aww,t3_a86o9p,1,False,False,a86o9p,
863,Repost indeed,aww,t3_a88p32,0,False,False,a88p32,
864,Oh are you taking a video?,aww,t3_a7uomc,32,True,False,a7uomc,
865,He really wants to play with the gerbils.,aww,t3_a84u1h,5,True,False,a84u1h,
866,"This is Sunny, a beagle I met outside the grocery store. The only way to get his attention is to wave a cherry at him.",aww,t3_a8791y,7,False,False,a8791y,
867,Hello Kitty!,aww,t3_a86mz8,2,False,False,a86mz8,
868,My big (baby) kitty Antonio with his new favorite toy,aww,t3_a87er1,1,False,False,a87er1,
869,Pupper intrigued by straw hat,aww,t3_a86wzp,1,False,False,a86wzp,
870,This little darlin’ deserves a little tribute as she has turned sweet 16 this week.,aww,t3_a855ay,5,False,False,a855ay,
871,Bewaaaare,aww,t3_a7s0cu,71,True,False,a7s0cu,
872,fUcKinG xEnomOrph eRupTs fRom UnSuspEcTing hUmAn’s cHesT,aww,t3_a82qr0,4,False,False,a82qr0,
873,Happy little gator,aww,t3_a80gnn,11,False,False,a80gnn,
874,"my gf got a new kitty the other day, he has black beans",aww,t3_a85tiz,0,False,False,a85tiz,
875,Hide n’ seek anyone?,aww,t3_a86ehy,1,True,False,a86ehy,
876,The best pic I have of 18 year old Harry,aww,t3_a844na,7,False,False,a844na,
877,Dammit.,aww,t3_a86b5u,3,False,False,a86b5u,
878,Little knuklehead is 6 months and she rarely stays for a photo.,aww,t3_a88bqw,0,False,False,a88bqw,
879,Her happy place.,aww,t3_a83jck,2,False,False,a83jck,
880,A not so fully awake Bella doesn’t appreciate the early starts.,aww,t3_a875be,1,False,False,a875be,
881,"If I fit, I sit.",aww,t3_a85au8,0,False,False,a85au8,
882,My beagle Dora,aww,t3_a8623p,1,False,False,a8623p,
883,Photogenic,aww,t3_a85y36,0,False,False,a85y36,
884,Dad is too happy to know that he's in trouble... but his son knows what's up.,aww,t3_a7rbjh,70,False,False,a7rbjh,
885,My pups are starting getting along nicely.,aww,t3_a84w14,0,False,False,a84w14,
886,"Meet Frank, he's excited for his first Christmas!",aww,t3_a85ms9,2,False,False,a85ms9,
887,4 different shades of ween.,aww,t3_a869gl,0,False,False,a869gl,
888,The look of love,aww,t3_a85451,1,False,False,a85451,
889,Our little Christmas present,aww,t3_a86sq3,0,False,False,a86sq3,
890,My cat,aww,t3_a85ttd,7,False,False,a85ttd,
891,"Logan boy is sick, send good thoughts his way.",aww,t3_a7yvpz,17,False,False,a7yvpz,
892,My mom and pup on the day I moved to university,aww,t3_a86mli,2,False,False,a86mli,
893,Talking to you. Meet Ivan. Our 9yr old Silky who just ate my wallet😂,aww,t3_a863jm,2,False,False,a863jm,
894,Big smiles.,aww,t3_a85o3n,0,False,False,a85o3n,
895,Watching tv is her favorite.,aww,t3_a867gx,0,False,False,a867gx,
896,excuse me you stopped petting,aww,t3_a85h2i,1,False,False,a85h2i,
897,I wanna play too,aww,t3_a87euo,0,False,False,a87euo,
898,Warned my SO that his age (18) made him highly wary and aloof towards new people.,aww,t3_a83im4,3,False,False,a83im4,
899,"3 years ago to the day we adopted a pair of ginger, ragdollx kittens. Not much has changed in that time.",aww,t3_a85g6k,4,False,False,a85g6k,
900,boop,aww,t3_a84fsn,1,True,False,a84fsn,
901,Hey reddit! Here’s my new puppy Zuko!,aww,t3_a86er0,2,False,False,a86er0,
902,An old picture of my two cats. Love how cats' eyes react to flash photography.,aww,t3_a87750,1,False,False,a87750,
903,short snout problem😭,aww,t3_a87dho,0,False,False,a87dho,
904,He wanted to let us know that his presence was our present,aww,t3_a84c5s,0,False,False,a84c5s,
905,"She likes to rest her chin, up to 20 minutes of this at a time. She’s not scratching, or rubbing her neck. Just standing, resting her chin...",aww,t3_a87qz6,0,False,False,a87qz6,
906,My amazing 12year old boy,aww,t3_a86duh,1,False,False,a86duh,
907,"Happy 12th birthday to my best friend, Maggie :)",aww,t3_a85ea7,3,False,False,a85ea7,
908,She’s 90% belly,aww,t3_a84ye4,2,False,False,a84ye4,
909,Best box ever!,aww,t3_a868i6,0,False,False,a868i6,
