,title,subreddit,name,num_comments,is_video,pinned,id,selftext
298,The squeaky pigs are her favorite,aww,t3_a89yiw,7,False,False,a89yiw,
299,"And you my, brown eyed girl.",aww,t3_a8ajjh,1,False,False,a8ajjh,
300,Everything I needed for the holidays,aww,t3_a87rxb,2,False,False,a87rxb,
301,He got scared when they yelled :(,aww,t3_a87zlr,6,False,False,a87zlr,
302,🐰,aww,t3_a880w1,0,False,False,a880w1,
303,Our puppy Cosmo playing with an ice block for the first time hahaha,aww,t3_a887sz,0,True,False,a887sz,
304,Emma Watson just posted this,aww,t3_a890no,1,False,False,a890no,
305,"Our little fur ball, Ravioli",aww,t3_a8avfy,3,False,False,a8avfy,
306,I see your old cats and raise you one old doggo!,aww,t3_a8aicr,0,False,False,a8aicr,
307,"Seriously? That puppy is still here, Mom?",aww,t3_a89871,0,False,False,a89871,
308,No idea why he does this,aww,t3_a8av22,1,False,False,a8av22,
309,It was a little muddy out today but that didn’t stop Susan from chasing her ball.,aww,t3_a8abkh,1,False,False,a8abkh,
310,Morning stretching has turned into morning cuddles,aww,t3_a8agvt,0,False,False,a8agvt,
311,My sweet 12 year old Yahtzee.,aww,t3_a884um,2,False,False,a884um,
312,My son practicing his Power Ranger,aww,t3_a8aak6,1,False,False,a8aak6,
313,Funny Cat Annoying Baby SO CUUUUUUUUUUTE,aww,t3_a8ag54,1,True,False,a8ag54,
314,Tiny Stalker,aww,t3_a7uwbj,99,False,False,a7uwbj,
315,Just walk slowly like daddy,aww,t3_a86o1l,3,False,False,a86o1l,
316,We adopted this monster two weeks ago. His favourite things are food and pooping on the carpet. Meet Seamus,aww,t3_a87tar,6,False,False,a87tar,
317,My boy Lou loves his bow tie,aww,t3_a8asjh,1,False,False,a8asjh,
318,"She kept me company for a while, making sure I was okay as I reapplied silicone to my shower.",aww,t3_a8a9pu,2,False,False,a8a9pu,
319,My old pal ready for christmas !,aww,t3_a89mbp,0,False,False,a89mbp,
320,How I watch GMA,aww,t3_a89zfs,3,False,False,a89zfs,
321,😍,aww,t3_a87f77,5,False,False,a87f77,
322,"‘If I look cute, I get a chimkin treat. Must look cute’",aww,t3_a8as96,0,False,False,a8as96,
323,doin me a heckin relaxo fren,aww,t3_a88jaq,0,True,False,a88jaq,
324,Dexters baby photo,aww,t3_a8ary3,0,False,False,a8ary3,
325,Adopted this pretty girl five years ago. I still fall for those eyes everyday!,aww,t3_a88kvl,1,False,False,a88kvl,
326,"This is Sam , one blue and one green eye . Such a placid and cuddly boy in the house but is happy too take on foxes and win to keep the neighbourhood safe . The best cat I have ever known .",aww,t3_a8aeka,0,False,False,a8aeka,
327,My tuxedo loves his balcony sits in the morning.,aww,t3_a8885r,3,False,False,a8885r,
328,Meet my dog who has a constant mlem from an overbite!!,aww,t3_a89hnt,0,False,False,a89hnt,
329,"This is Archie, every day he looks at me like this",aww,t3_a88653,4,False,False,a88653,
330,"Meet Roxy! 15 y/o sweetie I saved from my job two years ago. She’s a quirky little cat, I wouldn’t have it any other way!",aww,t3_a8ad5o,7,False,False,a8ad5o,
331,This cat and her brother always come into my office :).,aww,t3_a8ad2c,2,False,False,a8ad2c,
332,Maudie had a nose job and now she can breathe,aww,t3_a88byg,2,False,False,a88byg,
333,Absolute unit of a lad at my local gas station,aww,t3_a84xlq,8,False,False,a84xlq,
334,Ringtail Possum (Pseudocheirus peregrinus) Joey,aww,t3_a89ged,1,False,False,a89ged,
335,"An old photo of my girl as a puppy, sweet from the very start❤️",aww,t3_a80xz9,4,False,False,a80xz9,
336,Zeus curling up to sleep 🐶,aww,t3_a8ap3j,0,False,False,a8ap3j,
337,My puppy!,aww,t3_a8aiib,0,False,False,a8aiib,
338,Dis ma doggo,aww,t3_a8ai2i,0,False,False,a8ai2i,
339,as a kitten we called her “Legs”... the name stuck.,aww,t3_a85fuo,5,False,False,a85fuo,
340,Meowy Christmas,aww,t3_a8aasw,0,False,False,a8aasw,
341,"Reddit, meet Isabelle!",aww,t3_a89uxk,1,False,False,a89uxk,
342,Meet Dirty. He is awake about 10% of the time.,aww,t3_a8b32u,1,False,False,a8b32u,
343,When you’re caught scheming against the humans. Just act natural and they won’t know what we’re up to.,aww,t3_a8auqy,0,False,False,a8auqy,
344,The twinkle in her eye this morning made me smile,aww,t3_a8atu2,0,False,False,a8atu2,
345,It’s sliding doggies day,aww,t3_a8ames,1,False,False,a8ames,
346,Wishing everyone some Happy Holidays!,aww,t3_a87jnb,1,False,False,a87jnb,
347,This good boye on a train in Scotland,aww,t3_a8aff3,0,False,False,a8aff3,
348,"Most beautiful lady in the world, Miss Phoebes, my 💓, and some days, quite literally, all that keeps me going (PTSD veteran)",aww,t3_a87i3u,8,False,False,a87i3u,
349,The coziest of cats.,aww,t3_a8a2tc,2,False,False,a8a2tc,
350,Majestic as f%•¥,aww,t3_a88xx4,3,False,False,a88xx4,
351,Always looking to see what she can jump at next,aww,t3_a8a2h9,1,False,False,a8a2h9,
352,Merry Catmas!,aww,t3_a89x4h,2,False,False,a89x4h,
353,he ear too big for he gotdang feet,aww,t3_a8aztq,0,False,False,a8aztq,
354,"8 years old, eyes that say so much...",aww,t3_a83r5w,8,False,False,a83r5w,
355,I’ll just rest my head here until you cave and let me on the couch,aww,t3_a89j04,0,False,False,a89j04,
356,Jojo is our newest fur baby. He likes wearing clothes,aww,t3_a8ayk2,1,False,False,a8ayk2,
357,Santa’s little helper,aww,t3_a8ajf8,0,False,False,a8ajf8,
358,My good boi,aww,t3_a88wp8,2,False,False,a88wp8,
359,this is spicy boi (she’s a girl),aww,t3_a8aidq,2,True,False,a8aidq,
360,This majestic animal preys on human hearts,aww,t3_a8ax8c,0,False,False,a8ax8c,
361,Time for night-night &amp; cuddles,aww,t3_a8awzv,1,True,False,a8awzv,
362,Too many zoomies with the laser pointer.,aww,t3_a8awym,0,False,False,a8awym,
363,Yes I love ice cubes why do u ask ?,aww,t3_a87g08,3,False,False,a87g08,
364,"This is Orpheus, just picked him up from the shelter!",aww,t3_a893qb,5,False,False,a893qb,
365,My catto enjoys sleeping upside down,aww,t3_a899uh,0,False,False,a899uh,
366,"“No dad, I don’t want to walk anymore!”",aww,t3_a89ooq,4,False,False,a89ooq,
367,French Cuddles,aww,t3_a89xwh,3,False,False,a89xwh,
368,Her name is Honey and she was cold.,aww,t3_a8amz5,1,False,False,a8amz5,
369,"After my bf leaves for work, this good girl takes his spot.",aww,t3_a8aujv,1,False,False,a8aujv,
370,These two little guys are learning fast.,aww,t3_a8b2bv,0,True,False,a8b2bv,
371,A Regal Beagle,aww,t3_a8a7x6,0,False,False,a8a7x6,
372,Cute husky doing cute husky thing.,aww,t3_a8b1yk,2,False,False,a8b1yk,
373,Today is this little burrito's 3rd birthday.,aww,t3_a88ybu,4,False,False,a88ybu,
374,One of my angels,aww,t3_a8asj7,1,False,False,a8asj7,
375,That little nose smush tells me it's nearly time for his lunchtime walk,aww,t3_a7x3cv,17,False,False,a7x3cv,
376,Nugget gets nervous in the car,aww,t3_a8acli,5,False,False,a8acli,
377,Our puppy chihuahua stole a waffle!,aww,t3_a88e03,7,False,False,a88e03,
378,Hide and Seek,aww,t3_a8a5hp,7,True,False,a8a5hp,
379,"All the text said was “Mom, I may have made a mistake.” I laughed til I cried. Merry Christmas Reddit.",aww,t3_a88gst,3,False,False,a88gst,
380,Pupper is submissive to show she’s ready to meet the newest member of the family.,aww,t3_a85zlx,3,False,False,a85zlx,
381,GF shows me how much my little cat and I are bonded when I fall asleep on the couch.,aww,t3_a87jtw,2,False,False,a87jtw,
382,Hay guys!,aww,t3_a87gn9,1,False,False,a87gn9,
383,Just relaxing!,aww,t3_a8aw47,5,False,False,a8aw47,
384,"So photogenic, even if he hasn't woken up yet",aww,t3_a8a2k3,2,False,False,a8a2k3,
385,"Merry Christmas, from us to you.",aww,t3_a89m97,3,False,False,a89m97,
386,Cooper visits our cats every day. Today he was a bit more Bond villain than usual.,aww,t3_a88fq2,0,False,False,a88fq2,
387,my baby sleeping next to me,aww,t3_a8a89y,3,False,False,a8a89y,
388,"Watching Fiancée's cat, she seems pretty happy at my gaming computer",aww,t3_a8a1xx,4,False,False,a8a1xx,
389,"Winter can be chilly, but this girl has found the (not so) secret heat source.",aww,t3_a89v3d,0,False,False,a89v3d,
390,My good boy and I went on a hike the other day,aww,t3_a89pbu,0,False,False,a89pbu,
391,But what he never finds out if he’s a dog or a cotton ball?!,aww,t3_a8adut,0,False,False,a8adut,
392,Chasing a dog zooming with a GoPro in its mouth.,aww,t3_a7z75l,20,True,False,a7z75l,
393,"He knows when you've been sleeping, he knows when you're awake.",aww,t3_a8adgj,1,False,False,a8adgj,
394,"Adopted this pupper last weekend, full of love and puppy energy. Everyone, meet Bailey!",aww,t3_a82syf,5,False,False,a82syf,
395,Bike ride with dad!,aww,t3_a89eju,1,False,False,a89eju,
396,My cat exploded into more cats and now they're eating her insides please help....,aww,t3_a84g6y,8,False,False,a84g6y,
397,Puppy Finds Out What Ice Cubes Are,aww,t3_a82vpi,9,True,False,a82vpi,
398,Just right,aww,t3_a89951,0,False,False,a89951,
399,Absolute unit of a lad at my local gas station,aww,t3_a8658q,3,False,False,a8658q,
400,So cute... TOO CUTE!!!,aww,t3_a8aoz7,1,False,False,a8aoz7,
401,Bugg spin,aww,t3_a8ay5a,0,True,False,a8ay5a,
402,Tiny paws 🐾,aww,t3_a8aojd,0,False,False,a8aojd,
403,Hef the cat is daydreaming,aww,t3_a8916y,2,False,False,a8916y,
404,Good morning,aww,t3_a89p0x,1,False,False,a89p0x,
405,what are you doing....??,aww,t3_a8a10o,2,False,False,a8a10o,
406,Benji is ready for the holidays,aww,t3_a8af36,1,False,False,a8af36,
407,"She's not allowed on the bed without permission, so she got herself as close as she could!",aww,t3_a8aeu7,0,False,False,a8aeu7,
408,She is very photogenic!,aww,t3_a8aejs,1,False,False,a8aejs,
409,This lady is such a bum she fell asleep watching TV,aww,t3_a89aqr,3,False,False,a89aqr,
410,"This is Misty , misty likes to get to close to things and sniff them.......She believes everything must be sniffed. I love her",aww,t3_a89jc0,3,False,False,a89jc0,
411,Statues,aww,t3_a8933w,2,False,False,a8933w,
412,Enjoying the sun,aww,t3_a89isw,0,False,False,a89isw,
413,Paint me like one of your French models,aww,t3_a82dw1,4,False,False,a82dw1,
414,boop,aww,t3_a85vqc,1,False,False,a85vqc,
415,Morning!,aww,t3_a8b3r8,1,False,False,a8b3r8,
416,The majestic Basil,aww,t3_a88gx2,1,False,False,a88gx2,
417,Can't get mad at this boy for stealing my frosted cookie off the counter when he gives me this face.,aww,t3_a869e1,7,False,False,a869e1,
418,going for a walk with dad,aww,t3_a7xc98,7,False,False,a7xc98,
419,Puppy learning to high-five,aww,t3_a82qw3,3,True,False,a82qw3,
420,"A little blurry, but he was the best reindeer ❤",aww,t3_a899xp,0,False,False,a899xp,
421,Chomp,aww,t3_a868ug,3,False,False,a868ug,
422,I found the pacifier...,aww,t3_a8a7yc,0,False,False,a8a7yc,
423,My girlfriends kitten named Chicken,aww,t3_a8aeq3,1,False,False,a8aeq3,
424,Hooked on that snow!,aww,t3_a8aekn,3,False,False,a8aekn,
425,The circle of life,aww,t3_a89cus,1,False,False,a89cus,
426,Someone got caught sniffing around the branches of our tree,aww,t3_a8989t,0,False,False,a8989t,
427,Echo with her little derpy eye enjoying the Sun,aww,t3_a8ady0,0,False,False,a8ady0,
428,Yuki and his favorite toy,aww,t3_a87i8r,0,False,False,a87i8r,
429,so cute panda!!!,aww,t3_a88c6l,2,False,False,a88c6l,
430,A Momma and her baby,aww,t3_a8876i,0,False,False,a8876i,
431,Chinchilla in a little sweater.,aww,t3_a7ys1s,20,False,False,a7ys1s,
432,"Mason is so cute, I want to pick him up and squeeze him.",aww,t3_a89xhm,0,False,False,a89xhm,
433,Choose your fighter,aww,t3_a89kkx,2,True,False,a89kkx,
434,First day in the new home. Exhausting.,aww,t3_a88mi3,1,False,False,a88mi3,
435,The coat was too small for my dog so I put it on my cat....this is her f**k you face.,aww,t3_a88yr3,1,False,False,a88yr3,
436,Rhino Cuddles,aww,t3_a835lw,10,False,False,a835lw,
437,"I’m out for a ski. This good boi swooshes by. Later duuuuuude Spotted in Mont-Tremblant, Quebec",aww,t3_a87zi1,3,False,False,a87zi1,
438,"This is Storm and she will be having her first Xmas with us, cant wait.",aww,t3_a895d7,1,False,False,a895d7,
439,What breed is this cat? ⤵️,aww,t3_a8at5p,4,False,False,a8at5p,
440,My best Christmas present,aww,t3_a87lek,0,False,False,a87lek,
441,Doodle gets a cone for Christmas.,aww,t3_a89ol1,3,False,False,a89ol1,
442,Doggo came with a shoe,aww,t3_a89562,6,False,False,a89562,
443,(Colourised) Blonde haired prisoner of Paw caught making an ambitious escape - Germany circa 1942,aww,t3_a8a25f,2,False,False,a8a25f,
444,Floof would like a pat please,aww,t3_a89uxh,2,False,False,a89uxh,
445,This is Napoleon. He likes boops.,aww,t3_a88hov,4,False,False,a88hov,
446,My dog is pretty excited about her early Christmas gift,aww,t3_a8b3vb,1,False,False,a8b3vb,
447,Me singing “could you be.. the most beautiful girl in the world” impresses her no end.,aww,t3_a88k7r,1,False,False,a88k7r,
448,Is it Xmis yet mom? How many more slepps mom?,aww,t3_a8a8vw,0,True,False,a8a8vw,
449,Came home to this today 😍 sweet little kittens.,aww,t3_a8arlx,1,False,False,a8arlx,
450,Plugged my cat into the Christmas tree,aww,t3_a85s55,7,False,False,a85s55,
451,"Doesn't snow often where i live, but safe to say she enjoys it every time.",aww,t3_a89n0h,0,False,False,a89n0h,
452,Felling Relaxed wow....,aww,t3_a8a0mf,0,False,False,a8a0mf,
453,Boop,aww,t3_a88gki,2,True,False,a88gki,
454,My rescue cat Pumpkin days after I got her,aww,t3_a897z1,1,False,False,a897z1,
455,Didn't realise I bought 3 reindeers from the shop.,aww,t3_a88pfp,1,False,False,a88pfp,
456,This lady outside of a restaurant posed so nicely for me,aww,t3_a8apk1,5,False,False,a8apk1,
457,We don’t deserve dogs,aww,t3_a81ez3,9,False,False,a81ez3,
458,Our big boy Bananas decided to help out with the Christmas hamper my step-mom was making this year!,aww,t3_a896ji,0,False,False,a896ji,
459,I did a holiday photo shoot with my dog. She has a flare for modeling.,aww,t3_a8azkk,1,False,False,a8azkk,
460,Vizlas are adorable,aww,t3_a89qnb,0,False,False,a89qnb,
461,Snoozing kitty,aww,t3_a88u2k,0,False,False,a88u2k,
462,This is KitKat our rescue cat doing a blep.,aww,t3_a86kfq,0,False,False,a86kfq,
463,Caught Obi messing with the tree. This is the look I get.,aww,t3_a8aymi,0,False,False,a8aymi,
464,Ninja pug,aww,t3_a88b7e,4,False,False,a88b7e,
465,"Another Orca picture, they are the cutest.",aww,t3_a8327p,14,False,False,a8327p,
466,Some cheese please.,aww,t3_a86zsr,0,False,False,a86zsr,
467,This beauty likes to hide,aww,t3_a894i5,0,False,False,a894i5,
468,My cat fell asleep while she was streching,aww,t3_a88j2z,1,False,False,a88j2z,
469,Harry Pupper,aww,t3_a8alpg,1,False,False,a8alpg,
470,Pet me please!,aww,t3_a89d9l,10,False,False,a89d9l,
471,She doesn't let me wash my hands...,aww,t3_a882iw,3,False,False,a882iw,
472,My mom took photos of our new puppy,aww,t3_a8abj3,2,False,False,a8abj3,
473,My cat was not very happy about her Christmas gift,aww,t3_a85qz6,9,False,False,a85qz6,
474,My dog makes amazing noises when he wants something!,aww,t3_a8al5v,1,False,False,a8al5v,
475,I just met my new family today,aww,t3_a85n8j,4,False,False,a85n8j,
476,my fluffy puppy fluff,aww,t3_a85kah,1,False,False,a85kah,
477,What happens when you cross a bear cub and a ferret?,aww,t3_a8717o,5,False,False,a8717o,
478,Meet King...Its his first Christmas!,aww,t3_a86dg3,3,False,False,a86dg3,
479,Just brought this little girl home from the shelter. Her name is Betty.,aww,t3_a87cfk,3,False,False,a87cfk,
480,Mochi has decided enough video games have been played and she demands to be pet,aww,t3_a881bd,4,False,False,a881bd,
481,The epitome of comfort,aww,t3_a88dxy,0,False,False,a88dxy,
482,Boop,aww,t3_a8au19,0,False,False,a8au19,
483,My handsome boye and his holiday tie wishes you the best Christmas ever!,aww,t3_a85jvu,5,False,False,a85jvu,
484,The difference between my cats when driving,aww,t3_a887dm,4,False,False,a887dm,
485,Tis the season.,aww,t3_a88cwu,0,False,False,a88cwu,
486,That used to be my bed..,aww,t3_a88t2m,2,False,False,a88t2m,
487,All the pets in one picture.,aww,t3_a8as0k,2,False,False,a8as0k,
488,"Reddit, meet Pepper. He likes to look sharp.",aww,t3_a8arx9,1,False,False,a8arx9,
489,Meet Buddy!,aww,t3_a88ezk,4,False,False,a88ezk,
490,"There are many dogs, but this one’s mine",aww,t3_a873rr,1,False,False,a873rr,
491,Black void seems to be a little sleepy...,aww,t3_a89e3p,0,False,False,a89e3p,
492,Roxie chillin under blankets,aww,t3_a8afvd,0,False,False,a8afvd,
493,This dog on a swing.,aww,t3_a8b3dv,0,True,False,a8b3dv,
494,These kids never thought they’d have a dog again. Pure joy!,aww,t3_a85vxn,6,True,False,a85vxn,
495,World's smallest private airplane,aww,t3_a88v8q,5,False,False,a88v8q,
496,Cat bath 🐱,aww,t3_a8433b,8,True,False,a8433b,
497,My kind of threesome (not OC),aww,t3_a7vzrp,28,True,False,a7vzrp,
498,Husky grooming,aww,t3_a8aogz,2,False,False,a8aogz,
499,"Hoping everyone is having stress free holidays, from Echo!",aww,t3_a89o30,0,False,False,a89o30,
500,Toe beans and a fierce yawn,aww,t3_a8a3wy,0,False,False,a8a3wy,
501,Today I have seen the cutest laugh in my life 😊,aww,t3_a8a3uc,9,False,False,a8a3uc,
502,Merry Christmas!! (She’s only being cute bc I bribed her with treats),aww,t3_a8795v,1,False,False,a8795v,
503,Learning how to be a model- Kepler the 1-yr old goldendoodle,aww,t3_a8azm9,0,False,False,a8azm9,
504,"Two seperate dogs, Three years apart. Makin that bread. Janie on the left, Bitsy on the right",aww,t3_a8ayzp,1,False,False,a8ayzp,
505,Noodle is waiting for Santa Claws,aww,t3_a85rng,3,False,False,a85rng,
506,He’s ‘all ears’ to what you’ve got to say!,aww,t3_a8abc3,0,False,False,a8abc3,
507,This kitten getting into bed with their favorite toy,aww,t3_a87bkz,4,False,False,a87bkz,
508,Looks like somebody got comfortable.,aww,t3_a8a1ix,2,False,False,a8a1ix,
509,I feel like I just interrupted an important business meeting..,aww,t3_a88o4b,5,True,False,a88o4b,
510,I don't think he likes sharing his bed.,aww,t3_a8axm4,0,False,False,a8axm4,
511,Gotta stay warm for winter!,aww,t3_a8akxc,1,False,False,a8akxc,
512,Everytime I use my phone he comes up close and sniffs it . He's a little weird,aww,t3_a86ugr,6,False,False,a86ugr,
513,I told him I'd show the internet his tail. He was unimpressed.,aww,t3_a89koq,0,False,False,a89koq,
514,New job: kitty's bed,aww,t3_a8a05a,1,False,False,a8a05a,
515,"""As We Were Flying on a Rocket"" 1961 children's book illustration, from Soviet Russia, art by V. Gortinsky",aww,t3_a8ajwj,0,False,False,a8ajwj,
516,SO CUUUTE 😍😍😍😍,aww,t3_a8774m,1,False,False,a8774m,
517,Ha! You’re a hooman! Me a pupper.. wanna throw somethin?,aww,t3_a86d0u,0,False,False,a86d0u,
518,My dogo,aww,t3_a89idu,2,False,False,a89idu,
519,Reddit meet Harley the Olde English Bulldogge,aww,t3_a87s9r,0,False,False,a87s9r,
520,What a cute turtle.,aww,t3_a88ata,1,False,False,a88ata,
521,My dog accidentally swallowed a whole bottle of cute pills.,aww,t3_a86yt9,4,False,False,a86yt9,
522,Rhea had started to limp on our hike so I carried her the last few kilometres,aww,t3_a7ygo6,19,False,False,a7ygo6,
523,Its that time of year again,aww,t3_a89hkj,1,False,False,a89hkj,
524,"Hey Reddit, I’m Churros",aww,t3_a86kwz,4,False,False,a86kwz,
525,My friend rescued this special pupper the other day,aww,t3_a8603s,1,False,False,a8603s,
526,Mother knows best,aww,t3_a84sa6,5,False,False,a84sa6,
527,“Is that... is that food in your hands?” 😂,aww,t3_a85zr5,2,False,False,a85zr5,
528,Beware the smol stink kitties,aww,t3_a86810,3,False,False,a86810,
529,Happy lil Xmas good boy named Jasper that I met today,aww,t3_a88k0m,0,False,False,a88k0m,
530,My sister’s dog’s face is my exact reaction to suddenly being woken up.,aww,t3_a88vls,6,False,False,a88vls,
531,"Favorite cat of the campus. He has sight problems and bumps into tables while walking around in the cafeteria, but still loves being there because of the food! (He's a little chubby, but we don't really talk about that)",aww,t3_a808vq,6,False,False,a808vq,
532,My cat Loki laying in the only spot the sun was hitting the living room. 😊 Instagram is: Loki_Snoki,aww,t3_a88ve0,0,False,False,a88ve0,
533,Mom cat grabbing kitten back to the den,aww,t3_a7z8pj,24,True,False,a7z8pj,
534,My lil man,aww,t3_a8apzt,0,False,False,a8apzt,
535,Go out or stay in bed?,aww,t3_a88yit,1,False,False,a88yit,
536,My chihuahuas were not amused by santa,aww,t3_a8b3jl,0,False,False,a8b3jl,
537,"The ""NO MORE X"" face",aww,t3_a87hoz,1,False,False,a87hoz,
538,Who’s your best friend?,aww,t3_a86r43,1,True,False,a86r43,
539,Opening my eyes to this good boy,aww,t3_a87vzn,0,False,False,a87vzn,
540,She has crazy eyes but hasn't hurt me yet!,aww,t3_a88kgz,3,True,False,a88kgz,
541,Cat-snek forced to wear sombrero,aww,t3_a86y2v,2,False,False,a86y2v,
542,We adopted the cat on the right 5 days ago. Best decision we ever made.,aww,t3_a84wde,4,False,False,a84wde,
543,She’s in heat and she’s only allowed inside if she’s wearing a nappy. So I got her some cute washable ones.,aww,t3_a88wvh,5,False,False,a88wvh,
544,"I invited a friend over to knit and watch TV. Ten minutes in, I see this.",aww,t3_a85rfs,6,False,False,a85rfs,
545,Isn’t he so cute,aww,t3_a85h3i,1,False,False,a85h3i,
546,This is Hank. He likes to curl up in his bed in front of the fire.,aww,t3_a88nox,1,False,False,a88nox,
547,Golden pupper is still a little too clumsy...,aww,t3_a847ov,4,True,False,a847ov,
548,Cooper thinks santa is A-OK,aww,t3_a89z07,0,False,False,a89z07,
549,"""Son, stop, you can't sing""",aww,t3_a8azh1,0,False,False,a8azh1,
550,My dog looks tired of my shit.,aww,t3_a86qb0,7,False,False,a86qb0,
551,All tuckered out.,aww,t3_a84p7i,4,False,False,a84p7i,
552,Scratches please.,aww,t3_a8a85k,0,False,False,a8a85k,
553,When he want snacks.,aww,t3_a89hgk,2,False,False,a89hgk,
554,"This weather makes me sleepy. It's too hot human, do something!",aww,t3_a881a4,0,False,False,a881a4,
555,He might be odd but I love him unconditionally. He will always be my best friend.,aww,t3_a86qxj,0,False,False,a86qxj,
556,My daughter has been begging us for a kitten for months. We’ve told her in no uncertain terms we are NOT getting a kitten. This is what awaits her on Christmas morning..,aww,t3_a7szmu,2661,False,False,a7szmu,
557,My cat doesn’t like trespassers on our roof...,aww,t3_a893v8,1,True,False,a893v8,
558,My 11 year old golden puppy.,aww,t3_a853or,5,False,False,a853or,
559,Mack the Australian Cattle Dog,aww,t3_a87use,1,False,False,a87use,
560,Less than a year,aww,t3_a862yb,1,False,False,a862yb,
561,Ooops,aww,t3_a87eej,4,True,False,a87eej,
562,She loves to have her chin scratched &lt;3,aww,t3_a874nd,1,False,False,a874nd,
563,About one year and three months ago he was found on the streets and the animal shelter prayed he would survive the night. Fast forward and now he loves belly rubs and snuggles and is a healthy boy.,aww,t3_a86t7f,0,False,False,a86t7f,
564,I think she’s trying to look tough,aww,t3_a888nz,0,False,False,a888nz,
565,Just chilling,aww,t3_a89uod,1,False,False,a89uod,
566,"She ran around the house like a maniac for twenty minutes after this, the zoomies always start in the eyes",aww,t3_a85x9w,2,False,False,a85x9w,
567,"Meet miss kitty🐱We found her a month ago &amp; she was starving &amp; so skinny, but SO friendly. She ran up to us &amp; kept coming back...so we got a bed &amp; food for her to see if she’d stay. Of course she did &amp; a few days later we decided to keep her,&amp; brought her to the vet. Best Christmas Present ever!☃️🎁",aww,t3_a878q3,2,False,False,a878q3,
568,&gt;It's Christmas time? Already?,aww,t3_a887ui,0,False,False,a887ui,
569,My present is wrapped for Christmas.,aww,t3_a88n9h,0,False,False,a88n9h,
570,"""Time for night-night!""",aww,t3_a87cxs,1,False,False,a87cxs,
571,When your cat wants to help with wrapping Christmas gifts,aww,t3_a88w6a,0,False,False,a88w6a,
572,Merry Christmas from Brodythesilverlab,aww,t3_a85uot,3,False,False,a85uot,
573,"as requested, video of my happy kitten purring w her mouth open",aww,t3_a83pj1,4,True,False,a83pj1,
574,Just wants a Boop,aww,t3_a87073,2,False,False,a87073,
575,My mom is Amazing!,aww,t3_a7tm1q,220,False,False,a7tm1q,
576,We lost the last of our senior dogs this spring and tonight we brought home our new baby!,aww,t3_a8612g,5,False,False,a8612g,
577,This is how they sleep,aww,t3_a86law,0,False,False,a86law,
578,We all know which good girl got the most presents...,aww,t3_a85evn,3,False,False,a85evn,
579,Cute Sheep from New Zealand,aww,t3_a84h8e,4,False,False,a84h8e,
580,"The homeowner said that the buck shows up everyday, so they gave him a bed too.",aww,t3_a8a12t,0,False,False,a8a12t,
581,Naughty dog,aww,t3_a8aq92,1,False,False,a8aq92,
582,Mbya güarani toddler kiss a capibara,aww,t3_a85zle,5,False,False,a85zle,
583,Professor brings his dog to the classroom to calm the students before a big exam.,aww,t3_a7y2yp,21,False,False,a7y2yp,
584,My kitten Yuna taking a Christmas nap,aww,t3_a89zw9,0,True,False,a89zw9,
585,Lucy is very vocal,aww,t3_a88jdq,1,True,False,a88jdq,
586,Baby Meerkat,aww,t3_a85om8,4,False,False,a85om8,
587,"Meet my two newest family members, Bean &amp; Kali!",aww,t3_a85azp,1,False,False,a85azp,
588,It's fluffier than the stuffed animal..,aww,t3_a7y5li,7,False,False,a7y5li,
589,"Throwback picture to the cutest of the cute puppies, my gal Millie. Here she is just five minutes after I was given her.",aww,t3_a8an3i,0,False,False,a8an3i,
590,RHCP Flea and his doggo,aww,t3_a8b3jq,0,False,False,a8b3jq,
591,The most interesting cat in the world,aww,t3_a852sd,2,False,False,a852sd,
592,Say hello to Ronon. Our new 12 week old rescue.,aww,t3_a85zhv,1,False,False,a85zhv,
593,Blu loves chilling in the early morning sun,aww,t3_a8b1sb,3,False,False,a8b1sb,
594,say meow to everyone!!,aww,t3_a87e3i,5,False,False,a87e3i,
595,"Reporting for duty, Santa!",aww,t3_a8b0qm,1,False,False,a8b0qm,
596,My cat,aww,t3_a88v4o,1,False,False,a88v4o,
597,Need attention NOW,aww,t3_a88u9h,1,True,False,a88u9h,
598,Idk what to say,aww,t3_a8azbg,0,False,False,a8azbg,
599,Happy Gotcha Day to my new best friend Aurora,aww,t3_a834sk,6,False,False,a834sk,
600,Best buds for life,aww,t3_a83ni3,4,False,False,a83ni3,
601,This floof is ready for Christmas,aww,t3_a86696,2,False,False,a86696,
