,title,subreddit,name,num_comments,is_video,pinned,id,selftext
587,This tiny baby skunk,aww,t3_a9r7o4,20,False,False,a9r7o4,
588,"While I was freezing my ass off in Maywood, NJ this past week, my fur baby was doing this at Sage Ridge Ranch in De Luz, CA",aww,t3_aa1jaf,1,False,False,aa1jaf,
589,New luggage or cat hammock?,aww,t3_aa2fjw,1,False,False,aa2fjw,
590,My new puppy getting distracted by her wagging tail 😭😍,aww,t3_a9ndih,82,True,False,a9ndih,
591,3 years on and she still loves her favourite toy!,aww,t3_a9z7d1,0,False,False,a9z7d1,
592,"My Dakota, all tucked in",aww,t3_aa3ae3,0,False,False,aa3ae3,
593,"all cats are confused what type of fish is this ,,,,,they are discussion each other!!",aww,t3_aa1oms,4,False,False,aa1oms,
594,"sun's out, tongues out",aww,t3_aa0682,2,False,False,aa0682,
595,Wish I was half as photogenic as my best friend.,aww,t3_aa24e1,0,False,False,aa24e1,
596,Bongo loves memory foam.,aww,t3_aa19t7,1,False,False,aa19t7,
597,Absolute Loving Style!!!,aww,t3_aa1nqq,2,False,False,aa1nqq,
598,She's very happy to be celebrating the holidays with friends and family,aww,t3_aa096f,2,False,False,aa096f,
599,My dog was just neutered.,aww,t3_aa2m3m,1,False,False,aa2m3m,
600,"Got to spend another Christmas with this 16 year old boy, Whiskey",aww,t3_a9na8k,123,True,False,a9na8k,
601,This is Nola. She’s been my best buddy for 9 years now and I’m so glad she came into my life.,aww,t3_aa37k5,4,False,False,aa37k5,
602,"""I'm the only present you need, human.""",aww,t3_aa22v7,0,False,False,aa22v7,
603,A toucan Friend! He let me close to take a nice photo of him. (OC),aww,t3_a9zk5v,0,False,False,a9zk5v,
604,My cat is busy conducting groundbreaking research.,aww,t3_aa1skk,0,True,False,aa1skk,
605,Slide in yo dms like!,aww,t3_aa0fp1,1,True,False,aa0fp1,
606,Sometimes it's hard to believe that I found such an amazingly beautiful and sweet furbaby!,aww,t3_aa1ksg,5,False,False,aa1ksg,
607,Meet Link :D,aww,t3_a9z7s3,0,False,False,a9z7s3,
608,A little bit cold,aww,t3_aa1s01,0,False,False,aa1s01,
609,The Beggar (a poem for dogs),aww,t3_aa0zkb,2,False,False,aa0zkb,
610,"My little prince, Angus. (not pictured: his twin sis Angie, busy burrowing)",aww,t3_aa33qy,0,False,False,aa33qy,
611,"After coming back from a tiring work day, this actually made me smile and restored my faith in humanity.",aww,t3_a9z8j4,1,False,False,a9z8j4,
612,My baby is ready for next year,aww,t3_aa1q2i,0,False,False,aa1q2i,
613,My little buddy needing some morning attention.,aww,t3_aa1avw,2,False,False,aa1avw,
614,Here’s my goofy husky.,aww,t3_a9zkki,0,False,False,a9zkki,
615,My snowshoe girl Keo. Definitely the prettiest cat I’ve had...,aww,t3_a9za8z,2,False,False,a9za8z,
616,I looove snow,aww,t3_a9oqg9,18,True,False,a9oqg9,
617,It feels like my little buddy belongs here,aww,t3_aa2rg2,0,False,False,aa2rg2,
618,I can't wait to see her again.,aww,t3_aa1xry,1,False,False,aa1xry,
619,Someone loves his Christmas present...,aww,t3_aa1xnd,0,False,False,aa1xnd,
620,My boy's first christmas since we found him. My sister took the pic at the perfect time.,aww,t3_a9qvxu,9,False,False,a9qvxu,
621,First Christmas with our first puppy! Meet Danny!,aww,t3_a9z6zd,2,False,False,a9z6zd,
622,All tired out from opening presents,aww,t3_aa0g94,0,False,False,aa0g94,
623,A nice pupper rests.,aww,t3_aa2pgl,1,True,False,aa2pgl,
624,That post Christmas cat nip toy high...,aww,t3_a9zotx,1,False,False,a9zotx,
625,Curiosity,aww,t3_aa18e5,4,True,False,aa18e5,
626,Howdy.,aww,t3_aa1fg6,0,False,False,aa1fg6,
627,Munchkin cats are adorable.,aww,t3_aa02dw,2,True,False,aa02dw,
628,Our kitty was hiding under the tree during Christmas,aww,t3_aa02di,0,False,False,aa02di,
629,"""It wasn't a dream...it was real!""",aww,t3_a9zfih,0,False,False,a9zfih,
630,Let me tell you about my best friend,aww,t3_aa1mex,0,False,False,aa1mex,
631,😉,aww,t3_a9t3xv,13,False,False,a9t3xv,
632,caught these sisters in a moment of peace,aww,t3_a9o4ms,10,False,False,a9o4ms,
633,I think this belongs here too.,aww,t3_aa2dev,2,False,False,aa2dev,
634,"After a few months, Rei has decided that she does not like having a little sister.",aww,t3_aa23pt,1,False,False,aa23pt,
635,What's nesxtss?,aww,t3_aa3bvv,2,False,False,aa3bvv,
636,Dishwasher 4.0,aww,t3_aa2nc5,0,True,False,aa2nc5,
637,My 16 year old baby,aww,t3_aa16fh,0,False,False,aa16fh,
638,My sweet 15 year old girl,aww,t3_a9s58d,15,False,False,a9s58d,
639,"it was rain day ,,,,my lovely dog kiss a baby !!",aww,t3_aa2bez,0,False,False,aa2bez,
640,Bone fit for the King,aww,t3_aa3a69,2,False,False,aa3a69,
641,"This very skinny girl was in the kitchen this morning, I guess we have an other cat now",aww,t3_aa3a3s,0,False,False,aa3a3s,
642,Im thinking of adopting this beauty...,aww,t3_a9xtbh,6,False,False,a9xtbh,
643,Help! My cats hate each other!,aww,t3_aa39kb,0,False,False,aa39kb,
644,I cried yesterday. My husband had these special made to look just like my babies.,aww,t3_aa0gxi,0,False,False,aa0gxi,
645,The happiest doggo ever,aww,t3_a9wl46,8,False,False,a9wl46,
646,Thirsty kitties,aww,t3_a9wxkw,3,False,False,a9wxkw,
647,Velvet wrinkles!,aww,t3_a9px8t,10,False,False,a9px8t,
648,It’s the most wonderful time for a beer!,aww,t3_aa1hu9,0,False,False,aa1hu9,
649,Swampy getting ready for his nap,aww,t3_aa382k,0,False,False,aa382k,
650,"Even though you bark 24/7 and refuse to eat dog food, you are still the cutest mf I’ve ever met",aww,t3_aa2v6m,0,False,False,aa2v6m,
651,Comfort !,aww,t3_aa28mh,0,True,False,aa28mh,
652,"Sadie’s exhausted on the road trip back home after a great first Christmas with her cousins, both furry and human ones.",aww,t3_aa0kiw,0,False,False,aa0kiw,
653,Where to?,aww,t3_aa37n0,0,False,False,aa37n0,
654,Post walk mood,aww,t3_aa1ya8,0,False,False,aa1ya8,
655,Hunley the fuzzy boi,aww,t3_aa1p60,1,False,False,aa1p60,
656,The best present,aww,t3_aa09o2,0,False,False,aa09o2,
657,They’re gonna drive away!,aww,t3_aa36kl,0,False,False,aa36kl,
658,Came home and saw my cat looking at me like this. It lasted for 3 minutes.,aww,t3_a9xnij,7,False,False,a9xnij,
659,My mom found a card that looks just like her Kirby,aww,t3_a9qdx5,4,False,False,a9qdx5,
660,Scratches with his favourite person,aww,t3_aa1fnq,0,False,False,aa1fnq,
661,Curious cat,aww,t3_aa0nu7,4,True,False,aa0nu7,
662,Catwatch.,aww,t3_aa0cm0,0,False,False,aa0cm0,
663,Killer birb loves laser,aww,t3_aa07e6,1,True,False,aa07e6,
664,First time at the vet. He look tells me everything,aww,t3_aa2fhl,4,False,False,aa2fhl,
665,My little Tiger.,aww,t3_aa1lpn,0,False,False,aa1lpn,
666,Sunny Mlem,aww,t3_aa33k4,1,False,False,aa33k4,
667,"My friend decorated her dog, Lady, for Christmas",aww,t3_aa1cz2,0,False,False,aa1cz2,
668,My guys were united by their hatred of squirrels,aww,t3_aa0rwa,1,False,False,aa0rwa,
669,Our kids on Christmas morning,aww,t3_aa0y30,7,False,False,aa0y30,
670,A newborn sea turtle.,aww,t3_a9pyok,26,False,False,a9pyok,
671,Pet-sitting my friend’s two little beagles. Sweet story in comments.,aww,t3_aa32wa,6,False,False,aa32wa,
672,Yup... you!,aww,t3_aa0qz6,2,False,False,aa0qz6,
673,Mesmerized by the bird feeder..,aww,t3_a9zt8h,2,False,False,a9zt8h,
674,"My little tripawd, I’m just so obsessed with her it’s sickening :)",aww,t3_aa23a9,0,False,False,aa23a9,
675,He was not impressed with his new raincoat and antlers,aww,t3_a9zwwe,0,False,False,a9zwwe,
676,Willow Greets and Approves of Morning Scratchies,aww,t3_aa0wz6,0,True,False,aa0wz6,
677,My foster dog and my pet sitting doggo! Meet Chesper and Prince!,aww,t3_aa1svi,0,False,False,aa1svi,
678,My little pooper dooper Hugo beans,aww,t3_aa2d76,0,False,False,aa2d76,
679,Instructions were unclear,aww,t3_a9zp34,0,False,False,a9zp34,
680,Having kids is tough when all you want to do is sleep.,aww,t3_aa09is,1,False,False,aa09is,
681,Soaking up the AZ sun,aww,t3_aa2ok1,1,False,False,aa2ok1,
682,"a baby zonkey, a zebra and a donkey hybrid.",aww,t3_a9yhmu,0,False,False,a9yhmu,
683,No Mila my finger isn’t your lunch!! 😍,aww,t3_aa0w6h,0,False,False,aa0w6h,
684,A late Christmas Pug,aww,t3_aa2oa7,0,False,False,aa2oa7,
685,My Mom painted my puppy. Pic was taken when she was 7 weeks old.,aww,t3_a9zksr,2,False,False,a9zksr,
686,A Pug Dogs!!!,aww,t3_aa218g,0,False,False,aa218g,
687,"I am trying to get some sleep, but my mom won't let me.",aww,t3_a9zr48,1,True,False,a9zr48,
688,This is Han. He is my fluffy lil dude.,aww,t3_aa03dk,1,False,False,aa03dk,
689,Rita is 10 years young and she’s the best rescue dog ever (except for yours!),aww,t3_a9z64d,5,False,False,a9z64d,
690,Boom(er) Box,aww,t3_aa2arh,1,False,False,aa2arh,
691,"Waiting for that booty floof, but still the cutest sploot.",aww,t3_a9zjvi,1,False,False,a9zjvi,
692,"If it fits, it sits.",aww,t3_aa118x,0,False,False,aa118x,
693,"If i were you, id wanna be me too.",aww,t3_aa2acg,0,False,False,aa2acg,
694,"Meet the newest member of our fam, Kevin!",aww,t3_aa0hw4,3,False,False,aa0hw4,
695,"In the morning, Wally insists on being in the bathroom with me when I shower. So I rotated the hand towl holder so he has a place to sit. He loves the steam from the shower and sings until I get out of the shower. I think it fits him perfectly.",aww,t3_a9mpcx,241,False,False,a9mpcx,
696,Enjoying her scritches,aww,t3_aa10nn,1,False,False,aa10nn,
697,A turtle came and said hello. (OC),aww,t3_aa17xi,1,False,False,aa17xi,
698,Testing the brightness of the Day,aww,t3_aa1oxl,0,False,False,aa1oxl,
699,Captain mittens!,aww,t3_a9xrwi,2,False,False,a9xrwi,
700,Copy Cat,aww,t3_aa28sk,0,False,False,aa28sk,
701,Dash the Deer ❄️,aww,t3_aa286m,3,False,False,aa286m,
702,Awwww,aww,t3_aa282z,0,False,False,aa282z,
703,"My grandparent‘s neighbor‘s cat, Garfield. He‘s 15 years old and comes by my grandparents‘ house everyday at noon to collect his daily treat. Some days he’s very busy but some days he stays to be pet and chat a little.",aww,t3_a9sfcw,17,False,False,a9sfcw,
704,Put me in coach,aww,t3_aa1dws,0,False,False,aa1dws,
705,This candy sushi platter.,aww,t3_aa3aen,0,False,False,aa3aen,
706,Visted my grandma yesterday. Her dog (Duke) fell in love with my SO.,aww,t3_aa3adc,2,False,False,aa3adc,
707,"M girl sasha, pouts when the vacuums out. This is her unimpressed face",aww,t3_aa3a8a,0,False,False,aa3a8a,
708,lovely rhino called dino❤️,aww,t3_aa0kfg,1,True,False,aa0kfg,
709,Hello hooman,aww,t3_a9ykh1,1,False,False,a9ykh1,
710,My boy is always ready to play,aww,t3_aa1528,0,False,False,aa1528,
711,"Someone destroyed both her squeaky toys she got two days ago. Reddit, meet Luna",aww,t3_a9zrg9,1,False,False,a9zrg9,
712,My new best friend Bowie,aww,t3_aa1d0y,2,False,False,aa1d0y,
713,My little friend.,aww,t3_a9zv4o,0,False,False,a9zv4o,
714,A small place I made for the stray cat I rescued 2 days a go,aww,t3_a9wkt3,4,False,False,a9wkt3,
715,*Wink*,aww,t3_aa1beh,0,False,False,aa1beh,
716,First time being in the car I think she’s interested.,aww,t3_aa2gon,0,False,False,aa2gon,
717,Just look at this squishy lil face 😻,aww,t3_aa0il2,0,False,False,aa0il2,
718,I’ve been dog sitting and this GOODEST GIRL protected me from the neighborhood menace of a chihuahua.,aww,t3_aa07bo,0,False,False,aa07bo,
719,She does this every time she wants attention. It always works.,aww,t3_aa06wc,0,False,False,aa06wc,
720,Tilly Got a Camouflage Blanket For Christmas,aww,t3_aa1j25,2,False,False,aa1j25,
721,Mah heart. 💖 You saw her in the Netflix picture.. Reddit meet Iris.,aww,t3_a9zp2a,0,False,False,a9zp2a,
722,Just a happy golden pupper wearing his bowtie...,aww,t3_a9ydny,0,False,False,a9ydny,
723,The princess Tuna has had a long 2 days of first time road tripping and dodging sticky cousins. Well deserved naps.,aww,t3_aa067r,0,False,False,aa067r,
724,Cat.exe has stopped working,aww,t3_aa0u3s,0,False,False,aa0u3s,
725,My in-laws dog Lady. Her name definitely fits her personality; she’s such a sweet dog.,aww,t3_aa35vq,0,False,False,aa35vq,
726,No more christmas😁,aww,t3_aa00pj,0,False,False,aa00pj,
727,"Hi, my name is Marshall, and I'm a Christmas Smush",aww,t3_a9ytml,0,False,False,a9ytml,
728,This is my man Charlie crashing a photoshoot but actually making it 1000% better.,aww,t3_aa1hor,4,False,False,aa1hor,
729,Today is this nuggets first birthday,aww,t3_aa35eq,0,False,False,aa35eq,
730,"My little Chihuahua/papillon mix pup, is hard of hearing but his sense of smell is amazing. He was snoring!!",aww,t3_a9zzuy,0,True,False,a9zzuy,
731,Wiggum is adjusting to his new home.,aww,t3_aa0zxa,2,False,False,aa0zxa,
732,Wonky eared siamese,aww,t3_aa0ldu,0,False,False,aa0ldu,
733,Never too big to be held like a baby,aww,t3_a9vok8,6,False,False,a9vok8,
734,nice day with a beautiful zebra,aww,t3_aa0z16,12,False,False,aa0z16,
735,"I should probably be doing something ""productive,"" but I can't force myself to get up.",aww,t3_aa1pjj,1,False,False,aa1pjj,
736,Classic.,aww,t3_aa0yok,1,False,False,aa0yok,
737,"Muffin, look at the camera.",aww,t3_aa08ie,0,False,False,aa08ie,
738,My buddy Chuggz loves to hike - here on top of Engineer Mtn north of Durango CO,aww,t3_aa0qzj,0,False,False,aa0qzj,
739,"When he has had food, and still wants that lovin’",aww,t3_aa3377,0,False,False,aa3377,
740,cuterrrrrr,aww,t3_a9ynkv,1,False,False,a9ynkv,
741,Stranger view ;),aww,t3_aa2olc,0,False,False,aa2olc,
742,Purr engine: close up,aww,t3_aa07wk,3,True,False,aa07wk,
743,Merry Corgmas!,aww,t3_a9z8fh,0,False,False,a9z8fh,
744,My mom went hiking and met these guys.,aww,t3_a9ytio,2,True,False,a9ytio,
745,Dad and his new dog!!,aww,t3_a9zp82,0,False,False,a9zp82,
746,"""Oh, hey there! Can I have some?""",aww,t3_aa0290,3,False,False,aa0290,
747,cute corgi puppies,aww,t3_aa025c,2,False,False,aa025c,
748,Please let meowt,aww,t3_aa0csn,0,False,False,aa0csn,
749,"If i were you, id wanna be me too.",aww,t3_aa2a44,0,False,False,aa2a44,
750,My buddy's dog never misses a meal! Strong boi.,aww,t3_aa14se,2,False,False,aa14se,
751,"I love Albert SO much, this is his look 25/8",aww,t3_a9wyjk,5,False,False,a9wyjk,
752,"No matter how you're feeling, a little dog gonna love you.",aww,t3_a9tnpj,9,False,False,a9tnpj,
753,Bill Murray will always be my little superman.,aww,t3_a9zh3f,2,False,False,a9zh3f,
754,"My beautiful chow labrador mix, Smokey.",aww,t3_a9zwrp,2,False,False,a9zwrp,
755,Two Moods,aww,t3_aa1409,0,False,False,aa1409,
756,Winter lap nap time,aww,t3_aa30yd,0,False,False,aa30yd,
757,She (left) looks so small next to him (right) even though they’re the same age.,aww,t3_aa0bvg,0,False,False,aa0bvg,
758,Otselot )),aww,t3_a9zk6q,2,False,False,a9zk6q,
759,"My mom's 90 lb bundle of dopey love, Zena",aww,t3_a9zjr7,0,False,False,a9zjr7,
760,Wake me up when it's the New Year..,aww,t3_a9zvn7,1,False,False,a9zvn7,
761,Just a little fuzz ball,aww,t3_aa0nrx,1,False,False,aa0nrx,
762,My doggy with a giant bone,aww,t3_a9zfpz,2,False,False,a9zfpz,
763,Apparently my dog knows when we talk about her.,aww,t3_aa1v9k,0,False,False,aa1v9k,
764,Little kitten relaxing,aww,t3_aa09x4,0,True,False,aa09x4,
765,Weirdest looking Christmas tree I’ve ever seen,aww,t3_a9xhx0,5,False,False,a9xhx0,
766,Otis figured out the couch,aww,t3_a9zz6l,0,False,False,a9zz6l,
767,My work can wait.,aww,t3_aa0404,0,False,False,aa0404,
768,Little baby Ghibli mlem,aww,t3_a9zi1c,1,False,False,a9zi1c,
769,Hugs and kisses,aww,t3_aa1u07,0,True,False,aa1u07,
770,Messito the gecko on a baton,aww,t3_aa0s0g,2,False,False,aa0s0g,
771,She's had a busy few days.,aww,t3_aa0jz7,0,False,False,aa0jz7,
772,Kittens are truly the cutest,aww,t3_a9w883,7,True,False,a9w883,
773,A picture of my moms kitten from 1987,aww,t3_a9xuiq,1,False,False,a9xuiq,
774,My sweet boys Blue and Sugar,aww,t3_aa3chc,2,False,False,aa3chc,
775,My Gf's cute cats just watching us. They're called Coco (front) and Chanel (back).,aww,t3_a9xgyb,5,False,False,a9xgyb,
776,This winter bird,aww,t3_aa2glx,1,False,False,aa2glx,
777,Post dinner ride home,aww,t3_a9vem5,4,False,False,a9vem5,
778,Crazy times without the snow... :C,aww,t3_aa3bfe,1,True,False,aa3bfe,
779,Brian 1 - Carrot 0,aww,t3_aa3bh2,1,False,False,aa3bh2,
780,After celebrating Christmas all night she got some time to sleep peacefully,aww,t3_aa16g9,0,False,False,aa16g9,
781,A Proud Father Goal,aww,t3_a9wlui,2,False,False,a9wlui,
782,"Slow motion making my cat, Murphy, look like a complete badass",aww,t3_aa3arj,2,False,False,aa3arj,
783,"Reddit, meet the good girl that finally stole my mom's heart!",aww,t3_a9t2sv,8,True,False,a9t2sv,
784,I love him,aww,t3_a9ypkv,4,False,False,a9ypkv,
785,Happy Birthday Pug Puppies 🎉🎈🎉🎈🎁🎁,aww,t3_aa1p4k,1,False,False,aa1p4k,
786,Aldi have a special on at the moment,aww,t3_a9zzer,5,False,False,a9zzer,
787,Awww,aww,t3_aa04kp,0,False,False,aa04kp,
788,"Just hanging out, merry Christmas!",aww,t3_a9y6ml,0,False,False,a9y6ml,
789,Pupper enjoys day by the pool. Might nap later,aww,t3_a9zpn8,1,False,False,a9zpn8,
790,I saw this beautiful pupper on a walk today,aww,t3_aa0gpl,0,False,False,aa0gpl,
791,The best part of wakin up is Ollie in my cup 😍,aww,t3_aa0vgy,0,False,False,aa0vgy,
792,look at those adorable paws!,aww,t3_a9xovp,0,False,False,a9xovp,
793,Day after Christmas,aww,t3_aa13ds,1,False,False,aa13ds,
794,Solly is a very special little man.,aww,t3_a9yohp,5,False,False,a9yohp,
795,Merry Christmas from Bill the YMCA Greeter!,aww,t3_a9uw1r,6,False,False,a9uw1r,
796,"Was not sure Mike would get on with our new kitten, they are best friends now.",aww,t3_aa1cgy,0,False,False,aa1cgy,
797,Cat.,aww,t3_aa0mjr,1,False,False,aa0mjr,
798,These two I swear ;) too cute. Gambit and Clover.,aww,t3_aa0m0k,1,False,False,aa0m0k,
799,I love that he poses for pictures,aww,t3_aa1bi9,0,False,False,aa1bi9,
800,Real life Cabbage Patch,aww,t3_aa0t5i,0,False,False,aa0t5i,
801,After a fun (and exhausting) Christmas trip we are excited to be heading home.,aww,t3_aa36qb,1,False,False,aa36qb,
802,Best friends,aww,t3_aa0lct,1,False,False,aa0lct,
803,These cars are amazing,aww,t3_aa2azw,3,False,False,aa2azw,
804,Our dog and our friend’s son playing together,aww,t3_aa2pus,1,True,False,aa2pus,
805,He sat on my lap the whole night,aww,t3_a9qn03,68,False,False,a9qn03,
806,No go work. More snuggles pleeez.,aww,t3_a9zbfd,3,False,False,a9zbfd,
807,"Meet Simba! He was a ""free kitten to good home"" who had ringworm, a respiratory infection, ear mites, and an eye infection.... nearly $1,000 later, he's still the best Christmas Gift ever!",aww,t3_aa35ty,0,False,False,aa35ty,
808,My best friend Sam.,aww,t3_aa01bs,0,False,False,aa01bs,
809,I love my pups expressive eyes..,aww,t3_aa19rq,0,False,False,aa19rq,
810,My sister brought her good little girl over today!,aww,t3_aa2omn,0,False,False,aa2omn,
811,Meet my love life,aww,t3_aa0k09,1,False,False,aa0k09,
812,A captured calm moment from our pet camera verifying she does need sleep!,aww,t3_a9zi0y,0,False,False,a9zi0y,
813,"Buddy, meet Reddit. Reddit, this is Buddy, my Male Belgian Malinois. For the record, he is actually about 1.5 years old now, but I don’t have any recent photos of him.",aww,t3_aa34v4,2,False,False,aa34v4,
814,This pup.,aww,t3_aa2njx,0,False,False,aa2njx,
815,these two adorable cats (named snickers and milkshake) that my boyfriend and i saw at the petco,aww,t3_aa346h,1,False,False,aa346h,
816,my two cute baby sleeping,aww,t3_aa0qm5,0,False,False,aa0qm5,
817,Almost! Jonas tries his best to catch snacks,aww,t3_aa0b7h,1,True,False,aa0b7h,
818,Frenchie takes a brewery nap,aww,t3_aa2mfj,0,False,False,aa2mfj,
819,Cam and Roxie being cute,aww,t3_aa1u3h,0,False,False,aa1u3h,
820,A Family Affair,aww,t3_aa1huc,1,True,False,aa1huc,
821,Always bringing a smile to my face! 🐶🐾,aww,t3_aa1661,0,False,False,aa1661,
822,Dr dog,aww,t3_aa1sie,4,False,False,aa1sie,
823,Thought I’d be cute and wrap treats for my kitty...,aww,t3_aa1gi6,1,True,False,aa1gi6,
824,"Brodie, back when we first got him.",aww,t3_aa0npw,1,False,False,aa0npw,
825,She’s exhausted after a long day of opening treats and toys on Christmas.,aww,t3_aa0nl8,0,False,False,aa0nl8,
826,"Sasha, half german shepard half Australian shepard....the cutests and smartest cuddliest girl I love. 4 and halfyears old now... I love her! And she loves her daddy!",aww,t3_aa23h6,1,False,False,aa23h6,
827,Donut head.,aww,t3_a9yi9x,1,False,False,a9yi9x,
828,Cat catches laser,aww,t3_a9zqga,0,False,False,a9zqga,
829,My dog is always begging for something :),aww,t3_aa22x3,2,False,False,aa22x3,
830,Comfort comes in many shapes,aww,t3_a9ymit,0,False,False,a9ymit,
831,Stiff kitten fluff,aww,t3_aa0dmj,0,False,False,aa0dmj,
832,My baby girl.,aww,t3_a9zv4l,0,False,False,a9zv4l,
833,Pup Ross,aww,t3_a9yme6,3,False,False,a9yme6,
834,This Gremlin.,aww,t3_a9y9wl,4,False,False,a9y9wl,
835,My pet crow Ninja and his coolness,aww,t3_a9y2x5,3,False,False,a9y2x5,
836,We too had help announcing our engagement,aww,t3_a9vqka,3,False,False,a9vqka,
837,"He's not a kitten anymore, but he's still pretty dang cute!",aww,t3_aa1cmt,2,False,False,aa1cmt,
838,Cat dog,aww,t3_aa062j,2,False,False,aa062j,
839,"Sorry for the low quality, this was my favorite cozy Artemis, and I had to pretend to be disinterested.",aww,t3_aa05z9,0,False,False,aa05z9,
840,Showing me what to do,aww,t3_aa1bql,0,True,False,aa1bql,
841,"me Sunday morning, starting my day with Chinese after a bad hangover",aww,t3_a9ycw0,4,True,False,a9ycw0,
842,A good boi smiling to the camera,aww,t3_a9z86o,1,False,False,a9z86o,
843,Cute little squeaky gulps 🐰,aww,t3_a9zy1u,3,True,False,a9zy1u,
844,Goats having fun,aww,t3_aa04ep,2,True,False,aa04ep,
845,Osik is all puppered out from celebrating.,aww,t3_a9zssb,0,False,False,a9zssb,
846,'Iz our box now...',aww,t3_aa0iiv,0,False,False,aa0iiv,
847,Christmas with the king and his bed,aww,t3_a9njn9,23,False,False,a9njn9,
848,Yes you called me??,aww,t3_aa0qgs,0,False,False,aa0qgs,
849,My two good boys.,aww,t3_aa0ajc,2,False,False,aa0ajc,
850,"Gus, the 2 year old bulldog, decided this is where he is sleeping after a busy day",aww,t3_aa0q2l,0,False,False,aa0q2l,
851,Reddit meet Cookie,aww,t3_a9v72r,8,False,False,a9v72r,
852,Let's do this...,aww,t3_aa18om,0,False,False,aa18om,
853,They really want treats,aww,t3_aa0ovp,1,False,False,aa0ovp,
854,My CH cat freaking out,aww,t3_aa1k1v,1,True,False,aa1k1v,
855,He took his haircut well 😊,aww,t3_aa1k2j,4,False,False,aa1k2j,
856,my cousin loves my lizard so much for his birthday i gertrude a hat and went off to the party,aww,t3_aa3d2y,1,False,False,aa3d2y,
857,My wife and 2 of 6 babies.,aww,t3_aa3d0l,2,False,False,aa3d0l,
858,My favorite elk cow. . .,aww,t3_aa17w3,2,False,False,aa17w3,
859,This big old chonkus,aww,t3_aa17ez,0,False,False,aa17ez,
860,"r/aww long day of opening gifts and treats and pets, nap time",aww,t3_aa0flx,1,False,False,aa0flx,
861,"My kitten Alastor enjoying the afternoon breeze and a massage, with lots of purring!",aww,t3_aa3bod,0,True,False,aa3bod,
862,Sassy floof,aww,t3_a9zq44,0,False,False,a9zq44,
863,Naughty or Nice? What about naughty AND nice (-ish),aww,t3_a9z8e4,1,True,False,a9z8e4,
864,Chopper is his name :) Say Hi to him :),aww,t3_a9zghf,4,False,False,a9zghf,
865,Checking out the little Joey.,aww,t3_a9ryjb,8,True,False,a9ryjb,
866,My border collie is so smol,aww,t3_aa0mg7,0,False,False,aa0mg7,
867,My Bernedoodle Puppy,aww,t3_a9zb9s,2,False,False,a9zb9s,
868,Luna the Siamese,aww,t3_a9zjxd,2,False,False,a9zjxd,
869,Sitting on his favorite pillow 😍,aww,t3_a9ztl9,0,False,False,a9ztl9,
870,Squished kitty,aww,t3_a9yzw4,1,False,False,a9yzw4,
871,This is Ginger. He has the pinkest toe-beans.,aww,t3_a9zacr,1,False,False,a9zacr,
872,my cats cannot get along.,aww,t3_aa0sw6,0,True,False,aa0sw6,
873,11 week old German Shepard puppy my family brought home last week. Say hi to Athena!,aww,t3_a9umq4,4,False,False,a9umq4,
874,Zella,aww,t3_aa2ne4,0,False,False,aa2ne4,
875,Trip of turtle 🐢🐢🐢,aww,t3_aa266c,0,False,False,aa266c,
876,Sometimes you just have to stop and smell the roses.,aww,t3_a9z1kb,3,False,False,a9z1kb,
877,"Meet Ollie, our 4yr old dog. She loves people, other animals and her toys!",aww,t3_a9ypkg,0,False,False,a9ypkg,
878,Meet Rick! The goodest boy.,aww,t3_aa11lz,0,False,False,aa11lz,
879,Basset hounds celebrating their mom's MBA graduation. ❤️,aww,t3_aa1cz8,0,False,False,aa1cz8,
880,Happy gotcha day!! (He loves the flashlight),aww,t3_aa0hqx,0,False,False,aa0hqx,
881,Loki The Frenchy!,aww,t3_a9tmr9,4,False,False,a9tmr9,
882,Im obsessed with these,aww,t3_aa35i1,3,True,False,aa35i1,
883,It all started when I first discovered the owner’s cheese balls,aww,t3_aa10oc,0,False,False,aa10oc,
884,Yasha loves his Christmas present,aww,t3_aa34qo,0,False,False,aa34qo,
885,Rusty out on his Xmas walk,aww,t3_a9zfgf,0,False,False,a9zfgf,
886,Best buds.,aww,t3_a9ywk5,0,False,False,a9ywk5,
887,Fat cat in a little box,aww,t3_aa2k78,0,False,False,aa2k78,
888,Aww! That little frog is so cute!,aww,t3_a9zany,0,False,False,a9zany,
889,She falls asleep in the cutest positions,aww,t3_a9yqef,2,False,False,a9yqef,
890,"Such Secure, Much Wow, Very Birb",aww,t3_aa22qv,0,False,False,aa22qv,
891,Great closeup of my cat,aww,t3_a9zoqp,3,False,False,a9zoqp,
892,True love!,aww,t3_aa19w1,0,False,False,aa19w1,
893,my cute corgi,aww,t3_aa19dq,6,False,False,aa19dq,
894,Long boi does yoga and a chew,aww,t3_aa0xua,0,False,False,aa0xua,
895,"Daddy bought his little girl a dinosaur dress, I think she likes it",aww,t3_aa0nn6,1,False,False,aa0nn6,
896,A much needed nap after a morning of running around the house,aww,t3_a9z5mv,0,False,False,a9z5mv,
897,Every. Morning.,aww,t3_aa0nd4,1,False,False,aa0nd4,
898,"Meet Brian, my nephew's new border collie/husky mix.",aww,t3_a9ys7w,2,False,False,a9ys7w,
899,Frank Drebin demonstrating our holiday exercise regimen.,aww,t3_aa064n,3,True,False,aa064n,
900,My wife and I are finally expecting this April thanks to some help from IVF. Our dog Dexter hearing the news.,aww,t3_a9yj5w,1,False,False,a9yj5w,
901,They all look the same,aww,t3_a9yxpb,1,True,False,a9yxpb,
902,Got this chair as a present. Looks like it's no longer ours,aww,t3_a9zd4c,3,False,False,a9zd4c,
903,That hat,aww,t3_a9yg5c,0,False,False,a9yg5c,
