,title,subreddit,name,num_comments,is_video,pinned,id,selftext
292,Baby turtle,aww,t3_aa2dmf,2,False,False,aa2dmf,
293,This is Molly. She loves everyone and demands everyone love her back.,aww,t3_aa12mt,1,False,False,aa12mt,
294,My Grandpa holding my cousin’s bunny this Christmas,aww,t3_aa23gq,1,False,False,aa23gq,
295,"I was worried my oldest cat wouldn't be too happy with the new kitten I adopted, but he absolutely loves her.",aww,t3_a9wd9y,10,False,False,a9wd9y,
296,What did I get for Christmas? Fat. I got fat.,aww,t3_aa10x0,3,False,False,aa10x0,
297,Proper way to hold a dog?,aww,t3_aa1aei,2,False,False,aa1aei,
298,My dog (left) brought a friend home,aww,t3_aa32ld,4,False,False,aa32ld,
299,Atticus doing his best pose.,aww,t3_aa1tew,4,False,False,aa1tew,
300,My dog got a bowtie for Christmas and is enjoying it.,aww,t3_aa21ng,4,False,False,aa21ng,
301,"Rescue Squirrel ""Hazel"" taking her hourly nap.",aww,t3_aa2ktp,1,False,False,aa2ktp,
302,Misa thinks she’s an outside kitty. Silly girl. 🥰,aww,t3_aa21gt,0,False,False,aa21gt,
303,Best tree ornament is a fluffy meowing ornament,aww,t3_aa21gj,0,False,False,aa21gj,
304,Johnny had his very first Starbucks puppaccino today because he is a good boy. I think he liked it.,aww,t3_aa2vs3,0,False,False,aa2vs3,
305,I love my ball,aww,t3_aa0zmx,6,False,False,aa0zmx,
306,Happy girl,aww,t3_aa1o8n,0,False,False,aa1o8n,
307,She's my favorite girl,aww,t3_aa1g6z,0,False,False,aa1g6z,
308,"Sleepy, Summery, Squirrely Snooze! 🍃🌞",aww,t3_aa1qtg,1,False,False,aa1qtg,
309,I cam back home to this and was taken by surprise (They're very energetic).,aww,t3_aa2du8,0,False,False,aa2du8,
310,what,aww,t3_aa1z8k,1,False,False,aa1z8k,
311,My dog's puppies are starting to open their eyes!,aww,t3_aa1m8y,2,False,False,aa1m8y,
312,Little guy is always smiles when he sees my car at doggy daycare,aww,t3_aa2tdn,2,True,False,aa2tdn,
313,The only family member who got their Christmas gifts actually on time from me this year.,aww,t3_aa35dr,1,False,False,aa35dr,
314,She's calm.,aww,t3_aa2cw8,0,False,False,aa2cw8,
315,When we first brought the kitten home he hissed at her and wouldn’t let her near. Now he’s the best big brother ever!,aww,t3_aa3524,0,False,False,aa3524,
316,My bearded dragon belongs here (shes being snugs),aww,t3_aa2n8j,0,False,False,aa2n8j,
317,Cinnamon has a late Christmas present for you all...,aww,t3_aa2703,1,False,False,aa2703,
318,My son Thor,aww,t3_aa2bt0,2,False,False,aa2bt0,
319,Look son. Everything the water touches is our kingdom.,aww,t3_aa2y3f,0,False,False,aa2y3f,
320,"We are the perfect couple, we're just not in the perfect situation.",aww,t3_aa1kj8,4,False,False,aa1kj8,
321,Now you are under my protection,aww,t3_aa0jmo,2,False,False,aa0jmo,
322,"You guys seem to like cats, so I’ll show you one I found :D (OC)",aww,t3_a9zlbe,2,False,False,a9zlbe,
323,"Yukon says, ""Wharrgarbl.""",aww,t3_aa38j5,1,False,False,aa38j5,
324,Two small hearts can make a big one!,aww,t3_aa38cs,0,False,False,aa38cs,
325,Post shower lounge,aww,t3_aa2vbp,0,False,False,aa2vbp,
326,"Look at me, I am too Starboy.",aww,t3_aa2utl,0,False,False,aa2utl,
327,"My best friend Chief, we just got home from puppy school, she's training to be my service dog.",aww,t3_aa2iyo,0,False,False,aa2iyo,
328,My Godson loved a little simple bit of Christmas magic this year 😊,aww,t3_a9o2jd,249,True,False,a9o2jd,
329,My friend's dog barks in his sleep.,aww,t3_aa371m,2,True,False,aa371m,
330,Percy gets excited when it comes to Christmas. Especially since he was a good boy this year,aww,t3_aa0yuw,0,False,False,aa0yuw,
331,Pupper got a fancy new bed for Christmas! Thats her happy face.,aww,t3_aa2hni,1,False,False,aa2hni,
332,Working from home be like,aww,t3_aa1jqu,1,False,False,aa1jqu,
333,Dinner time tippy taps.,aww,t3_a9y8a8,5,False,False,a9y8a8,
334,Bunny,aww,t3_aa2gvu,2,False,False,aa2gvu,
335,Christmas food coma!!,aww,t3_a9xwst,5,False,False,a9xwst,
336,Maya is my good girl.💛,aww,t3_a9qh03,23,False,False,a9qh03,
337,My girl having fun at the beach.,aww,t3_aa2k8z,4,False,False,aa2k8z,
338,"Gracie Lou 5 months old , so big",aww,t3_aa1gg6,2,False,False,aa1gg6,
339,Such a playful elephant,aww,t3_a9ynx6,5,True,False,a9ynx6,
340,That doggo is so cute!,aww,t3_aa38lp,0,False,False,aa38lp,
341,Meow,aww,t3_aa0wib,5,True,False,aa0wib,
342,This is lola aka mop. Saved her life from the streets and now she has a forever home with us.,aww,t3_aa1xa7,1,False,False,aa1xa7,
343,Grumpy cats great great grandpa,aww,t3_a9z2gy,3,False,False,a9z2gy,
344,My sweet girl,aww,t3_aa37q6,2,True,False,aa37q6,
345,Sully. Best grand-doggo ever.,aww,t3_aa377u,1,False,False,aa377u,
346,So much love,aww,t3_aa125p,4,True,False,aa125p,
347,Dog vaults gate,aww,t3_aa0lps,1,False,False,aa0lps,
348,Who's a good girl!?!?!,aww,t3_a9zk0q,4,False,False,a9zk0q,
349,Cute cat,aww,t3_aa1lm5,0,False,False,aa1lm5,
350,Merry belated Christmas from my gorgeous girl,aww,t3_a9zp1x,1,False,False,a9zp1x,
351,Little Philly cuddling up with his momma,aww,t3_aa2sss,2,False,False,aa2sss,
352,My mom's old cat decided SHE was the best present.,aww,t3_aa2z8p,2,False,False,aa2z8p,
353,Giant trash panda,aww,t3_aa1krs,4,False,False,aa1krs,
354,The bond between my grumpy tripod and shy foster kitten melts my heart,aww,t3_aa24gs,1,False,False,aa24gs,
355,Playful baby goat,aww,t3_aa045l,4,False,False,aa045l,
356,Just got this cutie to hang out with our goats.,aww,t3_aa1yhf,2,False,False,aa1yhf,
357,Yin Yang Boo Buns,aww,t3_aa2x6k,1,False,False,aa2x6k,
358,Kitty says “I love you.”,aww,t3_aa1x04,2,True,False,aa1x04,
359,"Well, everyone has presents, but I don’t ...",aww,t3_aa2wg8,1,False,False,aa2wg8,
360,that lil smile warms my heart,aww,t3_aa1hz3,1,False,False,aa1hz3,
361,Ms. Winter and her satellites,aww,t3_aa275f,1,False,False,aa275f,
362,My girl claims all things soft as her own... including my robe,aww,t3_aa26z9,1,False,False,aa26z9,
363,Streeeeeeeetch,aww,t3_aa2oz2,0,False,False,aa2oz2,
364,The looks of the beautiful cat🧐🧐🧐,aww,t3_aa2180,1,False,False,aa2180,
365,Still the best dancer doggo. Video of 2013,aww,t3_aa2hp5,5,True,False,aa2hp5,
366,Proud of his stick.,aww,t3_aa399q,0,False,False,aa399q,
367,My dog’s reaction to finding out he’s going to be a big brother,aww,t3_aa1gph,2,False,False,aa1gph,
368,This big guy was just hanging out in Costa Rica,aww,t3_aa1ggf,2,False,False,aa1ggf,
369,"Dora finishing homework, thanks Dora",aww,t3_a9yxlo,1,False,False,a9yxlo,
370,Finally warmed up to her new little sister,aww,t3_aa0ae7,0,False,False,aa0ae7,
371,Sleepyhead,aww,t3_a9ya1l,2,False,False,a9ya1l,
372,I hope everyone had a wonderful Holiday!,aww,t3_aa2tuv,0,False,False,aa2tuv,
373,We’re hoping he still grows into his ears,aww,t3_aa0s5k,0,False,False,aa0s5k,
374,My old boy (15) being a great model.,aww,t3_aa1jp3,0,False,False,aa1jp3,
375,Awwwwwwwww,aww,t3_a9ymat,2,False,False,a9ymat,
376,Going into the kitchen from your room to get something to drink when your parents have guests over,aww,t3_aa044b,0,False,False,aa044b,
377,My boy Jones and his new BFF. He’s not normally such a poser. 😂,aww,t3_aa3683,0,False,False,aa3683,
378,Floofy floooof,aww,t3_aa1xcr,0,False,False,aa1xcr,
379,My dog looks like she belongs in a modern art exhibit,aww,t3_aa35zp,1,False,False,aa35zp,
380,pupper,aww,t3_aa2y8z,1,False,False,aa2y8z,
381,This little guy finally got a home this Christmas 😍,aww,t3_aa07rv,0,False,False,aa07rv,
382,This Corgi German Shepard mix,aww,t3_aa2jzr,4,False,False,aa2jzr,
383,When Dexter wants attention.,aww,t3_a9wtc3,4,False,False,a9wtc3,
384,"I took a photo of my cat with some new lenses I got for Christmas. Reddit, meet Bailey.",aww,t3_aa2dns,0,False,False,aa2dns,
385,Will my humans ever realize how hungry I still am?,aww,t3_aa2x49,1,False,False,aa2x49,
386,"My parents’ dog really loves snow. :) We don’t get it often in Southern California, so it’s an extra special event when we wake up to a white Christmas!",aww,t3_aa134f,0,False,False,aa134f,
387,Cat with thumbs!,aww,t3_aa3bnn,2,False,False,aa3bnn,
388,The cat i brought to my grandpa,aww,t3_aa2i7t,0,False,False,aa2i7t,
389,Who needs coffee when you have Princess Baby Jade &lt;3,aww,t3_a9zajo,8,False,False,a9zajo,
390,A big boi but a good big boi,aww,t3_a9zwc1,1,False,False,a9zwc1,
391,This Doggo came from nowhere wagging his tail and hugged my hand.,aww,t3_a9r378,26,True,False,a9r378,
392,My good boi looking slick,aww,t3_aa2hrs,0,False,False,aa2hrs,
393,"Meet Karma, she likes to play fetch all day and is a very good girl.",aww,t3_aa0qpc,3,False,False,aa0qpc,
394,Shower time,aww,t3_aa2afo,1,True,False,aa2afo,
395,"FIRST Christmas Family photo!! Top row, Left to Right: Scooby (looks high), Finnick (looks like Dobby), Summer (also looks high). Bottom two left to right: Forrest (pointy ears), Jack Jack (flat ears and half smile) HAPPY HOLIDAYS, EVERYONE!!!",aww,t3_aa2gvm,1,False,False,aa2gvm,
396,My dog is learning some Scottish dancing,aww,t3_a9ujx3,27,True,False,a9ujx3,
397,She Doesn't Want Me To Leave,aww,t3_aa245k,2,False,False,aa245k,
398,Christmas toy for Callie the pitbull!,aww,t3_aa1nao,0,False,False,aa1nao,
399,"[OC] I was so focused on her eyes, I didn't notice how her leash lined up with her.",aww,t3_aa2tz7,0,False,False,aa2tz7,
400,Know what really grind my gears? Backseat drivers.,aww,t3_a9npvw,137,False,False,a9npvw,
401,Good Christmas Girl,aww,t3_aa2ew2,0,False,False,aa2ew2,
402,My sweet girl Raja. Shes the reason all my clothing is covered in hair.,aww,t3_aa224u,2,False,False,aa224u,
403,Mlem,aww,t3_aa2zn8,0,False,False,aa2zn8,
404,Fell asleep and did a blep...,aww,t3_aa2s4l,0,False,False,aa2s4l,
405,"This restless elephant, Bastian Vinaysundar, in Kerala (India), was struggling to fall asleep. So his keeper, Sree Kumar, sang him 'Alliyilam Poovo' to lull him like a child. It worked.",aww,t3_a9zfhr,1,False,False,a9zfhr,
406,Just had her first shower (sorry for the quality),aww,t3_aa0n5h,1,False,False,aa0n5h,
407,Bucky loves his horse,aww,t3_aa27hg,1,False,False,aa27hg,
408,Strong independent good boy who don’t need no man,aww,t3_aa36up,1,False,False,aa36up,
409,Fluff ball on his favorite chair,aww,t3_aa36tk,2,False,False,aa36tk,
410,He still thinks he’s a lap dog,aww,t3_aa2r9n,4,False,False,aa2r9n,
411,I wish i had a buddy like this.,aww,t3_aa0m7z,0,True,False,aa0m7z,
412,Long boy with a welcome home stretch,aww,t3_aa2jn1,0,False,False,aa2jn1,
413,"My 10 year old girl just a chillin, My best bud.",aww,t3_aa2yc6,1,False,False,aa2yc6,
414,This is Dingo! He’s a corgi/pitbull mix with the most squishable face 💙,aww,t3_aa203w,0,False,False,aa203w,
415,"Our squirrel, Stella.",aww,t3_aa35vg,1,False,False,aa35vg,
416,Laika won't let my wife read.,aww,t3_aa2qef,1,False,False,aa2qef,
417,My grandfather asleep. He is always there for me and I love him so much,aww,t3_aa25xh,1,False,False,aa25xh,
418,Never too young for a thumper spot ❤,aww,t3_a9uyj2,6,True,False,a9uyj2,
419,I hope that you had best Christmas ever!,aww,t3_a9zhpj,6,False,False,a9zhpj,
420,"Found this little cutie running around by herself on a farm, she's now got a safe and warm home!",aww,t3_aa25iw,0,False,False,aa25iw,
421,Picking up this Gorgeous Doggo later this week.,aww,t3_aa0em6,3,False,False,aa0em6,
422,To remember my dog buster,aww,t3_aa2pcq,8,True,False,aa2pcq,
423,Dogs do speak but only to those who know how to listen.,aww,t3_aa0hec,0,False,False,aa0hec,
424,This is my dog Flo,aww,t3_aa0rsw,7,False,False,aa0rsw,
425,Still full of Christmas Spirit!,aww,t3_aa2b4f,1,False,False,aa2b4f,
426,"Lost my dog Christmas morning, went searching for the little dude for hrs, came home, turned on Avatar the last air bender where Appa was taken from Aang and weep for the night. After posting it on FB Colorado lost and found pets, I got a text saying Keanu was found. I’m very thankful.",aww,t3_a9v028,12,False,False,a9v028,
427,Little Arya missed my fiance and I so much on Christmas that she's taken to sleeping in our overnight bag so we won't forget her next time!,aww,t3_a9zgmi,1,False,False,a9zgmi,
428,It has been good being at home getting to give my favourite little boy some much needed fuss,aww,t3_aa1y8a,1,False,False,aa1y8a,
429,Waiting for someone to rub his belly...,aww,t3_aa1hdr,1,False,False,aa1hdr,
430,My lil pup,aww,t3_aa2450,2,False,False,aa2450,
431,My host sister took a picture of me asleep with our kitty.,aww,t3_aa1mk1,0,False,False,aa1mk1,
432,random dog that just turned up in my garden.,aww,t3_aa0gh1,5,False,False,aa0gh1,
433,"She was my sisters, but their landlord made her get rid of her. So I took her. Now they’ve moved and are taking her back. I’m heartbroken. I love her so much.",aww,t3_aa1xq8,4,False,False,aa1xq8,
434,Ski dog,aww,t3_aa0yi7,0,True,False,aa0yi7,
435,Do you have to go to work?,aww,t3_aa2vf1,0,False,False,aa2vf1,
436,How do I get him a modeling career?,aww,t3_a9q8qa,42,False,False,a9q8qa,
437,And they called it puppy love,aww,t3_aa1qtm,0,False,False,aa1qtm,
438,"Cats like spirulina, apparently",aww,t3_aa1ld9,0,False,False,aa1ld9,
439,He looked shocked when I said I ran out of treats lol,aww,t3_aa1l53,2,False,False,aa1l53,
440,Say hi to my new pupper Hela.,aww,t3_aa2mlm,1,False,False,aa2mlm,
441,I otter get an otter,aww,t3_a9vemd,9,True,False,a9vemd,
442,This weekend I'm picking up these kittens &amp; bringing them home,aww,t3_aa1kjf,6,False,False,aa1kjf,
443,Little girl trying to get my treats!,aww,t3_a9zoa7,3,False,False,a9zoa7,
444,Happy kitty family,aww,t3_a9x8pi,4,True,False,a9x8pi,
445,Searched for my cat for 2 hours... It should have been the first place for checking i suppose...,aww,t3_aa14s4,0,True,False,aa14s4,
446,Sugar Glider peeking at you ⭐💕,aww,t3_aa0aby,1,False,False,aa0aby,
447,My Christmas doggo,aww,t3_aa1izh,3,False,False,aa1izh,
448,"Thor, my constant companion and ally. He is the best part of every single day of my life since he entered it. 6 years old and still just a puppy!",aww,t3_aa0zro,0,False,False,aa0zro,
449,Good boy waiting for his human to return.,aww,t3_aa30dl,1,False,False,aa30dl,
450,My Betty,aww,t3_aa1ir0,3,False,False,aa1ir0,
451,Perfect timing.,aww,t3_a9zhb9,5,False,False,a9zhb9,
452,"This is Captain Max, our Husky/Doberman mix. After being rescued just a couple months ago, he seems to be enjoying our first family Christmas in style. He's truly the best gift we could have ever received.",aww,t3_aa09vd,4,False,False,aa09vd,
453,Shurato,aww,t3_aa1ima,2,False,False,aa1ima,
454,Crib hockey,aww,t3_aa0cra,1,False,False,aa0cra,
455,Baby leo sleep adorable!,aww,t3_aa38hk,0,False,False,aa38hk,
456,My Brother Left to Get Groceries. His dog has separation issues and has spent nearly 99% of her 5-month life within 10 feet of my brother. Here's her reaction to him showing up after being gone for 15 minutes. This video sadly does not include the 15 minutes of her whining at the door.,aww,t3_aa1cql,2,True,False,aa1cql,
457,Oh lawd he chonkin,aww,t3_aa0ceu,4,False,False,aa0ceu,
458,"Meet my best-friend, Alligator",aww,t3_aa3820,0,False,False,aa3820,
459,"The greatest dog ever and the one I’ve loved the most, I present to you, Bella.",aww,t3_aa37v0,0,False,False,aa37v0,
460,Every family member gets a turn to watch their favourite programme.,aww,t3_aa37gm,0,False,False,aa37gm,
461,Thought this picture turned out real nice and wanted to share,aww,t3_aa125d,0,False,False,aa125d,
462,Merry christmas from my puppy to yours!,aww,t3_aa16kj,2,False,False,aa16kj,
463,Lil pupper big stick,aww,t3_aa2bbd,0,False,False,aa2bbd,
464,That Blep. 😍,aww,t3_aa2i19,1,False,False,aa2i19,
465,Bunny Rabbit,aww,t3_aa0orw,2,False,False,aa0orw,
466,This is what love looks like.,aww,t3_a9z6d9,5,False,False,a9z6d9,
467,My puppies paw has one pink bean,aww,t3_aa1fet,0,False,False,aa1fet,
468,Slappy New Year!,aww,t3_aa10hn,2,True,False,aa10hn,
469,These aren’t the clothes you are looking for,aww,t3_aa2oqq,6,False,False,aa2oqq,
470,Rescued this little girl on Christmas morning. She hasn't stopped purring since.,aww,t3_a9qm27,21,False,False,a9qm27,
471,One of the rare moments I’ve managed to get a picture of both of them not looking like total derps,aww,t3_aa13ss,0,False,False,aa13ss,
472,"1 year apart, she's grown into such a young lady",aww,t3_a9zzyc,1,False,False,a9zzyc,
473,My cat loves his carrot,aww,t3_aa1j4w,0,False,False,aa1j4w,
474,My downstairs neighbor just got this sweet baby angel. Meet Livvy,aww,t3_aa3407,0,False,False,aa3407,
475,"This is Nemo, aptly named by the rescue foundation following a (now healed) degloving injury. He is now our squishy.",aww,t3_aa1j2g,7,False,False,aa1j2g,
476,She's so gorgeous,aww,t3_a9ywaw,3,False,False,a9ywaw,
477,My friend adopted this floof for Christmas. He obviously loves her already!,aww,t3_aa2mly,0,False,False,aa2mly,
478,Here is another one!,aww,t3_aa0ygh,1,False,False,aa0ygh,
479,My little nugget of sweet sweet love 💕,aww,t3_aa27ey,1,False,False,aa27ey,
480,Felix got food stuck to his nose last night and this is how he woke me,aww,t3_aa2ueg,0,False,False,aa2ueg,
481,"Latest addition to the hammy family. Meet Spud, the little guy who will only eat carrot biscuits.",aww,t3_aa272e,1,False,False,aa272e,
482,My pets are thinking of starting a pop-music group by the looks of it...,aww,t3_aa2ls8,2,False,False,aa2ls8,
483,The Liar twins.👥💂‍♂️💂‍♀️,aww,t3_aa207c,2,False,False,aa207c,
484,My gfs cat (now mine as well) Mrs. Kitty Dog ♥,aww,t3_aa32oi,0,False,False,aa32oi,
485,My Buddy. He was everyone's Buddy.,aww,t3_aa1c6r,0,False,False,aa1c6r,
486,Cheetah cub chewing on mom in Kenya,aww,t3_aa1z6x,0,False,False,aa1z6x,
487,*monch*,aww,t3_aa2ktv,0,False,False,aa2ktv,
488,My boy Mikey claimed all the beds for himself.,aww,t3_aa2s34,0,False,False,aa2s34,
489,My little man Leo always wants to snuggle when he knows I’m sad 🥰,aww,t3_aa39wi,3,False,False,aa39wi,
490,I'll miss this about working from home,aww,t3_aa1xtw,0,False,False,aa1xtw,
491,My lil Santa paws,aww,t3_aa24kf,4,False,False,aa24kf,
492,Help Keep an Eye on the Little Guy :),aww,t3_aa0fbr,9,False,False,aa0fbr,
493,Flagrant flaunting of the so-called “no couch” rule at grandma and grandpa’s house,aww,t3_aa24bp,3,False,False,aa24bp,
494,Christmas tuckered our new puppy out.,aww,t3_aa1qoa,0,False,False,aa1qoa,
495,My driver,aww,t3_aa2zmi,3,False,False,aa2zmi,
496,My pup loves the new blanket,aww,t3_aa2zkt,1,False,False,aa2zkt,
497,Even with 11 years she is still super cheeky :D,aww,t3_aa2zca,1,False,False,aa2zca,
498,Can't resist these gorgeous blue eyes,aww,t3_a9y6xw,2,False,False,a9y6xw,
499,First time leaving my boy with a sitter for a whole week. I was nervous but they just sent his picture after having a great walk!,aww,t3_aa0hro,2,False,False,aa0hro,
500,"Found (and returned) little Wlly, who was exploring the neighborhood this morning",aww,t3_aa0tvh,1,False,False,aa0tvh,
501,Full from all his christmas treats we got him,aww,t3_aa17y5,0,False,False,aa17y5,
502,SnickersButt is living up to his name.,aww,t3_aa12wl,0,False,False,aa12wl,
503,She blinked,aww,t3_aa22ig,2,False,False,aa22ig,
504,My sister and I were worried our dogs wouldn’t get along. One MLEM cured our worries.,aww,t3_aa0gyf,2,False,False,aa0gyf,
505,My niece colored a dragon for me,aww,t3_aa1oto,2,False,False,aa1oto,
506,Freedom!,aww,t3_aa2gp1,0,False,False,aa2gp1,
507,Feeding queen biggles her dinner,aww,t3_aa36x3,3,False,False,aa36x3,
508,Real or fake?,aww,t3_aa0wgy,0,True,False,aa0wgy,
509,Mittens recently opened his third eye chakra,aww,t3_aa2nyt,1,False,False,aa2nyt,
510,Christmas pup,aww,t3_aa0bkr,0,False,False,aa0bkr,
511,"My dog, the black one, is staying over at my aunt's place while I'm traveling and really settled in comfortably. My aunt's dog's got the ""You seein this shit?"" look all over",aww,t3_aa26lk,0,False,False,aa26lk,
512,"Missing the sun, missing my wobbly buddy",aww,t3_aa26jd,0,False,False,aa26jd,
513,She broke a hole in the blinds to say hello to the neighbors,aww,t3_aa1lt7,0,False,False,aa1lt7,
514,Pancake turning on her charm,aww,t3_aa0ajz,0,False,False,aa0ajz,
515,This good girl is 15 and my favourite part of coming home for Christmas,aww,t3_a9z748,1,False,False,a9z748,
516,"My rescue doggos in their holiday outfits. 🎄🎄🎄 Fizgig, Sir Jim Didymus and Bella.",aww,t3_a9zaie,3,False,False,a9zaie,
517,Baby Mia thinks my jeans are yummy,aww,t3_aa0ul3,0,False,False,aa0ul3,
518,"Even though he's getting older, he still loves to lay on my stomach and enjoy some scritches. He's my best friend and loyal companion. I love you Yoda.",aww,t3_aa33sy,1,False,False,aa33sy,
519,Angel wants to be a present too!,aww,t3_aa2uhl,2,False,False,aa2uhl,
520,Sophie,aww,t3_aa13hb,1,False,False,aa13hb,
521,"Christmas may be over, but Latke isn't ready to let go of the holiday spirit",aww,t3_aa33d8,1,False,False,aa33d8,
522,Ready for snuggles,aww,t3_aa2u0m,1,False,False,aa2u0m,
523,"This is my new baby, Lemon!",aww,t3_aa2kmx,1,False,False,aa2kmx,
524,My pup is 8 years old and I’m still kicking myself for not naming him Dobby! He hopes everyone had a magnificent holiday!,aww,t3_aa0kkk,2,False,False,aa0kkk,
525,Gmork complains that he’s not getting enough pets,aww,t3_aa0t6b,1,False,False,aa0t6b,
526,My doggo and it’s stick !,aww,t3_aa1dte,0,False,False,aa1dte,
527,This picture of my baby Nikah in the snow,aww,t3_aa32tx,0,False,False,aa32tx,
528,Sleepy birdy,aww,t3_aa3cwj,0,True,False,aa3cwj,
529,"never trust that ""pet me"" face",aww,t3_a9xfda,2,False,False,a9xfda,
530,My bf surprised me with this adorable baby boy for Christmas! We haven’t decided on a name yet... open to suggestions!,aww,t3_a9xerh,51,False,False,a9xerh,
531,Got this lil' bundle of joy for Christmas!,aww,t3_a9zqnx,6,False,False,a9zqnx,
532,"Buddy, the best farm dog ever. He just showed up one day and slowly worked his way into my parents bedroom. He's older now, but he's still a hard working, precious gem and definitely makes home feel like home.",aww,t3_a9poee,32,False,False,a9poee,
533,🔥 Dolphin checking out what a diver is doing 🔥,aww,t3_aa3c3w,0,False,False,aa3c3w,
534,Meet Julius our nature boy.,aww,t3_aa0jec,2,False,False,aa0jec,
535,My good girl,aww,t3_aa31r3,1,False,False,aa31r3,
536,3 floofs taking a nap,aww,t3_aa2b3c,0,False,False,aa2b3c,
537,"I see so many dogs all the time. Here's my puppets, Gideon. I haven't seen him since October because of business.",aww,t3_aa3bwt,2,False,False,aa3bwt,
538,Putting away laundry on hard mode.,aww,t3_aa0neu,2,False,False,aa0neu,
539,When the cat loves his cat brother,aww,t3_aa1ozf,0,False,False,aa1ozf,
540,My one-eyed pup needs a nap,aww,t3_aa2a94,0,False,False,aa2a94,
541,Can’t live without him,aww,t3_aa1ht8,0,False,False,aa1ht8,
542,Me and Cookie💕,aww,t3_aa2rhw,0,False,False,aa2rhw,
543,Five week old Stockings says hello!,aww,t3_aa228s,0,False,False,aa228s,
544,And will Juliet come out?,aww,t3_aa30kl,1,False,False,aa30kl,
545,Only way he sleeps 😍,aww,t3_aa0dxn,0,False,False,aa0dxn,
546,"my cat got cold, so i decided to wrap her in my blanket.",aww,t3_aa39y7,0,True,False,aa39y7,
547,beautiful pic,aww,t3_aa1tws,4,False,False,aa1tws,
548,The next WWE master,aww,t3_aa0dbr,3,False,False,aa0dbr,
549,My deaf dalmatian mix,aww,t3_aa1mz6,2,False,False,aa1mz6,
550,Private Wienerdog reporting for snuggles!,aww,t3_aa39re,0,False,False,aa39re,
551,A dream come true!,aww,t3_a9y4su,5,True,False,a9y4su,
552,Doggo Christmas Scarf,aww,t3_aa2p80,0,False,False,aa2p80,
553,This is my sister’s cat. His name is Thor and he is one hyper active little guy.,aww,t3_aa1zme,0,False,False,aa1zme,
554,Old lady mlem.,aww,t3_aa133l,0,False,False,aa133l,
555,Bodyguard,aww,t3_a9zi2i,0,False,False,a9zi2i,
556,They just want to say hello to everybody!,aww,t3_a9zuu9,1,False,False,a9zuu9,
557,My senior pupper howls for love,aww,t3_aa2nst,0,True,False,aa2nst,
558,"Christmas chill with my maine coon Floki 🎄 yep, he loves me 😍",aww,t3_aa26pg,4,False,False,aa26pg,
559,"My Hammy,Charlie!",aww,t3_aa2ev2,0,False,False,aa2ev2,
560,Crew love,aww,t3_aa0nlf,0,False,False,aa0nlf,
561,My Ex-GF took the cat but the night before I left he slept with me all night.,aww,t3_aa26ee,0,False,False,aa26ee,
562,Can we play now?,aww,t3_a9zmdk,2,False,False,a9zmdk,
563,Scratchy scratchy,aww,t3_aa074l,0,True,False,aa074l,
564,cute corgi,aww,t3_a9z73t,1,False,False,a9z73t,
565,My cat didn't get anything for Christmas but he is definitely enjoying the boxes from it!,aww,t3_aa36s5,3,True,False,aa36s5,
566,Blep,aww,t3_aa0qoe,0,False,False,aa0qoe,
567,Showered in kisses,aww,t3_a9x66w,8,False,False,a9x66w,
568,He wanted to try pickles for the first time,aww,t3_a9yb55,10,False,False,a9yb55,
569,Time for cuddles!,aww,t3_aa2cn5,0,False,False,aa2cn5,
570,Baby growl!,aww,t3_aa1w8k,1,False,False,aa1w8k,
571,The proper way to hold a dog,aww,t3_aa0pyw,5,False,False,aa0pyw,
572,Protecting the pack...!,aww,t3_aa2upp,0,True,False,aa2upp,
573,"They haven't seen each other for days, super excited to see her again.",aww,t3_aa34pe,0,False,False,aa34pe,
574,How will I ever cross this raging river?,aww,t3_aa047i,1,False,False,aa047i,
575,Snow!,aww,t3_aa1435,2,True,False,aa1435,
576,Snowy dog🥶🥶🥶🥶,aww,t3_aa22lh,1,False,False,aa22lh,
577,I made friends with this floof on Christmas night,aww,t3_aa3373,2,False,False,aa3373,
578,Cam being photogenic,aww,t3_aa21va,0,False,False,aa21va,
579,"Their first Christmas and now, 5 years later❤",aww,t3_a9t83u,12,False,False,a9t83u,
580,Bender was a very good boy this year 🎅,aww,t3_aa0ryl,0,True,False,aa0ryl,
581,"I fell asleep on the couch, but my cats hadn’t seen me in 14 days. Thanks to my husband I now know they cuddle me at night! &lt;3",aww,t3_a9nxgj,49,False,False,a9nxgj,
582,This cat was rescued by some people in my hometown. More in comments,aww,t3_aa2hww,4,False,False,aa2hww,
583,Nap expert,aww,t3_aa1sok,0,False,False,aa1sok,
584,What a good boy going for a drive,aww,t3_aa2r3d,2,False,False,aa2r3d,
585,Yin and Yang,aww,t3_a9za58,2,False,False,a9za58,
586,"Was going to go to the gym, but then...",aww,t3_aa30gb,5,False,False,aa30gb,
