,title,subreddit,name,num_comments,is_video,pinned,id,selftext
904,Meowy Christmas!,aww,t3_a9zcla,0,False,False,a9zcla,
905,She insists on dressing me and taking pictures!!!,aww,t3_aa1jx4,0,False,False,aa1jx4,
906,My new favorite picture of my 16yo girl,aww,t3_a9yi83,1,False,False,a9yi83,
907,I'm watching you...,aww,t3_a9zlg6,0,False,False,a9zlg6,
908,A surprise sneeze,aww,t3_a9zl6g,0,True,False,a9zl6g,
909,Almost 4 years old and she still so little.,aww,t3_aa0k6m,0,False,False,aa0k6m,
910,"""It...it wasn't a dream! This is real!""",aww,t3_a9wxpb,3,False,False,a9wxpb,
911,Three years ago we got a Christmas Cat. This year we got a Christmas Kitten!,aww,t3_a9z2zh,0,False,False,a9z2zh,
912,For some reason they all pass out every time we’re in the bathroom,aww,t3_a9zfj1,2,True,False,a9zfj1,
913,"My daughter made our then kitten Simba ""comfy"".",aww,t3_a9xczi,4,False,False,a9xczi,
914,“Can I have your food?”,aww,t3_aa0az9,1,False,False,aa0az9,
915,My cat bubbles sitting in the sun,aww,t3_aa1wfs,0,False,False,aa1wfs,
916,"Boop my nose, please.",aww,t3_a9wpev,3,False,False,a9wpev,
917,Whatchya thinkin' about?,aww,t3_aa0rr6,0,False,False,aa0rr6,
918,No one believes how sweet &amp; cuddly my anxious kitty is when they aren't here.,aww,t3_a9yfye,1,False,False,a9yfye,
919,who dat ?,aww,t3_a9y4ke,7,True,False,a9y4ke,
920,Introducing Lord Nedly and Lady Persephone,aww,t3_a9xbmw,4,False,False,a9xbmw,
921,Little guy all zonked out!,aww,t3_a9ykxc,0,False,False,a9ykxc,
922,My mom got me this stained glass corgi-bat for Christmas!,aww,t3_a9xgin,1,False,False,a9xgin,
923,Two of my buddies.,aww,t3_aa1tel,0,False,False,aa1tel,
924,"My cat, Moses, on Christmas Eve",aww,t3_a9yenn,2,False,False,a9yenn,
925,My cat insists I hold her while working. This is the only way I can get any work done.,aww,t3_a9xlop,4,False,False,a9xlop,
926,My cat staring at me from a pine tree,aww,t3_aa1dgg,0,False,False,aa1dgg,
