,title,subreddit,name,num_comments,is_video,pinned,id,selftext
0,R/AWW OFFICIAL DISCORD!!! JOIN NOW!,aww,t3_97vuvt,139,False,False,97vuvt,[Join here!](https://discord.gg/c9YAqy3)
1,r/catsandchristmastrees: /r/Aww Subreddit of the Week!,aww,t3_a7yh12,11,False,False,a7yh12,
2,"Moose. My sidekick, my partner, my best friend. Thank you for being such an amazing creature.",aww,t3_aa05uq,1189,False,False,aa05uq,
3,My doggo successfully beat heart worm!,aww,t3_aa09mf,237,False,False,aa09mf,
4,"Buy a dog for your grandma guys, you won't regret it.",aww,t3_aa0ays,336,True,False,aa0ays,
5,He turned 15 this year. Still turns back to make sure I'm still there.,aww,t3_aa02o5,96,False,False,aa02o5,
6,"""Hi there!""",aww,t3_a9zief,139,True,False,a9zief,
7,Cuddle buddies.,aww,t3_a9zm50,36,False,False,a9zm50,
8,Good boy in the snow,aww,t3_a9z8ud,17,False,False,a9z8ud,
9,Awwtters.,aww,t3_aa0h27,22,False,False,aa0h27,
10,The seal is so precious,aww,t3_aa05wi,56,False,False,aa05wi,
11,My Daughter’s First Painting With Help From Bob Ross,aww,t3_a9z8be,52,False,False,a9z8be,
12,she doesn’t believe in the concept of personal space,aww,t3_a9ze2y,102,False,False,a9ze2y,
13,Little goldie after his first day at the beach,aww,t3_a9y8s0,60,True,False,a9y8s0,
14,She looks so comfy there.,aww,t3_aa02kb,14,False,False,aa02kb,
15,Fire vs water,aww,t3_a9y79o,93,False,False,a9y79o,
16,The proper way to hold a baby,aww,t3_a9xqxk,382,False,False,a9xqxk,
17,My brovaries just exploded.,aww,t3_aa02tn,33,True,False,aa02tn,
18,Father and son.,aww,t3_aa0i3i,48,False,False,aa0i3i,
19,Street dog in Georgia 🇬🇪,aww,t3_a9zbvk,69,False,False,a9zbvk,
20,Shower buddy,aww,t3_a9zei1,161,True,False,a9zei1,
21,Cats enjoying big round ice block,aww,t3_a9xal3,508,True,False,a9xal3,
22,Cinematographer comes through with the scritches,aww,t3_a9yd5t,96,True,False,a9yd5t,
23,She’s watching her favorite movie,aww,t3_a9yu2o,37,True,False,a9yu2o,
24,"Felt cute, might delete later 😂",aww,t3_a9zcdz,27,False,False,a9zcdz,
25,Oh boy a snow day!,aww,t3_a9zmfw,23,False,False,a9zmfw,
26,It's love 😍,aww,t3_a9ygdz,30,True,False,a9ygdz,
27,Black and White Cat Coat,aww,t3_aa0kva,9,False,False,aa0kva,
28,"When we found him in a ditch, and now. Welcome home buddy",aww,t3_aa2d57,24,False,False,aa2d57,
29,Deaf little girl finds out she's going to be a big sister,aww,t3_aa2t6u,37,False,False,aa2t6u,
30,Our pup stole my spot in the bed. Didn't have the heart to kick him out.,aww,t3_a9z874,27,False,False,a9z874,
31,Whippet Wiggle Butt,aww,t3_a9z7r9,34,False,False,a9z7r9,
32,"""what's wrong?, was I too aggressive?""",aww,t3_a9yxh1,10,False,False,a9yxh1,
33,He seems proud of himself.,aww,t3_a9v7mi,437,False,False,a9v7mi,
34,"After 10 years of renting a no-pets apartment, we can finally have pets in our own house. Meet Luna and Willow!",aww,t3_a9vgf9,209,False,False,a9vgf9,
35,The tiniest kitten in a sweater,aww,t3_a9vy6n,95,False,False,a9vy6n,
36,Player 3 has entered the game,aww,t3_a9ztav,12,False,False,a9ztav,
37,If you’re happy and you know it,aww,t3_aa0lfk,15,True,False,aa0lfk,
38,This little black floof with the big eyes,aww,t3_a9zd8x,10,False,False,a9zd8x,
39,A few weeks ago my daughter lost her very best friend. I am happy to report they have been reunited!,aww,t3_a9w64h,85,True,False,a9w64h,
40,When your parents come home unexpectedly and bust you,aww,t3_aa0cel,11,False,False,aa0cel,
41,lilly the angry eyebrow,aww,t3_a9zygy,13,False,False,a9zygy,
42,My kid wanted a sledgehammer for his birthday. So I got him one and buried the rest of his presents in concrete.,aww,t3_a9w9u4,222,True,False,a9w9u4,
43,"My parents GSD, then and now. From pupper to big boi.",aww,t3_a9zrio,15,False,False,a9zrio,
44,Carrot time in slow motion,aww,t3_aa0lge,16,True,False,aa0lge,
45,Glow-Up!!! :D,aww,t3_aa1i2t,5,False,False,aa1i2t,
46,UPS delivery guy takes time out to love on my cat.,aww,t3_a9udbe,1064,False,False,a9udbe,
47,I got my wife a camera to watch our cats when we’re away. Iggy found it.,aww,t3_a9wqyi,34,False,False,a9wqyi,
48,Look at my pink ribbon.,aww,t3_a9uhc5,105,False,False,a9uhc5,
49,Hedgehog going camping,aww,t3_aa1aww,12,False,False,aa1aww,
50,"This is our kitten Peaches that we rescued a couple months ago. She goes by many nicknames though, notably peachy and whitebeard",aww,t3_a9z6wv,9,False,False,a9z6wv,
51,Girl spent her break helping a disabled man eat his meal,aww,t3_a9xldt,44,False,False,a9xldt,
52,My Mom painted a watercolor of my pups for me for Christmas using a picture from their birthday party. I love it.,aww,t3_aa1q0y,10,False,False,aa1q0y,
53,Recently added him to our family. Clark Griswold,aww,t3_a9u19y,107,False,False,a9u19y,
54,"If I fits, I sits: EXTREME EDITION",aww,t3_aa0wjz,10,False,False,aa0wjz,
55,My old girl is worn out from entertaining visitors all day.,aww,t3_a9u55z,60,False,False,a9u55z,
56,"Same pose, 4 months apart!",aww,t3_aa12d3,4,False,False,aa12d3,
57,The Winter King,aww,t3_a9x4d1,15,False,False,a9x4d1,
58,That's the cutest meow i've ever heard,aww,t3_a9yt76,4,True,False,a9yt76,
59,"Our Ginger lost her eye in November, but is a tough girl and we think just as beautiful as ever!",aww,t3_aa2bjx,3,False,False,aa2bjx,
60,Kitties keeping warm,aww,t3_a9zc4v,5,True,False,a9zc4v,
61,Another picture of Bob Ross. This time with a baby raccoon.,aww,t3_aa0zms,6,False,False,aa0zms,
62,the council shall oversee your judgement,aww,t3_aa0r97,4,False,False,aa0r97,
63,This Cat Knows How to Give a Good Massage 10/10,aww,t3_a9uk8n,72,True,False,a9uk8n,
64,My twin brothers getting a puppy for Christmas,aww,t3_a9vhbo,116,True,False,a9vhbo,
65,This adorable little jumping spider covered in pollen,aww,t3_aa0q03,12,False,False,aa0q03,
66,"This is Kiva, my foster failure. I had to adopt her because nobody wanted a black, shy dog from the reservation. She has turned out to be the best dog I've ever had.",aww,t3_aa0vhl,16,False,False,aa0vhl,
67,Good boi doin a smile,aww,t3_aa20py,2,False,False,aa20py,
68,Capybaras chilling in a hot yuzu bath in winter is the most soothing scene,aww,t3_aa16ep,13,True,False,aa16ep,
69,World meet Ollie,aww,t3_a9u2na,64,False,False,a9u2na,
70,Penguin Kindergarten,aww,t3_a9wbu4,33,True,False,a9wbu4,
71,So nice of him.,aww,t3_a9sozf,451,True,False,a9sozf,
72,No human,aww,t3_aa203y,5,True,False,aa203y,
73,This is Scrumpy. She’s 20 years old today. Happy Birthday.,aww,t3_aa2n5s,4,False,False,aa2n5s,
74,My girlfriend just adopted a Great Pyrenees,aww,t3_a9z3z0,9,False,False,a9z3z0,
75,"Everyone, meet my new best friend, Bobby.",aww,t3_aa0vut,12,False,False,aa0vut,
76,It was a great day at work,aww,t3_aa1nb4,4,True,False,aa1nb4,
77,Is this how you do it?,aww,t3_a9zw72,9,False,False,a9zw72,
78,🐕🐕,aww,t3_a9w7ia,15,False,False,a9w7ia,
79,Just look at that face!,aww,t3_aa20vz,0,False,False,aa20vz,
80,"Born 15 years ago in our home, but he couldn't make it 16. I'll miss you so much Wesley. I love you",aww,t3_aa1667,8,False,False,aa1667,
81,Reddit this is Zip!,aww,t3_a9zp37,3,False,False,a9zp37,
82,All for a Broccoli!,aww,t3_a9y809,22,True,False,a9y809,
83,It's the paper boy,aww,t3_aa20tg,2,True,False,aa20tg,
84,When you're watching Netflix and happen to look down.. 👀,aww,t3_a9tp96,39,False,False,a9tp96,
85,My grandma said she looks like a coyote and was a mistake. That just makes me love her more.,aww,t3_aa24f5,5,False,False,aa24f5,
86,"Just got him a new bed, at least he's using it.",aww,t3_aa2slz,4,False,False,aa2slz,
87,"My father in law's kitten, zonked after chasing a Christmas bauble for 2 hours on xmas day.",aww,t3_a9x2uq,10,False,False,a9x2uq,
88,Scaley Girl gotta get comfy,aww,t3_a9z9y0,4,True,False,a9z9y0,
89,"Mitzi, the last of 4 miniature Dachshunds I grew up with. She’s 18 today.",aww,t3_aa0xz7,8,False,False,aa0xz7,
90,Little goldie after his first day at the beach,aww,t3_aa2734,7,True,False,aa2734,
91,This will put a smile on your face.,aww,t3_aa0kly,3,False,False,aa0kly,
92,She got paid from her first modeling gig ... now she thinks she owns the place 👑,aww,t3_aa16gm,8,True,False,aa16gm,
93,"My grandfather is the classic north-italy farmer, he has his own house and this is Pippo, his dog. Pippo watches the house from wild animals that may damage the plants. Since he is raised to be kind of a guard-dog, he is not used to getting love, always shy to come close and get pets, so cute.",aww,t3_aa1ppz,3,False,False,aa1ppz,
94,look at those adorable paws!,aww,t3_a9skdf,33,False,False,a9skdf,
95,Capybaras taking a hot bath with yuzu fruits in winter,aww,t3_aa2b4a,7,True,False,aa2b4a,
96,"My girlfriend sketched our ""Dog"" for my Christmas book, and it's the best gift I've ever received.",aww,t3_a9x9sg,36,False,False,a9x9sg,
97,imagine being in there,aww,t3_a9rhb6,310,True,False,a9rhb6,
98,Figured she deserves to be seen so here is maddie my one year old puppy!,aww,t3_a9vdcy,23,False,False,a9vdcy,
99,Otter furball,aww,t3_aa1oon,3,False,False,aa1oon,
100,This is Winter. I think he’s happy to be warm &amp; safe on this side of the glass now.,aww,t3_a9rmb3,77,False,False,a9rmb3,
101,Dinner is coming!,aww,t3_a9rx2q,61,False,False,a9rx2q,
102,"When Fiona the Hippo was born (6 weeks premature) she was only 29 pounds. Now the Cincinnati Zoo confirms she's reached a new milestone, and weighs 1,000 pounds!",aww,t3_a9r422,399,True,False,a9r422,
103,Christmas 2016 to Christmas 2018. They grow up so fast 😭,aww,t3_a9tbmc,82,False,False,a9tbmc,
104,Lol - This Cat,aww,t3_a9zatg,5,True,False,a9zatg,
105,1.5 month difference. I'm convinced my SO swapped our cat for another.,aww,t3_aa2iao,5,False,False,aa2iao,
106,This wallaby wanted more sweet potato slices!,aww,t3_a9zwik,5,False,False,a9zwik,
107,My adopted boy just turned 2!,aww,t3_aa0663,7,False,False,aa0663,
108,How could I ever say no to that face?!,aww,t3_aa0sq3,6,False,False,aa0sq3,
109,The day I brought home my new sidekick,aww,t3_aa2l07,7,True,False,aa2l07,
110,Domestic pet hamster’s survival instinct: climbing up a human leg for safety!,aww,t3_aa029m,3,True,False,aa029m,
111,"Please meet my mom's 19 year old lady cat, Sonya.",aww,t3_aa28th,2,False,False,aa28th,
112,My Aunt’s GR Puppy,aww,t3_aa06ba,3,False,False,aa06ba,
113,I love this calf,aww,t3_aa23w3,1,False,False,aa23w3,
114,When I get home and my wife asks me what I’m doing today......,aww,t3_a9r9jr,33,True,False,a9r9jr,
115,Some things never change,aww,t3_aa2dfp,6,False,False,aa2dfp,
116,Stepdad raised him since he was 3. He got him adoption papers as a Christmas gift.,aww,t3_aa2ybq,5,True,False,aa2ybq,
117,Magic Boi performs disappearing act,aww,t3_a9rad6,46,True,False,a9rad6,
118,A warrior and his best friend,aww,t3_a9y4w8,28,False,False,a9y4w8,
119,This bookstore in Seattle is very cat-friendly,aww,t3_aa2lj2,1,False,False,aa2lj2,
120,His first time in the snow!,aww,t3_aa12uk,7,False,False,aa12uk,
121,A dog will teach you unconditional love.,aww,t3_aa2xu9,2,False,False,aa2xu9,
122,"This is Eleven, she got a home for Christmas.",aww,t3_a9th7k,37,False,False,a9th7k,
123,A Pregnant Guinea Pig,aww,t3_aa0g8h,11,False,False,aa0g8h,
124,Granda gets surprised for Christmas with a pup and falls in love already,aww,t3_a9qa7e,353,True,False,a9qa7e,
125,"Shampooed, conditioned, and blow dried cows",aww,t3_aa2le5,4,False,False,aa2le5,
126,Mini Dalmatian,aww,t3_aa0qzi,2,False,False,aa0qzi,
127,My mom’s dog just gave birth to four perfect little moo moos.,aww,t3_aa1dsg,3,False,False,aa1dsg,
128,Oh hi there...,aww,t3_aa31ij,0,False,False,aa31ij,
129,True gentlemen,aww,t3_aa2qf0,3,True,False,aa2qf0,
130,Yeah that’s the spot!,aww,t3_aa2m02,4,True,False,aa2m02,
131,How can I help?,aww,t3_a9przq,256,False,False,a9przq,
132,"Felt cute, might delete later!",aww,t3_aa25la,2,False,False,aa25la,
133,A stunning piebald fawn being adorable - one of the things he does best,aww,t3_aa0y49,5,False,False,aa0y49,
134,Beginner howl,aww,t3_aa0tfr,3,True,False,aa0tfr,
135,Some big cats lion around,aww,t3_aa18lj,2,False,False,aa18lj,
136,Nothing to see here. Just two dudes chilling,aww,t3_a9qcz7,77,True,False,a9qcz7,
137,"Meet Mauro, my first son. He was born on Christmas eve. He's so perfect :-)",aww,t3_aa29fm,8,False,False,aa29fm,
138,My friend's dog looks like Dobby,aww,t3_aa2dhd,2,False,False,aa2dhd,
139,"I had to leave town during the holidays, so I left my cat at my girlfriend's house. Just received this, I think she's fine!",aww,t3_aa0xsb,3,False,False,aa0xsb,
140,"This is Winry, but we just call her Floof.",aww,t3_a9wptp,19,False,False,a9wptp,
141,Pidgeon defending her adopted child,aww,t3_a9zga6,7,False,False,a9zga6,
142,Meet my kitten Lord Vader,aww,t3_aa151z,4,False,False,aa151z,
143,"This is our good girl dapple doxie, Maggie Mae!",aww,t3_aa0rah,0,False,False,aa0rah,
144,Glass door,aww,t3_aa2azr,2,False,False,aa2azr,
145,"14 year old Skittles. She has developed a love for screaming loudly for no reason. Demented old thing, but she means the world to me!",aww,t3_aa0ecm,15,False,False,aa0ecm,
146,They said she was a runt but she's grown a lot in 4 weeks time,aww,t3_aa1n9d,1,False,False,aa1n9d,
147,Trying to take the tree down but we’ve got a protester.,aww,t3_a9xbl3,5,False,False,a9xbl3,
148,He's so brave,aww,t3_a9te9c,39,False,False,a9te9c,
149,Nothing like a mother's hug.,aww,t3_a9pmxq,104,False,False,a9pmxq,
150,"I rescued this sweet girl about 8 months ago. Today we celebrated her first real Christmas in a safe, loving home.",aww,t3_a9ybr4,5,False,False,a9ybr4,
151,Rare white lion cubs,aww,t3_aa1p7a,2,False,False,aa1p7a,
152,"Adopted a Kitty for Christmas, caught her being weirdo",aww,t3_aa15nd,2,False,False,aa15nd,
153,Scout the Beagle at my parents house,aww,t3_aa2yzb,2,False,False,aa2yzb,
154,Regina our golden eyed little charmer,aww,t3_aa22fd,1,False,False,aa22fd,
155,Stumbled upon this picture of Bob Ross with his squirrels.,aww,t3_a9xi7c,14,False,False,a9xi7c,
156,Must pet,aww,t3_a9xj73,2,False,False,a9xj73,
157,Gabriel is quickly becoming my new best friend!,aww,t3_a9zzw8,1,False,False,a9zzw8,
158,His face says it all,aww,t3_aa0uoq,4,True,False,aa0uoq,
159,Reddit meet Buddy,aww,t3_aa2sv7,8,False,False,aa2sv7,
160,Tfw you’ve been living under a dirty porch your entire life but then get swept away and see buildings for the first time.,aww,t3_a9plgt,118,True,False,a9plgt,
161,it's only stalking if you get caught,aww,t3_aa0d3n,3,False,False,aa0d3n,
162,Couldn't find a chicken. This will have to do.,aww,t3_aa0msh,11,False,False,aa0msh,
163,Couldn’t leave out my old lady at Christmas,aww,t3_a9zif5,1,False,False,a9zif5,
164,Golden bush tail possum,aww,t3_aa2v6a,1,False,False,aa2v6a,
165,My big old sweet old happy senior dog Chelsea resting after going for a “walk” to the mailbox. 💓,aww,t3_aa2bww,0,False,False,aa2bww,
166,The freshest of new kittens! Meet Olive the newest addition to my family!,aww,t3_aa2rtu,3,False,False,aa2rtu,
167,"Not a traditional puppy/kitty, but my wife got me wood and a knife for christmas. Was able to make her a tiny heart with it",aww,t3_aa06j9,10,False,False,aa06j9,
168,Little Bean,aww,t3_aa1p7s,8,False,False,aa1p7s,
169,Got to pet this pretty kitty for the first time in months!,aww,t3_aa2czn,1,False,False,aa2czn,
170,"I’m a cat whisperer. When I go to people’s houses, their cats always like me better than the owners .",aww,t3_aa2lmr,5,False,False,aa2lmr,
171,"She couldn’t see herself in the mirror, so she improvised",aww,t3_aa1pzl,3,False,False,aa1pzl,
172,Thats too sweet,aww,t3_aa39f8,2,False,False,aa39f8,
173,I met a real live furball today!,aww,t3_a9pk08,58,False,False,a9pk08,
174,Burrito,aww,t3_aa1oxm,4,False,False,aa1oxm,
175,My sisters cat isn’t happy about the 5 hour drive we’ve forced her into,aww,t3_aa1242,6,False,False,aa1242,
176,Hi!,aww,t3_aa2k8q,2,False,False,aa2k8q,
177,"Puppy eyes, and an ear.",aww,t3_aa1ucl,2,False,False,aa1ucl,
178,The happiness in their eyes is too much to handle,aww,t3_aa0vsq,2,False,False,aa0vsq,
179,Camouflage level: EXPERT,aww,t3_a9xkla,3,True,False,a9xkla,
180,Animal friendship,aww,t3_aa2bzq,2,False,False,aa2bzq,
181,Another beautiful moment brought to you by Milo.,aww,t3_aa024h,2,True,False,aa024h,
182,Floof doggo to cheer you up,aww,t3_a9pj5v,45,False,False,a9pj5v,
183,Never trust a man who doesn’t like cats.,aww,t3_aa37v5,7,False,False,aa37v5,
184,Zeus is an old boy and has no more teeth. Lil man can't keep it in anymore.,aww,t3_aa2j99,1,False,False,aa2j99,
185,this is one of the cutest mother daughter kitty pictures I have ever seen,aww,t3_a9xb3a,3,False,False,a9xb3a,
186,A wild cat appears,aww,t3_aa1lhb,0,False,False,aa1lhb,
187,Curiosity stewed the cat.,aww,t3_aa14la,2,False,False,aa14la,
188,"Saving one dog will not change the world, but surely for that one dog, the world will change forever.",aww,t3_a9r5v1,22,False,False,a9r5v1,
189,Dog loves rooftops,aww,t3_a9qt9g,43,False,False,a9qt9g,
190,"A small frog. I hope people find this cute, as most people I know wouldn’t consider frogs “aww” material. (OC)",aww,t3_a9zcys,4,False,False,a9zcys,
191,My world's cutest kitty,aww,t3_aa2qy0,3,False,False,aa2qy0,
192,This is Nova. She's a sweet girl.,aww,t3_a9sulq,26,False,False,a9sulq,
193,My little Puppy,aww,t3_a9zpxy,1,False,False,a9zpxy,
194,Gorgeous eyes on a cutie,aww,t3_a9pfar,29,False,False,a9pfar,
195,My Pet is like my Son,aww,t3_aa2wq7,1,False,False,aa2wq7,
196,Monster attacks helpless human,aww,t3_a9tc0f,32,True,False,a9tc0f,
197,"Meant to get a dog, grabbed a brown bear instead.",aww,t3_aa1qhb,4,False,False,aa1qhb,
198,Bunny strongly disapproves of kisses,aww,t3_aa2ifp,1,False,False,aa2ifp,
199,2 doggos on the beach sharing a stick,aww,t3_a9pn1l,28,False,False,a9pn1l,
200,My girlfriend's mini-aussie trying to look as pathetic as possible.,aww,t3_aa2wmc,1,False,False,aa2wmc,
201,Cats choose us; we don’t own them.,aww,t3_aa1sa3,0,False,False,aa1sa3,
202,Casually celebrating all the toys we just got,aww,t3_aa0dpn,0,False,False,aa0dpn,
203,A photogenic cat I met in Jerusalem,aww,t3_aa0ppx,5,False,False,aa0ppx,
204,"My fiancee, my Australian Shepherd puppy, and my Husky-Shepherd-Chow rescue dozing.",aww,t3_a9zgxz,3,False,False,a9zgxz,
205,This good doggo always comes to say good morning when I stay with my parents. She’s so lovely.,aww,t3_aa0umm,0,False,False,aa0umm,
206,My sweet boy... I’ve never had a cat I’ve loved so much in my whole life.,aww,t3_a9pgg5,57,False,False,a9pgg5,
207,Crazy what a difference time can make.,aww,t3_a9yyel,6,False,False,a9yyel,
208,The best photo I’ll ever take of her,aww,t3_aa0jlc,3,False,False,aa0jlc,
209,She waits to eat until dad says it’s okay.,aww,t3_aa2nta,4,False,False,aa2nta,
210,A love hate relationship,aww,t3_aa355l,0,False,False,aa355l,
211,"you sir, are a cat; a fat one.",aww,t3_aa284k,2,False,False,aa284k,
212,"Is it real? Don’t know, but I’m not taking a chance.",aww,t3_aa173s,3,True,False,aa173s,
213,My useless wedding assistant,aww,t3_aa026f,2,False,False,aa026f,
214,What’s wrong Was I too aggressive,aww,t3_aa0kmv,2,True,False,aa0kmv,
215,Snow Leopard cub startles mom and himself.,aww,t3_a9omt0,177,False,False,a9omt0,
216,Our little guy when we found him (2 months old) vs now (almost 5 months old),aww,t3_aa37am,1,False,False,aa37am,
217,Met this cutie the other day.,aww,t3_aa2xdq,2,False,False,aa2xdq,
218,"Meet Gulliver, Jedi Master.",aww,t3_aa2bv9,2,False,False,aa2bv9,
219,I love you and your derp face,aww,t3_aa169u,0,False,False,aa169u,
220,Since everyone else is still on vacation I got to bring my good boy to work with me today.,aww,t3_a9pemb,127,False,False,a9pemb,
221,This cat comes every day looking for a snack.,aww,t3_a9prwp,167,True,False,a9prwp,
222,For Christmas my mother gave me a pillow of my cat sitting on his hind legs.,aww,t3_aa0isb,6,False,False,aa0isb,
223,My pug always had boundless energy. Then he spent the day with a corgi puppy.,aww,t3_aa0avb,3,True,False,aa0avb,
224,Meet Luna!,aww,t3_aa308b,1,False,False,aa308b,
225,Helpful Trash Panda,aww,t3_a9zly3,4,True,False,a9zly3,
226,My 12 year old best friend,aww,t3_aa1ol4,3,False,False,aa1ol4,
227,Husker get wrapped.,aww,t3_a9zz1n,2,False,False,a9zz1n,
228,It’s the paperboy.,aww,t3_aa0llz,2,True,False,aa0llz,
229,Just got new storage bins. 15 minutes later...,aww,t3_a9ulzl,10,False,False,a9ulzl,
230,A Super Cute Baby Owl,aww,t3_aa31uz,4,False,False,aa31uz,
231,"Our Lab Dany's favorite past time is getting things around the house she isn't supposed to have and trying to get us to chase her around the house. When we don't chase her, she will wait patiently until we do, sometimes until she falls asleep with the item still in her mouth.",aww,t3_aa312m,1,False,False,aa312m,
232,Some sun shining on him,aww,t3_aa2rlj,2,False,False,aa2rlj,
233,My cat when I was leaving this morning,aww,t3_aa2qzj,2,False,False,aa2qzj,
234,An island full of bunnies! The babies were the only ones I wanted to play with.,aww,t3_aa0i2f,2,False,False,aa0i2f,
235,Just Taking a Nap,aww,t3_a9vceg,5,False,False,a9vceg,
236,Woke up to her practicing to be the new Dumbo,aww,t3_aa03dy,1,False,False,aa03dy,
237,My Freind's Bunny,aww,t3_aa1iaa,2,False,False,aa1iaa,
238,My golden boy!,aww,t3_aa2nzh,0,False,False,aa2nzh,
239,HelPlESs dOg iS rIpPEd To SHREds bY A vICIouS BEaSt,aww,t3_aa15bs,0,False,False,aa15bs,
240,Cat-blackmailer,aww,t3_aa31d9,0,False,False,aa31d9,
241,Any bulldog fans?,aww,t3_aa2hyi,1,False,False,aa2hyi,
242,"My parents cat, Hozzy, doesn't understand why I love taking pictures of him",aww,t3_aa2w36,0,False,False,aa2w36,
243,Life Choices,aww,t3_a9yayh,5,False,False,a9yayh,
244,My parent's cat Pippin is the master of the house.,aww,t3_aa2vnk,0,False,False,aa2vnk,
245,16 Years old and still going strong.,aww,t3_aa2vkh,1,False,False,aa2vkh,
246,Puppy and her binky,aww,t3_a9u3oy,12,True,False,a9u3oy,
247,"50% Bernese, 50% Samoyed, 100% freaking adorable! Reddit meet King Gus",aww,t3_aa1lje,4,False,False,aa1lje,
248,My friend's cat drinking water 😭,aww,t3_aa2818,2,True,False,aa2818,
249,My view every morning while I get ready for work 😍,aww,t3_a9x5pc,8,False,False,a9x5pc,
250,Could have been worse,aww,t3_a9pwuj,37,True,False,a9pwuj,
251,Something seems to be missing,aww,t3_aa0vgf,1,False,False,aa0vgf,
252,"Desmond (Left) went missing a few days before Christmas, thankfully we found him within 24 hours! His brother Winston is very happy to have him back, but still a little concerned.",aww,t3_aa1xnh,0,False,False,aa1xnh,
253,Cheeky goat,aww,t3_a9vzf8,7,False,False,a9vzf8,
254,My floofy girl in her Christmas jacket ❤️,aww,t3_aa378y,4,False,False,aa378y,
255,"This is Toasted Marshmallow, Toast for short. She’ll only drink from a running tap.",aww,t3_aa2lsn,2,False,False,aa2lsn,
256,When your crush kisses your cheek,aww,t3_aa2c0b,1,False,False,aa2c0b,
257,"This is Kelby. I rescued her from the shelter, but she's the one who saved me.",aww,t3_aa23gd,2,False,False,aa23gd,
258,Father and son.,aww,t3_aa22xp,0,False,False,aa22xp,
259,Cat is always hungry.,aww,t3_a9y17t,4,True,False,a9y17t,
260,"This is little Dixon and yes, he is really soft ☺️",aww,t3_aa1qjf,0,True,False,aa1qjf,
261,My best friend Onyx. Had to leave him with a friend in Ohio when I moved to Arizona. Finally flying back to get him in a month.,aww,t3_aa2kex,0,False,False,aa2kex,
262,Some people thought you’d appreciate this,aww,t3_aa2zm9,0,False,False,aa2zm9,
263,Yes I can fly with confidence,aww,t3_aa2zl5,3,False,False,aa2zl5,
264,My uncle got a fishing rod to play with the animals.,aww,t3_aa2ooc,0,True,False,aa2ooc,
265,83 years and 10 months!,aww,t3_a9yt7s,5,False,False,a9yt7s,
266,Those eyes,aww,t3_aa2632,1,False,False,aa2632,
267,Banana,aww,t3_aa16hk,3,False,False,aa16hk,
268,"This is Ginger, our 16 year old Shepard mix. She is doing hydro therapy to help improve her walkies. She use to hike many many miles at once.",aww,t3_aa0xhk,3,False,False,aa0xhk,
269,Curious kitty,aww,t3_aa2817,0,False,False,aa2817,
270,"My 7 mo old kitten has seperation anxiety, this is how I wake up every morning",aww,t3_aa0fin,3,False,False,aa0fin,
271,Favorite photo of my good boy 💜,aww,t3_aa31bs,3,False,False,aa31bs,
272,This date looks like it's going well,aww,t3_a9o335,663,False,False,a9o335,
273,Today is my best friends 5th birthday! Happy Birdy Axel Steel!,aww,t3_aa120g,11,False,False,aa120g,
274,"Meet Aspen, The Goodest Boye",aww,t3_a9zape,2,False,False,a9zape,
275,Little Chungus,aww,t3_aa14qi,5,False,False,aa14qi,
276,This is how my dog lays when he wants attention,aww,t3_aa07of,3,False,False,aa07of,
277,Bought them matching robes for Christmas and now we can’t tell them apart!,aww,t3_a9oajr,91,False,False,a9oajr,
278,This good boy is now one year old!!,aww,t3_aa11d8,2,False,False,aa11d8,
279,My dog maple getting pet just right,aww,t3_aa1lal,1,True,False,aa1lal,
280,Beelzebub the Hemingway cat has 6 toes on 3 of his feet.,aww,t3_aa1t34,4,False,False,aa1t34,
281,Repost but hilarious,aww,t3_a9za88,4,True,False,a9za88,
282,How cute is this monkey,aww,t3_aa0s8k,3,True,False,aa0s8k,
283,Real Christmas spirit!,aww,t3_aa3bmj,1,False,False,aa3bmj,
284,"Luna is a sleepy kitty, she sends her love!",aww,t3_aa2oq0,0,False,False,aa2oq0,
285,Collects all of my shoes in his bed and is so proud of it.,aww,t3_aa1kfu,0,True,False,aa1kfu,
286,I love this boy with all of my heart.,aww,t3_aa1wdn,0,False,False,aa1wdn,
287,"My best friend Jaxon. He wasn’t supposed to live past 4 and here we are, celebrating his 11th birthday soon! He doesn’t stay still long enough for photos so I had to sneak one in his sleep. I love you buddy no matter how dumb you are.",aww,t3_aa1o48,0,False,False,aa1o48,
288,When she wants me to rub her belly,aww,t3_aa29fs,0,False,False,aa29fs,
289,This is what happens when the sunlight reflects off of my phone and shines on the wall behind the couch.,aww,t3_aa1nzv,0,False,False,aa1nzv,
290,Poker face. Don’t know what I’ll do without my Copper,aww,t3_aa20a8,0,False,False,aa20a8,
291,It's Loki's first birthday today and he still carries around his favorite toy,aww,t3_aa34ru,2,True,False,aa34ru,
