,title,subreddit,name,num_comments,is_video,pinned,id,selftext
306,happy new year,aww,t3_abh28o,2,False,False,abh28o,
307,Just another sleeping position,aww,t3_ab7vzy,67,False,False,ab7vzy,
308,"Meet Mimi, my shiba pupper!",aww,t3_abjwq2,0,False,False,abjwq2,
309,"My yellow ball of love, Cheese! Originally found as a stray kitten at a waterpark, now he's a spoiled cat that rules our neighborhood.",aww,t3_abkhlf,3,False,False,abkhlf,
310,When I was young Jiji and Salem were the cats that sparked my love for sassy black cats. I wish mine could talk too.,aww,t3_abjskp,3,False,False,abjskp,
311,"My childhood dog turned 14 recently. She’s lost her hearing, but she still knows she’s the goodest ☝️",aww,t3_abhqwn,1,False,False,abhqwn,
312,This Iceberg looks like a front of a ruin of a castle,aww,t3_abkg04,5,False,False,abkg04,
313,"Nibbler was the runt of his litter, but he has grown into a handsome cat with beautiful, golden eyes.",aww,t3_abkbe9,1,False,False,abkbe9,
314,Nothing better than spending the first day of the new year with this guy ♥️,aww,t3_abk6u5,1,False,False,abk6u5,
315,Happy New Year from the goodest smol octoboi! 🎉💥💫🎊,aww,t3_abifku,3,False,False,abifku,
316,How we started the new year,aww,t3_abkpd8,0,False,False,abkpd8,
317,A friendly squirrel,aww,t3_abk639,1,False,False,abk639,
318,Smooch,aww,t3_abk5v1,1,True,False,abk5v1,
319,Bow tie,aww,t3_abjqag,0,False,False,abjqag,
320,Itty bitty baby isn't ready to come out yet,aww,t3_abhh2v,3,False,False,abhh2v,
321,welcome 2019,aww,t3_abgy9y,2,False,False,abgy9y,
322,Hazel in her favorite mug!,aww,t3_ab8pte,28,False,False,ab8pte,
323,They look innocent,aww,t3_abkj4k,0,False,False,abkj4k,
324,GRRRRRRR! :),aww,t3_abe1dc,6,False,False,abe1dc,
325,My little girl gave a big smile!,aww,t3_abk42p,0,False,False,abk42p,
326,Ready! Attention!...,aww,t3_abkxik,1,False,False,abkxik,
327,Doggo attacks kitties!,aww,t3_abkqsk,0,True,False,abkqsk,
328,Puss in boot 🖤,aww,t3_abivlw,1,False,False,abivlw,
329,You are eternally loved. 💛,aww,t3_abi8i3,7,False,False,abi8i3,
330,Lulu is being extra cuddly this winter morning,aww,t3_abkfna,0,False,False,abkfna,
331,My dogs always loved reading,aww,t3_abkpr4,0,False,False,abkpr4,
332,"A Mouse-Deer is the smallest hoofed animal, weighing only 4lbs and standing at 12 inches tall",aww,t3_abhoma,6,False,False,abhoma,
333,I’m finally a dad. Look at those cheeks!,aww,t3_ab7up1,2388,False,False,ab7up1,
334,My cat loves to watch my husband play Spider-Man,aww,t3_abkt56,3,False,False,abkt56,
335,Happy New year everybirdy!,aww,t3_abkssi,0,False,False,abkssi,
336,Fancy feet.,aww,t3_abksmg,2,False,False,abksmg,
337,Aww,aww,t3_abkwmr,2,False,False,abkwmr,
338,"New to this site, but always see my boyfriend liking pics from this sub-reddit. So here’s a pic of our lovely little lad, Thomas, a two year old rescue who is very glad the fireworks from last night have stopped.",aww,t3_abipcg,0,False,False,abipcg,
339,Pay attention to me!,aww,t3_abk1af,3,False,False,abk1af,
340,Fang face !,aww,t3_abixf9,3,False,False,abixf9,
341,Ginger gal,aww,t3_abjat7,0,False,False,abjat7,
342,Adopted this lil guy from Hungary 3 months ago and he hasn't left my side ever since!,aww,t3_abhsb7,1,False,False,abhsb7,
343,Give love and take love,aww,t3_abjo7d,1,False,False,abjo7d,
344,She doesn’t want me to stroke her while she sleeps.,aww,t3_abkvns,0,False,False,abkvns,
345,Here's my scooby doo girl,aww,t3_abie8n,1,False,False,abie8n,
346,My mastador Jackie &lt;3,aww,t3_abiolq,3,False,False,abiolq,
347,Does anyone else get love mauled?,aww,t3_abjno9,2,False,False,abjno9,
348,Emm... Why are you looking at me like that?,aww,t3_abhiw4,4,False,False,abhiw4,
349,meet Grace my 1yo swiss mountain dog,aww,t3_abkp3o,2,False,False,abkp3o,
350,"12 today, he's a good boy",aww,t3_abl810,0,False,False,abl810,
351,Babysat this little guy during new years!,aww,t3_abkow2,0,False,False,abkow2,
352,"My 10 month and 2 month corgis, Naboo and Jedi ❤",aww,t3_abjn49,1,False,False,abjn49,
353,These ears!!!,aww,t3_abjzb2,0,False,False,abjzb2,
354,"My Dog Chewed his bed up in Secret, but Didn't Realise he Still had this ball of Fluff on his chin...",aww,t3_abjuw3,1,False,False,abjuw3,
355,The handsome devil,aww,t3_abilr2,4,False,False,abilr2,
356,My BIL's kitty hopes you're not too hangover today,aww,t3_abi66d,0,False,False,abi66d,
357,I found this rabbit that wandered into my yard,aww,t3_abki8n,5,False,False,abki8n,
358,Hehhh leaves !,aww,t3_abl5u0,0,False,False,abl5u0,
359,What are you doing paw?,aww,t3_abft0l,3,True,False,abft0l,
360,Happy New Year!,aww,t3_abjxcq,0,False,False,abjxcq,
361,"Hunter and Beverly (kitten) from the day I brought her home to just now, 6 weeks to 6 months",aww,t3_abl5ho,3,False,False,abl5ho,
362,He did not appreciate dressing up last night. Happy new year everyone!,aww,t3_abhved,1,False,False,abhved,
363,My sister's cat takes his revenge,aww,t3_abjah4,1,True,False,abjah4,
364,Sphinx cats are cute too!,aww,t3_abl4n2,0,False,False,abl4n2,
365,Sometimes you just need a puppy 🐶😍😍😍,aww,t3_abl4dv,3,False,False,abl4dv,
366,LMAO,aww,t3_abkr8d,3,False,False,abkr8d,
367,Soo cold today!,aww,t3_abkl63,0,False,False,abkl63,
368,Chunky boy sits like this to watch tv.,aww,t3_abi7va,8,False,False,abi7va,
369,My view first thing every morning. Her name is Lil Bean.,aww,t3_abj09w,0,False,False,abj09w,
370,My scared cat hidding from yesterday night fireworks,aww,t3_abk3kt,0,False,False,abk3kt,
371,Moms New Puppy,aww,t3_abisb6,0,False,False,abisb6,
372,Cat selfie,aww,t3_abj543,2,False,False,abj543,
373,babe.. people are watching,aww,t3_abj4hk,0,True,False,abj4hk,
374,My new labradoodle has the most boopable nose,aww,t3_abe349,5,False,False,abe349,
375,a gentle boi,aww,t3_abkhw9,0,False,False,abkhw9,
376,E.T phone home!,aww,t3_abkbm5,1,False,False,abkbm5,
377,This is Nugget. Also known as the Nug-Bug:),aww,t3_abl6iq,3,True,False,abl6iq,
378,He forgot he was an animal😂🤫,aww,t3_abl6a9,3,False,False,abl6a9,
379,My first rescue pup. Coming up on 2 years with us,aww,t3_abjffy,2,False,False,abjffy,
380,That look of adoration..,aww,t3_ab67zq,97,True,False,ab67zq,
381,My Dad's cat. He just started sleeping like this and also lays down to eat. His name is Chairman Meow.,aww,t3_abjzlc,1,False,False,abjzlc,
382,"Feeling cute, might delete later",aww,t3_abhwu6,3,False,False,abhwu6,
383,"I’ve had enough of your shit, Karen",aww,t3_abi602,3,False,False,abi602,
384,Always wanting to play,aww,t3_abkkkb,0,False,False,abkkkb,
385,her look after one bite of fish,aww,t3_abl4ja,0,False,False,abl4ja,
386,Happy New Year!,aww,t3_abl431,1,False,False,abl431,
387,Doggo helps another,aww,t3_abhv22,11,False,False,abhv22,
388,Lazy day off filled with cuddles,aww,t3_abkw2y,0,False,False,abkw2y,
389,Nap time,aww,t3_abjfz8,0,False,False,abjfz8,
390,January 1.st - we all know the feeling...,aww,t3_abl2h0,2,False,False,abl2h0,
391,After he eats breakfast. He comes and sits with me to get all the lovin’,aww,t3_abd9ct,8,True,False,abd9ct,
392,Look at this good boy,aww,t3_abjjad,1,False,False,abjjad,
393,This little guy looks like he has mittens on!,aww,t3_abko5a,3,True,False,abko5a,
394,Dog with a ball,aww,t3_abjj6g,0,False,False,abjj6g,
395,Simetimes i think she knows she needs to pose for a photo and does just that.,aww,t3_abko2v,0,False,False,abko2v,
396,Best boys....,aww,t3_abhxca,0,False,False,abhxca,
397,My pup’s nose looks like a heart!,aww,t3_abj80v,1,False,False,abj80v,
398,My name is Cheddar. But my owners call me the Block o' Cheese :),aww,t3_abl8n3,1,False,False,abl8n3,
399,“Act natural”,aww,t3_abfybd,5,True,False,abfybd,
400,Bolafa is doing better after rescue by Lola Ya Bonobo Sanctuary,aww,t3_abjaku,0,False,False,abjaku,
401,Zoom,aww,t3_abkt77,0,False,False,abkt77,
402,Good girl,aww,t3_abjaeg,0,False,False,abjaeg,
403,Passed out before 6pm on NYE,aww,t3_abl00b,2,False,False,abl00b,
404,My dogs have reversed mismatched eyes,aww,t3_ab920g,43,False,False,ab920g,
405,Cat finds its dad that it barely knew.,aww,t3_abi5uv,0,False,False,abi5uv,
406,These two partied a little too hard for New Years,aww,t3_abklzr,0,False,False,abklzr,
407,Sleepy Kitty,aww,t3_abk3si,1,False,False,abk3si,
408,A nice and relaxing nap,aww,t3_abkym9,0,False,False,abkym9,
409,Just a soldier in the line of duty,aww,t3_abhpmh,3,False,False,abhpmh,
410,aww,aww,t3_abize6,1,True,False,abize6,
411,Dog with Viking hat,aww,t3_abl5wz,0,False,False,abl5wz,
412,Margaret doesn't do mornings well,aww,t3_ab9a26,35,False,False,ab9a26,
413,Starting the new year off right with a nice warm epsom salt foot soak.,aww,t3_abkp3y,0,False,False,abkp3y,
414,My friend added a new addition to her family.,aww,t3_abl3kv,0,False,False,abl3kv,
415,He is scared of the fireworks,aww,t3_abjuzz,0,False,False,abjuzz,
416,dont bother i can pet myself,aww,t3_abjhcz,1,False,False,abjhcz,
417,She doesn't like to be left alone in unfamiliar places,aww,t3_abhck2,3,False,False,abhck2,
418,My dog likes to be comfy. Here she is laying on three pillows,aww,t3_abka2e,0,False,False,abka2e,
419,"My little pooch Jasper, a good boy (most of the time)",aww,t3_abktje,1,False,False,abktje,
420,Look at this cute baby giraffe!,aww,t3_abidey,1,False,False,abidey,
421,"You pet, they smile",aww,t3_abkt8x,2,False,False,abkt8x,
422,“Oh sweety you’re using the new shark bed wr-.. No. You’re right. It’s better.”,aww,t3_abl0nh,0,False,False,abl0nh,
423,Bob says happy new year!! X,aww,t3_abk95w,0,False,False,abk95w,
424,Happy New Year from this dapper fella.,aww,t3_abl8xy,0,False,False,abl8xy,
425,Kitty's pink beeeanz!,aww,t3_abl0dv,1,False,False,abl0dv,
426,Hope you have a paws-itively amazing New Year!,aww,t3_abk389,1,False,False,abk389,
427,Puppy pose,aww,t3_abikru,0,False,False,abikru,
428,I just felt like taking a picture of my crested gecko with santa.,aww,t3_abi2ij,0,False,False,abi2ij,
429,"This is Lucy, the most well behaved, relaxed cat you'll ever meet.",aww,t3_abix6a,1,False,False,abix6a,
430,My best buddy celebrating his 11th New Year.,aww,t3_abh0aa,2,False,False,abh0aa,
431,he make me big smile,aww,t3_abl75y,0,False,False,abl75y,
432,"Wolf, 2016 and today",aww,t3_abhw9m,0,False,False,abhw9m,
433,Caught a huge dust mite yesterday.,aww,t3_abiwjh,1,False,False,abiwjh,
434,Doggos gotta stick together,aww,t3_ab5rui,126,False,False,ab5rui,
435,Mom's new puppy,aww,t3_abim2r,1,False,False,abim2r,
436,Zzzzzzzzzz,aww,t3_abky6l,0,False,False,abky6l,
437,"Adopted this cuddly cat from my local Humane Society last year during $20 New Year’s adoptions. It’s her birthday today, so please party and drink accordingly.",aww,t3_ab7vgl,41,False,False,ab7vgl,
438,Happy new year from Pretzel Kitten!,aww,t3_abkxrr,0,False,False,abkxrr,
439,Watching the sunset and this cute random dog came up wanting to be pet 🐾,aww,t3_abj20m,2,False,False,abj20m,
440,"Mango, my 15 year old little squidge",aww,t3_abkq0r,0,False,False,abkq0r,
441,Our new kitty 🤠,aww,t3_abh4mt,4,False,False,abh4mt,
442,Poser.,aww,t3_abkiov,0,False,False,abkiov,
443,Alpacas are too cute!,aww,t3_abicpj,1,False,False,abicpj,
444,Excuse me sir don’t stop!,aww,t3_abjpa3,0,True,False,abjpa3,
445,"My little brother, Jax",aww,t3_abjkka,3,False,False,abjkka,
446,❤️,aww,t3_abkp79,0,False,False,abkp79,
447,Tried to take cute Christmas photos of my dog. Didn't exactly gl as well as hoped.,aww,t3_abkov9,0,False,False,abkov9,
448,My New Year's Resolution is to enjoy eating my greens half as much as she does,aww,t3_abkorr,0,False,False,abkorr,
449,hi i'm a husky too,aww,t3_abkguu,1,False,False,abkguu,
450,My kitty Little Guy,aww,t3_abl3en,0,False,False,abl3en,
451,"Happy to be passed the holidays, but it sure was fun celebrating them with this brand new human in our lives 💙",aww,t3_abiolm,5,False,False,abiolm,
452,Got a call at the police department that this beautiful boy lost his elderly owners and needed a home...my home apparently.,aww,t3_abc2t0,20,False,False,abc2t0,
453,My nephew and his younger brothers and sisters,aww,t3_abitmi,2,False,False,abitmi,
454,"Hello, I'm Ellie!",aww,t3_abi2l9,2,False,False,abi2l9,
455,This little angel was rescued from a meat farm in China. Meet Joe!,aww,t3_abib4a,3,False,False,abib4a,
456,Put your paws where I can see them!,aww,t3_abicyx,0,False,False,abicyx,
457,Happy New Year from our sleepy pup,aww,t3_abjmze,1,False,False,abjmze,
458,Very good boy here to high-five you for getting through 2018,aww,t3_abcrz4,2,True,False,abcrz4,
459,All my friends ditched me so I guess I am spending NYE all alone with this guy &lt;3,aww,t3_abe23y,16,False,False,abe23y,
460,He looks so proud!,aww,t3_abc1kx,5,False,False,abc1kx,
461,Too much to handle for her 10th B'day Party,aww,t3_abl260,2,False,False,abl260,
462,Here's my boom boom dog,aww,t3_abktri,0,False,False,abktri,
463,I've been a long time lurker but I think I finally wanna make a post. Got this guy during the summer and hes been my little goofball ever since. Meet Axel.,aww,t3_abktr0,1,False,False,abktr0,
464,The cutest dog in the world,aww,t3_abk1wq,0,False,False,abk1wq,
465,Fireworks are loud and scary. Happy New year,aww,t3_abl16s,3,False,False,abl16s,
466,Happy little dreams,aww,t3_abd4pq,6,False,False,abd4pq,
467,Purrrrrrrrrr,aww,t3_abk7qv,0,False,False,abk7qv,
468,Dad you’re not holding the rawhide right!,aww,t3_abk758,1,False,False,abk758,
469,Avon Barksdale is ready for a New Year's treat,aww,t3_abk6q1,0,False,False,abk6q1,
470,Taking a nap :),aww,t3_abjg1j,0,False,False,abjg1j,
471,"The twins look the same, but there is one slight difference",aww,t3_ab606i,46,False,False,ab606i,
472,How we spent New Year’s Eve 🐶,aww,t3_abk5ta,0,False,False,abk5ta,
473,*staring intensifies*,aww,t3_abkizu,0,False,False,abkizu,
474,Happy New Year Everyone!,aww,t3_abjzem,1,False,False,abjzem,
475,Happy New Years from a toasty boy!,aww,t3_abjj9x,0,True,False,abjj9x,
476,Look at this marshmallow!,aww,t3_abkyga,0,False,False,abkyga,
477,Who's a good girl!?,aww,t3_abl79z,0,False,False,abl79z,
478,When Kitty still fit on me,aww,t3_abk502,2,False,False,abk502,
479,He is named Octavo,aww,t3_abgbiw,6,False,False,abgbiw,
480,Passed out after a hard night of partying,aww,t3_abl702,0,False,False,abl702,
481,Roy Kim's new puppy. I'm in love.,aww,t3_abk3os,0,True,False,abk3os,
482,Happy new year 🤗,aww,t3_abl5f6,0,False,False,abl5f6,
483,"It was my eight year old’s birthday yesterday, and we surprised her with skillet tickets, her favorite band EVER.",aww,t3_abkwa4,4,False,False,abkwa4,
484,Bird Fox Hat Apple Tree,aww,t3_abkgj0,2,False,False,abkgj0,
485,"Oh, hello!",aww,t3_abl4uj,0,False,False,abl4uj,
486,"Where I live, we don’t get much snow so I thought I’d make the most of it.",aww,t3_abily7,3,False,False,abily7,
487,My little fluff muffin Stinson,aww,t3_abjwm6,1,False,False,abjwm6,
488,Wrecks makes an autistic child feel better about needing glasses.,aww,t3_abl4ia,0,False,False,abl4ia,
489,Smiling duck i found at the park,aww,t3_abjc9m,5,False,False,abjc9m,
490,"Reddit, meet Cosmo. She’s very photogenic when she’s not destroying furniture!",aww,t3_abiqwz,0,False,False,abiqwz,
491,"Hi Reddit, I’m Maurice and today is my 17th birthday! Happy New Year!",aww,t3_abieiv,3,False,False,abieiv,
492,Modelling his Christmas present. Grandma makes him one for every season.,aww,t3_abjq58,0,False,False,abjq58,
493,Some good bois I saw going home this morning,aww,t3_abiq7t,3,True,False,abiq7t,
494,Anyone wanna take a crack at what this adorable little jerk did next? Meet Gir. His hobbies include biting my toes at random and judging me from the tallest perch of his cat tower.,aww,t3_abl3ai,2,False,False,abl3ai,
495,My cat is so cuties ☺️,aww,t3_abibnx,4,False,False,abibnx,
496,"Tiny Cat and Mau Mau, BFFs! 😍",aww,t3_abk7h0,0,False,False,abk7h0,
497,This is so cute :D,aww,t3_abj6xn,5,False,False,abj6xn,
498,"Meet AJ, he loves thinking he can go outside.",aww,t3_abklze,0,False,False,abklze,
499,A loving hug.,aww,t3_abjp8x,0,False,False,abjp8x,
500,My little staffy uses a pillow like a human 😍,aww,t3_abk0ok,2,False,False,abk0ok,
501,"This is the face of happiness. After being gone for a week for Christmas, Daddy came home! Happy New Year Pistachio!",aww,t3_abj6gi,0,False,False,abj6gi,
502,Old boi hogging toys from new boi,aww,t3_abjepw,1,False,False,abjepw,
503,"Marley, always falling asleep while sitting up.",aww,t3_abk5sg,0,False,False,abk5sg,
504,Let’s hope 2019 is slightly less humiliating,aww,t3_abksfu,1,False,False,abksfu,
505,Every single time! 🤣,aww,t3_abl0z2,0,False,False,abl0z2,
506,Just checking in,aww,t3_abkcd1,0,False,False,abkcd1,
507,Both my goofy girls,aww,t3_abjdj5,1,False,False,abjdj5,
508,When your bird is raised as a dog...,aww,t3_abckh1,12,True,False,abckh1,
509,schleepy kitty,aww,t3_abk4wp,0,True,False,abk4wp,
510,Going to the beach,aww,t3_abk4fe,0,False,False,abk4fe,
511,"My roommates kitty, Bandit. Watch till the end for a surprise 😺",aww,t3_abjxka,0,True,False,abjxka,
512,He had a long night.,aww,t3_abkzbx,0,False,False,abkzbx,
513,"Meet „Eve“ the foundling: I found her running on a Main Street, being obviously confused, young guys bugging her and she almost ran on the street. I saved this little baby and found a new home for her at my friends house. It was a happy New Years Eve 🍀",aww,t3_abjcg3,6,False,False,abjcg3,
514,"Picked up this little girl at the shelter. Reddit, meet Julia.",aww,t3_abg6a4,6,False,False,abg6a4,
515,Happy New Year from Ziggy on his 1st Birthday today!,aww,t3_abifsr,3,False,False,abifsr,
516,OMG look at this cats eyes,aww,t3_abhy4q,3,False,False,abhy4q,
517,"I've had enough of your shit, Caroline.",aww,t3_abhmij,6,True,False,abhmij,
518,The first day 2019 morning!,aww,t3_abhznf,1,False,False,abhznf,
519,Got to pet this chonk for New Years last night.,aww,t3_abifff,5,False,False,abifff,
520,Our 9 year old cat has really taken to the new kitten. He even initiated this cuddle session!,aww,t3_abkpnf,2,False,False,abkpnf,
521,"This boy was an outside kitty my mom used to feed who had an open sore on his side. He was still healing when she had to move to a new place, and she didn't have the heart to leave him behind. Now he's my sweet little towel boy!",aww,t3_abkpi6,2,False,False,abkpi6,
522,"My Dog, Duly, is afraid of his sisters...",aww,t3_abj2z9,6,False,False,abj2z9,
523,Someone brought a puppy into our locker room. She climbed up into my bag all by herself and just sat in my helmet so content for about 5 minutes.,aww,t3_abgphi,7,False,False,abgphi,
524,Lloyd was in the right mood for new years,aww,t3_abl7q7,0,False,False,abl7q7,
525,My sweet baby angel doing a heckin stair sit,aww,t3_abkxrk,9,False,False,abkxrk,
526,My cats like to stretch with me before I go for a run..,aww,t3_abj6mr,0,False,False,abj6mr,
527,I is human,aww,t3_abkgp6,0,False,False,abkgp6,
528,Have beards will travel- my two Scotties checking out the Theed Royal Palace.,aww,t3_abkoue,2,False,False,abkoue,
529,The gentleman,aww,t3_abhxf0,2,False,False,abhxf0,
530,Happy new year from a very adorable kitty!,aww,t3_abhc9x,1,False,False,abhc9x,
531,Dinner Is Served,aww,t3_abbqzm,15,False,False,abbqzm,
532,New Years naps,aww,t3_abkokz,0,False,False,abkokz,
533,Diesel reflecting on his diet progress this past year.,aww,t3_abi67h,1,False,False,abi67h,
534,This face at the dog park,aww,t3_abd5un,4,False,False,abd5un,
535,Bubble tries and fails to devour sweet innocent children,aww,t3_abkobn,0,False,False,abkobn,
536,Tierd cat fell asleep on its scratching toy intsead the bed.,aww,t3_abjjdt,4,False,False,abjjdt,
537,Happy New Year!,aww,t3_abl5zx,2,False,False,abl5zx,
538,Rolling into 2019 like:,aww,t3_abjeca,0,False,False,abjeca,
539,My girl Indie enjoying her new toy,aww,t3_abk146,0,False,False,abk146,
540,"In the last two weeks, Minnie has decided that she has to be right next to our toddler at all times.",aww,t3_abir2x,0,False,False,abir2x,
541,Cuddly cats:),aww,t3_abjoky,0,False,False,abjoky,
542,"Po, scared of the noisy wind, is hanging out with me in the computer room.",aww,t3_abhwjf,2,False,False,abhwjf,
543,My dad and one of our miniature goats,aww,t3_abkf10,2,False,False,abkf10,
544,Just comfy and content with life,aww,t3_abj9cg,0,False,False,abj9cg,
545,Anyone wanna kiss me?,aww,t3_abk0l6,1,False,False,abk0l6,
546,She’s the best doggo,aww,t3_abl4tw,1,False,False,abl4tw,
547,The goodest girl in the whole wide world. When she notices that I have a panic attack coming on she lays down at my feet and kisses me until she knows that I am safe. I don’t know what I would do without her.,aww,t3_abht0j,6,False,False,abht0j,
548,My cat since I was up way later than usual last night: “You’re in my chair”,aww,t3_abiapb,2,False,False,abiapb,
549,Thank You Comrade,aww,t3_abihoh,6,False,False,abihoh,
550,Stella thinks she’s musical. I think she’s a goofball.,aww,t3_abjt0i,2,False,False,abjt0i,
551,This scamp destroying my flip-flop - not even mad.,aww,t3_abi27v,0,False,False,abi27v,
552,"Look at this fishy eyes, what a cool color",aww,t3_abk5k4,1,False,False,abk5k4,
553,He knows he's the goodest boy,aww,t3_ab59cr,379,False,False,ab59cr,
554,"Hey, we have a guest!!!!",aww,t3_ab5vw6,148,False,False,ab5vw6,
555,My bf woke up early for breakfast so I get to wake up to this instead.,aww,t3_ab9mul,10,False,False,ab9mul,
556,Cute way to start the new year :-),aww,t3_abjbzv,0,False,False,abjbzv,
557,My new girl Ginger! She’s kinda dumb and very annoying when she decides she wants affection but she’s a keeper,aww,t3_abk527,1,False,False,abk527,
558,Gilbert,aww,t3_abhv1j,8,False,False,abhv1j,
559,"This is my cat Calypso. She's a robust, full-figured gal who likes wine corks, whipped cream caps, ping pong balls, napping, pooping on the floor, and of course, food.",aww,t3_abjqn6,0,False,False,abjqn6,
560,Rocky Dog 🐕 dog 🐶 friend Faith joins new community too,aww,t3_abkb1u,4,False,False,abkb1u,
561,Guess I’ll just fail my exams. Oh well.,aww,t3_abjf4z,1,False,False,abjf4z,
562,18 year old boi seeing in the new year,aww,t3_abid3h,0,False,False,abid3h,
563,Much love from these two 💖,aww,t3_abkajw,1,False,False,abkajw,
564,Buttons is wishing everyone a happy New Year!!,aww,t3_abe6yz,5,False,False,abe6yz,
565,Let’s just take a quick snooze,aww,t3_abjvw0,0,False,False,abjvw0,
566,"In their own beds, then in each other's beds, then in the same bed.",aww,t3_abh1c5,0,False,False,abh1c5,
567,Pupper after first proper bath. Sorry for lighting.,aww,t3_abjjdh,1,False,False,abjjdh,
568,Benjamin is a good boy.,aww,t3_abk86b,2,False,False,abk86b,
569,Kitty sitting pretty in the light,aww,t3_abilzl,0,False,False,abilzl,
570,Best Buddies have to be touching when they nap.,aww,t3_abky8x,0,False,False,abky8x,
571,My dad sent me this with the caption “one cool cat”,aww,t3_abkfr5,1,False,False,abkfr5,
572,"Jerry says hi, is he handsome ??",aww,t3_abj2ra,2,False,False,abj2ra,
573,Luna,aww,t3_abiynt,1,False,False,abiynt,
574,I promise he looks cute normally,aww,t3_abl7q3,1,False,False,abl7q3,
575,Retired bearded dragons,aww,t3_abi6at,8,False,False,abi6at,
576,She is one of the most special looking kitties I have ever seen,aww,t3_abfecs,7,False,False,abfecs,
577,"He's been an indoors cat for a few years now, and I think he loves it.",aww,t3_abj6e2,0,False,False,abj6e2,
578,Found this little poof at a bookstore.,aww,t3_abjfib,2,False,False,abjfib,
579,Our little Tiger,aww,t3_abl64a,0,False,False,abl64a,
580,How can you say no to those eyes?,aww,t3_abitfv,0,False,False,abitfv,
581,Not sure this belongs on this sub but it’s just so funny. Caught my cat in mid-yawn at the perfect moment.,aww,t3_abee9n,7,False,False,abee9n,
582,My aunts cat playing with her scratcher,aww,t3_abk4to,1,True,False,abk4to,
583,Casper the havanese pup LOVES chewing on socks!,aww,t3_abl57o,0,True,False,abl57o,
584,Chill level is a solid 10!,aww,t3_abj4gi,0,False,False,abj4gi,
585,Baby gecko I found outside.,aww,t3_abk3ck,2,False,False,abk3ck,
586,Smallest Yawn Ever,aww,t3_ab7na1,11,False,False,ab7na1,
587,Awww!!,aww,t3_abhpf1,2,True,False,abhpf1,
588,Big smiles for 2019!,aww,t3_abjvkn,0,False,False,abjvkn,
589,To boop or not to boop,aww,t3_abiv1e,3,False,False,abiv1e,
590,The first photo I ever saw of my baby girl,aww,t3_abji6b,1,False,False,abji6b,
591,My Lil buddies first Christmas and New Years. He certainly dressed for the occasion. Everyone. Meet Lincoln.,aww,t3_abihjd,0,False,False,abihjd,
592,Having a sleepy new year,aww,t3_abittz,1,False,False,abittz,
593,Just a few more minutes,aww,t3_abfar2,0,False,False,abfar2,
594,"I’m just gonna snuggle right up in here, alright?",aww,t3_abds4s,4,False,False,abds4s,
595,"Thats a pee pad, not a think pad.",aww,t3_abigkz,6,False,False,abigkz,
596,Fifi the Duchess of Floofery,aww,t3_abl0ea,0,False,False,abl0ea,
597,Cute lil deer,aww,t3_abipam,1,False,False,abipam,
598,🐈,aww,t3_abisiz,0,False,False,abisiz,
599,Someone was jealous of all the attention the new puppy was getting....,aww,t3_abfrnn,1,False,False,abfrnn,
600,🐈🐈,aww,t3_abkz3n,0,False,False,abkz3n,
601,Edison enjoying New Years Day,aww,t3_abi32o,1,False,False,abi32o,
602,"""Oh! Were you doing something? Hmm not anymore...""",aww,t3_abjxql,0,False,False,abjxql,
603,Meet Harry,aww,t3_abknpl,2,False,False,abknpl,
604,Rainbow Beauty,aww,t3_abkno2,1,False,False,abkno2,
605,How can you not say this is cute?,aww,t3_abhdh3,3,False,False,abhdh3,
606,She’s a sleepy doggo and I love her,aww,t3_abk56v,0,False,False,abk56v,
607,Happy New Year from Buddy the wonder pup!,aww,t3_abk56c,1,False,False,abk56c,
608,Special cat ❤❤,aww,t3_ab6co9,126,True,False,ab6co9,
609,Snuggles,aww,t3_abj8bd,0,False,False,abj8bd,
610,Brown fluff,aww,t3_abhk8a,3,False,False,abhk8a,
611,"If y’all drink tonight, please have a drink for my baby boy. His birthday is New Years!",aww,t3_abcn4i,26,False,False,abcn4i,
612,This is how my roommates cat sleeps,aww,t3_abiq4e,1,False,False,abiq4e,
613,"Ok...I guess I just won’t do laundry today, you win",aww,t3_abl82i,0,False,False,abl82i,
