,title,subreddit,name,num_comments,is_video,pinned,id,selftext
614,My best photo of 2018. He was 19 and my everything.,aww,t3_abgxgw,9,False,False,abgxgw,
615,New Years Napping,aww,t3_abjvww,0,False,False,abjvww,
616,Neville can be quite photogenic when he's not hiding,aww,t3_abjvp7,2,False,False,abjvp7,
617,My good girl lays on me like this all the time.,aww,t3_abhx89,2,False,False,abhx89,
618,He is so cute when he sleeps❤️,aww,t3_abkbut,0,False,False,abkbut,
619,He is so cute when he sleeps😍,aww,t3_abkbhg,0,False,False,abkbhg,
620,My dog Jayne looking lost after we wold him to lay his head down! He’s rebooting.,aww,t3_abjuzy,0,False,False,abjuzy,
621,🔥🐾🐶,aww,t3_abl6rk,0,False,False,abl6rk,
622,Fell asleep on the couch last night and woke up like this...,aww,t3_abiwod,0,False,False,abiwod,
623,"The fireworks won’t go away, but Baldr figured out a way to make it a little better. Even if Papa doesn’t realize it.",aww,t3_abf3p0,7,False,False,abf3p0,
624,Smooshed,aww,t3_abjude,2,False,False,abjude,
625,"My adopted pair had a hard time adjusting, but now they're back to bffs! Bella and Delores are ready for 2k19!",aww,t3_abj5s7,3,False,False,abj5s7,
626,Couldn’t be closer these two,aww,t3_abk1zc,0,False,False,abk1zc,
627,He loves his tunnel,aww,t3_abh3z7,5,False,False,abh3z7,
628,Just a boy and his cat,aww,t3_abjtyf,0,False,False,abjtyf,
629,Staying at a resort in the Bahamas and it came with a cat!,aww,t3_abiht4,5,False,False,abiht4,
630,"My brother's a big softie, here he is hearing his daughter's first words.",aww,t3_abjai7,1,False,False,abjai7,
631,First belly rub of 2019!,aww,t3_abk11k,0,False,False,abk11k,
632,Millie dreaming of catchin em all,aww,t3_abj4po,0,False,False,abj4po,
633,My dog is a derp! This is the look he gives me when we get back from a walk. (the thing that looks like a plane pillow is a temporary comfy way to keep him from licking his paws),aww,t3_abk9eq,0,False,False,abk9eq,
634,The hangover is real.,aww,t3_abh5lx,0,False,False,abh5lx,
635,It’s like she knows she’s pretty,aww,t3_abgmw2,3,False,False,abgmw2,
636,Friendly seal gets playful with diver,aww,t3_abj93e,2,False,False,abj93e,
637,Reunited lost cat Woody with his owner &amp; got a free bottle of rosé for it. Good start to the new year!,aww,t3_abjeg7,0,False,False,abjeg7,
638,Izzy (the all ginger one) can be a massive asshole but she loves her brother,aww,t3_abkh55,2,False,False,abkh55,
639,Baby elephant stopping to get this little guy off the road,aww,t3_abbopg,13,True,False,abbopg,
640,Rocco is not entertained.,aww,t3_abjqei,0,False,False,abjqei,
641,Puppy’s first time standing up to our other dog,aww,t3_abkfj0,0,True,False,abkfj0,
642,Happy New Year from Jeffrey the Poodle!,aww,t3_abj1hj,3,False,False,abj1hj,
643,"I was sick and bedridden, she alone was with me the whole day!",aww,t3_abhrdg,3,False,False,abhrdg,
644,Dreaming of the days when he was a hula dancer,aww,t3_abiol2,0,False,False,abiol2,
645,My girls ❤️❤️,aww,t3_abl0di,0,False,False,abl0di,
646,My stupid Dog stuck her head inside A box,aww,t3_abikjn,0,True,False,abikjn,
647,Good puppers taking a nap together after a long day running around,aww,t3_abjbpp,0,False,False,abjbpp,
648,Shadows trying her best to be a yin/yang. She’s a good girl.,aww,t3_abih44,3,False,False,abih44,
649,cute king kong,aww,t3_abfkmi,3,False,False,abfkmi,
650,"My French/American meatball of a cat. Reddit, meet Lucie",aww,t3_abhsbj,0,False,False,abhsbj,
651,Happiness,aww,t3_abhw7g,1,True,False,abhw7g,
652,Cute Baby Ocelots,aww,t3_abk3rg,0,False,False,abk3rg,
653,Rang in the new year with this 2-day old bundle of joy,aww,t3_abhu95,11,False,False,abhu95,
654,Got spayed and had a cone. She was glaring at us,aww,t3_abjnl5,1,False,False,abjnl5,
655,Robin looking comfy,aww,t3_abkner,0,False,False,abkner,
656,"Hello r/aww, meet Toffee! He’s a bit dumb but adorable&lt;3",aww,t3_abh5xm,4,True,False,abh5xm,
657,Best first mate I could ask for,aww,t3_abhvzs,1,False,False,abhvzs,
658,Kind of a pathetic aww..but my big boy needs knee surgery next week :(,aww,t3_abiqln,5,False,False,abiqln,
659,Chewie is contemplating his life choices,aww,t3_abky7e,0,False,False,abky7e,
660,Hi hoomans. My toy poodle Franklin here just wants to let you know you're doing great and you've got 2019.,aww,t3_abj3nq,1,False,False,abj3nq,
661,Starting 2019 like....,aww,t3_abkbdc,0,False,False,abkbdc,
662,That face.,aww,t3_abhzdz,1,False,False,abhzdz,
663,The face,aww,t3_abhz6z,0,False,False,abhz6z,
664,A little help here please,aww,t3_abhqqk,0,False,False,abhqqk,
665,This makes me drowsy AF... But it's cute seeing her fall asleep,aww,t3_abixt5,0,False,False,abixt5,
666,"My little oto perched atop the stake holding his lunch (blanched zucchini, yum!)",aww,t3_abjryv,0,False,False,abjryv,
667,Happy Mew Year! From a random kitty I encountered today.,aww,t3_abl8mr,0,False,False,abl8mr,
668,Happy holidays!,aww,t3_abi35e,0,False,False,abi35e,
669,Happy new year from Muffin!.. are the fireworks over yet?,aww,t3_abkuzm,1,False,False,abkuzm,
670,"No, no, no.. The fish are not eatable",aww,t3_abl800,0,False,False,abl800,
671,Ready and excited for 2019,aww,t3_abj6ov,1,False,False,abj6ov,
672,Tennis Ball Zoomies,aww,t3_abl7bv,1,True,False,abl7bv,
673,My babies,aww,t3_abi7oq,1,False,False,abi7oq,
674,"Everyone, meet Loki, 18 weeks old and already my best friend",aww,t3_abhr68,1,False,False,abhr68,
675,Maia loves her new cubby,aww,t3_abjino,0,False,False,abjino,
676,My little bunny friends :)),aww,t3_abl6ls,0,False,False,abl6ls,
677,I am a bit cold ;),aww,t3_abktj9,1,False,False,abktj9,
678,Meet Amino! Chihuahua Yorkie mix,aww,t3_abir2a,0,False,False,abir2a,
679,Meet Tubius! 10y old cat.,aww,t3_abhsrj,2,False,False,abhsrj,
680,"""Hello there""",aww,t3_ab5jsc,56,False,False,ab5jsc,
681,I heard we were doing NICU pics. Here’s the first time I held my son.,aww,t3_abf6s8,3,False,False,abf6s8,
682,My cat and my housemate’s cat are finally starting to get along ❤️,aww,t3_abkgex,2,False,False,abkgex,
683,HELLO ! It’s a NEW YEAR 🎈 ROCKY DOG 🐕 picks a NEW COMMUNITY 👅 CA CRUISING 🚘 ⛱ nothing but BLUE SKIES AHEAD 🌤,aww,t3_abk5v4,3,False,False,abk5v4,
684,she was so tired that fell asleep while eating his dinner,aww,t3_abhdlh,3,False,False,abhdlh,
685,Waking up with a hangover to this,aww,t3_abhfaq,4,False,False,abhfaq,
686,What was that?!,aww,t3_abies6,0,False,False,abies6,
687,Bailey waiting for her dessert.,aww,t3_abkfoa,2,False,False,abkfoa,
688,Say hello to my little friend!,aww,t3_abjw7r,0,False,False,abjw7r,
689,My two doggos Benji and Riley posing nicely for the camera.,aww,t3_abk59q,0,False,False,abk59q,
690,This is Splat. Taken right before she maneuvers her eyeball in to the fingertip.,aww,t3_abjgch,0,False,False,abjgch,
691,"Stayed home with the dog on NYE, probably the best option",aww,t3_abdux7,9,False,False,abdux7,
692,"9 years old, and still no idea how to use a scratching post... Still purrfect!",aww,t3_abl2ae,3,True,False,abl2ae,
693,So worn out from New Years celebrations not even yarn can distract him from napping,aww,t3_abk3oq,0,False,False,abk3oq,
694,And we think New Year's eve is hard on humans.,aww,t3_abinj0,0,False,False,abinj0,
695,Safety first in the car!,aww,t3_abl07f,0,False,False,abl07f,
696,Huskies are weird.,aww,t3_abbi7r,12,True,False,abbi7r,
697,The reunion!,aww,t3_abfvb6,1,False,False,abfvb6,
698,Wake up and love me,aww,t3_abkam4,0,True,False,abkam4,
699,Unwinding with his favourite TV show after an exciting NYE,aww,t3_abj555,0,False,False,abj555,
700,This pup named Rumour from our local animal shelter (adoption pending!),aww,t3_abg4sa,4,False,False,abg4sa,
701,My dog hanging out in his favorite spot 🙂,aww,t3_abil1q,0,False,False,abil1q,
702,"They were wrestling, then they just stopped and went to sleep..",aww,t3_abid9x,0,False,False,abid9x,
703,My brothers cat models so well. 😍,aww,t3_abj3um,1,False,False,abj3um,
704,I have a love of orangutans so I am biased but I thought this was too cute not to share with you all! Families come in all shapes and sizes :),aww,t3_abhfuh,3,False,False,abhfuh,
705,Santa Paws is coming to town. Happy New Year all!,aww,t3_abj9w5,1,False,False,abj9w5,
706,Just a sleepy bwoy,aww,t3_abinvy,0,True,False,abinvy,
707,Smokey isn't sure of his new sister. Reddit meet Silkie,aww,t3_abicg6,0,False,False,abicg6,
708,kisses for the best doggo! (i saw a similar photo on here and wanted to try my own!),aww,t3_abhr0e,2,False,False,abhr0e,
709,Relation never can't be forget,aww,t3_abkv2u,3,False,False,abkv2u,
710,Roar!,aww,t3_abl9oq,0,False,False,abl9oq,
711,My best friend 🐶,aww,t3_abkhq1,5,False,False,abkhq1,
712,My cat is obsessed with a certain chair in our house and kisses and snuggles it regularly.,aww,t3_abgjdc,9,True,False,abgjdc,
713,We just told her the holidays are over. Happy 2019 everybody! Make it count!,aww,t3_abj87s,1,False,False,abj87s,
714,Every time I come home,aww,t3_ab8kth,11,False,False,ab8kth,
715,"She’s so spoiled, even our dog pampers her",aww,t3_abhclv,1,True,False,abhclv,
716,Hi Reddit! Meet Sephiroth! Jan 1st has been sleeping day :),aww,t3_abl8xi,0,False,False,abl8xi,
717,I see you,aww,t3_abl8vh,0,False,False,abl8vh,
718,She’s a playful pup,aww,t3_abk5fx,0,True,False,abk5fx,
719,"This is Thor, without the hammer and mean looks",aww,t3_abhls7,0,False,False,abhls7,
720,Tasty,aww,t3_ab986c,33,False,False,ab986c,
721,Sargona playing fetch.,aww,t3_abje1v,1,True,False,abje1v,
722,Baby toad just starting out [OC],aww,t3_abiqgp,0,False,False,abiqgp,
723,Loves her blanket,aww,t3_abl84a,1,False,False,abl84a,
724,My dog insisted we follow her onto the other side of a gated trail.,aww,t3_abkfa6,0,False,False,abkfa6,
725,Fat kitty sleepy kitty waiting for football games,aww,t3_abk3s1,0,False,False,abk3s1,
726,Paint me like one of your French girls ✨ Vlad the vixen,aww,t3_abjcsj,1,False,False,abjcsj,
727,Kids giving out Gatorade to everyday sanitation workers,aww,t3_abht6j,2,False,False,abht6j,
728,Howling in the new year!,aww,t3_abicwu,0,False,False,abicwu,
729,"Not mine, credit to u/GoofyXSensei, just thought you all deserved to see this to start 2019 well",aww,t3_abhqlg,0,False,False,abhqlg,
730,New year's lunch was eventful!,aww,t3_abi98l,1,False,False,abi98l,
731,Taking his New Year hangover seriously,aww,t3_abhux5,0,False,False,abhux5,
732,My boy crazy 3 year old is mad at me because she can’t go out and chase the neighborhood good boy that got out of his back yard.,aww,t3_abjrrq,2,False,False,abjrrq,
733,"I hope you all have a 2019 as bright, happy and full of love as these two!",aww,t3_abhldk,1,False,False,abhldk,
734,Cat and doggo relaxing together,aww,t3_abifgn,0,False,False,abifgn,
735,"Reddit, meet Tic Tac",aww,t3_abhdfk,1,False,False,abhdfk,
736,SMART SNOOPA,aww,t3_abkpb7,0,False,False,abkpb7,
737,Baby smooth-coated otter does a big jump to catch up with family,aww,t3_abhrrz,2,True,False,abhrrz,
738,My girlfriends new cat likes flavored water box's,aww,t3_abkc4c,0,False,False,abkc4c,
739,Clever Title,aww,t3_abl3pr,0,False,False,abl3pr,
740,dog_cat_grass_nature_friends,aww,t3_abl3mq,0,False,False,abl3mq,
741,This best girl stayed very still to humor me on this,aww,t3_abjhw3,2,False,False,abjhw3,
742,Moose doesn't care about the numbers on the scale. She just wants to be happy and healthy in 2019.,aww,t3_abkbw5,0,False,False,abkbw5,
743,Lovely Friendship,aww,t3_abevc6,3,False,False,abevc6,
744,"This is Rolo, watching my wife eat",aww,t3_abhbbc,2,False,False,abhbbc,
745,He likes the warmth of snuggles.,aww,t3_abi4mc,1,False,False,abi4mc,
746,Polar bear chilling in jacuzzi,aww,t3_abgqpy,1,False,False,abgqpy,
747,Catto disguised as bush,aww,t3_abl2rr,0,False,False,abl2rr,
748,Caring for a Corgi puppy,aww,t3_abhr2i,0,False,False,abhr2i,
749,My two female cats taking care of each other’s,aww,t3_abiids,3,True,False,abiids,
750,She didn’t make it to midnight...,aww,t3_abeftp,11,False,False,abeftp,
751,"If I don't move, the cat cant see me...",aww,t3_abimk3,0,False,False,abimk3,
752,This is Mittens!,aww,t3_abl23e,0,True,False,abl23e,
753,Who’s my daddy?,aww,t3_abe2qi,5,True,False,abe2qi,
754,Obi-Wan Borkobi,aww,t3_abie3n,3,False,False,abie3n,
755,Da Boss,aww,t3_abhocl,3,False,False,abhocl,
756,q,aww,t3_abeths,5,False,False,abeths,
757,Sleeping in,aww,t3_abj8l1,0,False,False,abj8l1,
758,My dog never lets herself be photographed. My mom finally got one and it is just the best.,aww,t3_abcoqg,10,False,False,abcoqg,
759,(Not my video),aww,t3_abhnl0,1,True,False,abhnl0,
760,Prometheus loves that my house walls are a cat obstacle course,aww,t3_abi90l,4,True,False,abi90l,
761,2019 Vibes,aww,t3_abi8ug,0,False,False,abi8ug,
762,Was petting his head then he did this.,aww,t3_abep5r,10,False,False,abep5r,
763,*wink* ain't I purrfect,aww,t3_abifr9,0,False,False,abifr9,
764,When your humans won’t give you attention...,aww,t3_abjm00,0,True,False,abjm00,
765,That one hairy baby...,aww,t3_abjm2q,3,False,False,abjm2q,
766,Just want to wish everyone a happy new year with a pupper smile 😊,aww,t3_abhk1o,1,False,False,abhk1o,
767,Sarah Belle wishes everyone an excellent New Year!,aww,t3_abkxvj,5,False,False,abkxvj,
768,He is never this quiet 😂,aww,t3_abgt6g,0,False,False,abgt6g,
769,Trekking with my pup on New year's day,aww,t3_abhltg,6,False,False,abhltg,
770,"People were asking for more pictures of Harvey, our staffy-mastiff cross with alopecia, so I thought I'd oblige.",aww,t3_abk5si,0,False,False,abk5si,
771,On particularly cold days Nook likes to wear his husky hat. 🐺,aww,t3_abhlmp,2,False,False,abhlmp,
772,The moment when you know they love you💕,aww,t3_abhv13,0,False,False,abhv13,
773,Random Cat broke into our camping van,aww,t3_abhl6y,6,False,False,abhl6y,
774,Guilty cloud,aww,t3_abiibp,0,False,False,abiibp,
775,"His name's Canada, and he's five. Rescued Feb 2016.",aww,t3_abirjs,0,False,False,abirjs,
776,My best friend for 16 years,aww,t3_abk3b7,0,False,False,abk3b7,
777,Meet Pippin! My grandparents adopted this little one when he was rescued from animal abusers in Romania. After all he has been through he still loves to be a little lap dog.,aww,t3_abhtmw,2,False,False,abhtmw,
778,"He thought the flowers looked pretty, I thought he looked prettier",aww,t3_ab6vq0,8,False,False,ab6vq0,
779,Snuggling my lovebird,aww,t3_ablahs,0,True,False,ablahs,
780,"My pretty girl, Trixie, is 10 years old now. She is starting to slow down a bit but her inner puppy always comes out whenever a fresh snow falls.",aww,t3_ablaac,0,True,False,ablaac,
781,Winnie being patient with our new foster kitten.,aww,t3_abfumc,5,True,False,abfumc,
782,Nap time,aww,t3_abi4kk,0,False,False,abi4kk,
783,"When people tell me ""You're going to regret that in the morning,"" I sleep in until noon because I'm a problem solver.",aww,t3_abhilu,1,False,False,abhilu,
784,The smallest kitten blocking our path,aww,t3_abgqxu,3,False,False,abgqxu,
785,"Give us the treats, and no one gets tripped",aww,t3_abiak2,1,False,False,abiak2,
786,Muenster wishes you a happy new year!,aww,t3_abj6t2,1,False,False,abj6t2,
787,Happy New year! .. my Xmas tree calico cat ❤,aww,t3_abhk1u,4,False,False,abhk1u,
788,This cat popping out,aww,t3_abf988,1,False,False,abf988,
789,Motherly cat adopts ducklings,aww,t3_abgogw,2,True,False,abgogw,
790,Therapy pup at Alzheimer’s residential care facility waiting for the memory care patients! Especially HAROLD!,aww,t3_abegpj,4,False,False,abegpj,
791,"This is my dog, he is American Staffy x Labrador ❤️",aww,t3_abhzc1,2,False,False,abhzc1,
792,My mates lizard,aww,t3_abkp9e,0,False,False,abkp9e,
793,"‘Summer body routine starts next week, I swear.’",aww,t3_abgfcu,9,False,False,abgfcu,
794,Am good boi. Have snoot. Pls boop.,aww,t3_abidax,1,False,False,abidax,
795,I guess he wants to come with us,aww,t3_abjmon,0,False,False,abjmon,
796,True holiday spirit!,aww,t3_abirzw,0,False,False,abirzw,
797,That paw!,aww,t3_abiha8,0,True,False,abiha8,
798,"This is Odin's ""Why aren't you petting me"" face.",aww,t3_abb9dr,14,False,False,abb9dr,
799,"Bailey, at the head of table",aww,t3_abicde,4,False,False,abicde,
800,Reddit - meet Fender. He sleeps on his his back most of the time.,aww,t3_abl3ca,1,False,False,abl3ca,
801,Poker face.... meowww!,aww,t3_abig6w,2,False,False,abig6w,
802,The Love,aww,t3_abikd3,2,False,False,abikd3,
803,Happy birthday to my beautiful girl! 11 today!,aww,t3_abfd38,2,False,False,abfd38,
804,"Without a potato chip, this isn't possible!",aww,t3_abdyu1,8,False,False,abdyu1,
805,"Happy New Year, animal lovers",aww,t3_abdw1x,2,False,False,abdw1x,
806,Baby Lemming On A Spoon,aww,t3_ab5lrz,77,False,False,ab5lrz,
807,Baby Crocodile,aww,t3_abgf8s,9,False,False,abgf8s,
808,His New Year’s Resolution - clean the floor more,aww,t3_abj1eb,1,False,False,abj1eb,
809,my cat eating cassava chips,aww,t3_abl0gt,1,False,False,abl0gt,
810,Too much frolic last night. Happy Mew Year.,aww,t3_abhw0m,0,False,False,abhw0m,
811,Doggo wants to say hello,aww,t3_abgqv2,3,False,False,abgqv2,
812,When your cat poses better than you do...,aww,t3_abh09s,1,False,False,abh09s,
813,My Husky mix Ghost sometimes falls asleep in a position that doesn't seem to be conducive to sleep...,aww,t3_abiiv6,0,False,False,abiiv6,
814,My dads dog ready for the new year! Reddit meet Scout!,aww,t3_abgtqd,2,False,False,abgtqd,
815,/u/PlayerThree2018 is the best Cake Day gift ever. Happy New Year!,aww,t3_abj0ja,7,False,False,abj0ja,
816,Still haven't seen bird box I'd rather watch cat box,aww,t3_abghfh,2,False,False,abghfh,
817,Happy new year from me and my pup,aww,t3_abj7so,0,False,False,abj7so,
818,Happy New Year!,aww,t3_abizmk,1,False,False,abizmk,
819,Lana wishes you a happy new year full of things to chew on,aww,t3_abfore,0,False,False,abfore,
820,My sweet girls first New Years!,aww,t3_abimul,0,False,False,abimul,
821,A cute pug came round to see a neighbour. Image taken with permission,aww,t3_abiz9e,0,False,False,abiz9e,
822,Hello im cute,aww,t3_abisgg,0,False,False,abisgg,
823,"dogie pets cat, cat hugs back",aww,t3_abgwsd,1,True,False,abgwsd,
824,My cat looks so mad at me,aww,t3_abjp44,0,False,False,abjp44,
825,Mood,aww,t3_abigkb,4,False,False,abigkb,
826,Even cats play the floor is lava,aww,t3_abg2qa,0,False,False,abg2qa,
827,My kitten sleeping,aww,t3_abixmu,0,False,False,abixmu,
828,He does this everytime I take a poop,aww,t3_abi3jg,9,False,False,abi3jg,
829,Look at this pup who drove to Chick-fil-A and is ordering all the foods,aww,t3_abj4wu,0,False,False,abj4wu,
830,My dog and I back when I had my wisdom teeth out,aww,t3_abhwaz,2,False,False,abhwaz,
831,Happy Good Girl,aww,t3_abifmb,0,False,False,abifmb,
832,Attacking 2019 like...,aww,t3_abetzc,6,False,False,abetzc,
833,"""What kind of toy is this?""",aww,t3_ab8l9d,12,False,False,ab8l9d,
834,Dobby loves soft everything,aww,t3_abgvom,1,True,False,abgvom,
835,Out the Window.,aww,t3_abik62,0,False,False,abik62,
836,Twix gives me moral support when I'm pooping... Or judging me; I can't tell.,aww,t3_abg9h5,7,False,False,abg9h5,
837,Not in the mood,aww,t3_abh20u,2,False,False,abh20u,
838,Max is a handsome!,aww,t3_abhjnc,0,False,False,abhjnc,
839,Just a dog on the car,aww,t3_abguwu,0,False,False,abguwu,
840,Sheba catching a snow ball,aww,t3_abjxak,0,False,False,abjxak,
841,Prometheus walks or runs multiple times a day and night (I hear him when I'm trying to sleep). Do you get enough exercise too?,aww,t3_abfdez,9,True,False,abfdez,
842,“We need to discuss my daily treat allowance”,aww,t3_aba5ck,7,False,False,aba5ck,
843,"Couldn't find one of the puppies, so called out her name and this happened. (Lynk &amp; Mysti ❤)",aww,t3_abf4ht,1,False,False,abf4ht,
844,We didn’t make it to midnight,aww,t3_abihdf,0,False,False,abihdf,
845,"Marley and Me - ‘Ha, this ending always gives me a great chuckle.’",aww,t3_abgj9s,1,False,False,abgj9s,
846,Cutest new years pup that you ever did see,aww,t3_abla8m,0,False,False,abla8m,
847,"It is hot in the summer here in São Paulo, Brazil, so my dog, Milk, was laying on the floor to refresh himself",aww,t3_abj8ob,1,False,False,abj8ob,
848,beautful baby //,aww,t3_abl9re,1,False,False,abl9re,
849,My cat apparently loves the silver garland,aww,t3_abl9ic,0,True,False,abl9ic,
850,Took baby outside... She froze...,aww,t3_abj8il,0,False,False,abj8il,
851,Is this what you want?,aww,t3_abgc4r,5,True,False,abgc4r,
852,She plays dead until I notice her! 😂,aww,t3_abgn68,1,True,False,abgn68,
853,This is what my sweet girl looked like in 2018. I’m actually quite proud of the timing.,aww,t3_abiz5t,0,False,False,abiz5t,
854,Here's butt in your face!!! Keep watching...my youngest can be very persistent when trying to get his brother to play with him.,aww,t3_abi9tr,2,True,False,abi9tr,
855,Kitty playing fetch with a bottle cap,aww,t3_abl69n,0,True,False,abl69n,
856,happy new years friends!!,aww,t3_abf1xa,10,False,False,abf1xa,
857,My little Emma 😍😍,aww,t3_abiow2,2,False,False,abiow2,
858,Hoomans keep doesing stuff like dis... Why is plastic porcupine thing on noggin??,aww,t3_abgeqc,0,False,False,abgeqc,
859,"My adorable old doggo, 12 years old and going strong!",aww,t3_abga06,0,False,False,abga06,
860,Another picture of Floki taken in November.,aww,t3_abh8bu,0,False,False,abh8bu,
861,Meet Gord Meowney. This cat's ahead by a century...,aww,t3_abihiz,1,False,False,abihiz,
862,This is the Dogs bed.. He is hiding in the closet now...,aww,t3_abhd92,0,False,False,abhd92,
863,My doggos.,aww,t3_abg6fi,0,False,False,abg6fi,
864,Shironeko has that smile...,aww,t3_abhrax,6,False,False,abhrax,
865,Lil quacker gettin his swim on,aww,t3_ab8g3j,17,True,False,ab8g3j,
866,You're not making your bed today human.,aww,t3_abh2vz,0,False,False,abh2vz,
867,"Max doesn't like to see us leave the house. This is his ""window"" on the gate.",aww,t3_abc5jw,4,False,False,abc5jw,
868,"It's end of the first day of 2019 and it's cold, dark, and nighttime",aww,t3_abiasm,0,True,False,abiasm,
869,Cooking Cat AlIvE,aww,t3_abi9qw,3,False,False,abi9qw,
870,One of my favorite photos of her from this year! Happy New Year's everyone and may your reddits be blessed with cute photos all year long! 🎉🎆,aww,t3_abfvy7,1,False,False,abfvy7,
871,Paws down paws up this is how we like to pup!,aww,t3_abe44u,3,False,False,abe44u,
872,Snowy Boi Goes on New Year’s Adventure,aww,t3_abe9dt,0,False,False,abe9dt,
873,A dump of wholesome and cute animals,aww,t3_abglvw,1,False,False,abglvw,
874,he gets serious whenever the glasses go on,aww,t3_abhd2l,4,False,False,abhd2l,
875,Jones was rolling in too much mud today!,aww,t3_abkweg,0,False,False,abkweg,
876,Finger licking good,aww,t3_abawna,0,True,False,abawna,
877,Friend’s dog on Christmas Day,aww,t3_abhhzd,0,False,False,abhhzd,
878,"My 'Tanzanian red claw' scorpion named Raven, going in to hug santa &lt;3 (Atleast it looks like it)",aww,t3_abjh9p,2,False,False,abjh9p,
879,Much live from these two 💖,aww,t3_abkacv,0,False,False,abkacv,
880,Just Beautiful!,aww,t3_abfdqh,2,False,False,abfdqh,
881,Happy little fluff!,aww,t3_abfofw,2,False,False,abfofw,
882,My son heard someone at the door today,aww,t3_ab3uvc,167,False,False,ab3uvc,
883,This kitten knows where to go when it's cold outside.,aww,t3_abjdn2,0,False,False,abjdn2,
884,"PUPPER &lt;3. Look at my dog, Molly!",aww,t3_abitd9,0,True,False,abitd9,
885,Busted! Caught sleeping on the sofa bed. She got down as soon as she heard mum coming and was right back on there once she’d left.,aww,t3_abi4s4,2,False,False,abi4s4,
886,“Mom! When can we start my make up?”,aww,t3_abflzj,1,False,False,abflzj,
887,A very good underbite.,aww,t3_abj04m,0,False,False,abj04m,
888,The name is Pendleton. He is twelve.,aww,t3_abgnbi,0,False,False,abgnbi,
889,"""Yea I'm fabulous""",aww,t3_abh6r3,1,True,False,abh6r3,
890,Unselfish boy,aww,t3_abggol,3,False,False,abggol,
891,what a cute boii,aww,t3_abhlwu,0,False,False,abhlwu,
892,She's back at it again,aww,t3_abiq0j,0,False,False,abiq0j,
893,"Can’t move mouse, might wake cat.",aww,t3_abla70,0,False,False,abla70,
894,My cat has 2000 IQ and can open doors on her own.,aww,t3_abk1k2,6,True,False,abk1k2,
895,"I got a hamster this Christmas, she's so cute!",aww,t3_abiiak,0,False,False,abiiak,
896,Saved some trash pandas from getting smashed pandas,aww,t3_abhlfy,0,False,False,abhlfy,
897,You can see my reflection in this handsome boy's eye,aww,t3_abl9pz,0,False,False,abl9pz,
898,The only thing better than one Maine Coon,aww,t3_abepwj,1,False,False,abepwj,
899,Dapper doggo hopes you had wonderful holidays!,aww,t3_abl94x,0,False,False,abl94x,
900,"She keeps begging for packs of guitar strings because she thinks they're bags of treats. Poor pup, packaging can be confusing sometimes.",aww,t3_abg092,7,False,False,abg092,
901,30 Minutes Shy of Making it to Midnight (Maybe next year),aww,t3_abgn7v,0,False,False,abgn7v,
902,"When drying Noah's face after a bath, only the finest carpets will do",aww,t3_abg8oy,3,True,False,abg8oy,
903,"If you don't succeed at first, try again",aww,t3_abfl5h,3,True,False,abfl5h,
904,My grand dog says happy new year - with his goofy smile,aww,t3_abgva8,2,False,False,abgva8,
905,A very derpy cat,aww,t3_abifgj,2,False,False,abifgj,
906,This is such a pure and wholesome interaction,aww,t3_abchpe,10,True,False,abchpe,
907,"It it fitz, I sitz (no matter how big they get, they are still cats)",aww,t3_abg795,0,False,False,abg795,
908,15 year old still doesn’t like fireworks,aww,t3_abgtl9,2,False,False,abgtl9,
909,Happy New Year from this party animal!,aww,t3_abl3ln,0,False,False,abl3ln,
910,Our extremely cute cat,aww,t3_abhore,2,False,False,abhore,
911,My cousin’s sweet derp turned 16 on Christmas Day. She smells like Fritos but we still love her so!,aww,t3_abeipt,6,False,False,abeipt,
912,My 5 yr old Alsatian-Husky. Looking good on NYE,aww,t3_abbnxe,4,False,False,abbnxe,
913,Nom nom nom nom nom nom,aww,t3_abg9cw,2,True,False,abg9cw,
914,My cat is a deep sleeper,aww,t3_abgzki,0,True,False,abgzki,
