,title,subreddit,name,num_comments,is_video,pinned,id,selftext
0,R/AWW OFFICIAL DISCORD!!! JOIN NOW!,aww,t3_97vuvt,142,False,False,97vuvt,[Join here!](https://discord.gg/c9YAqy3)
1,r/catsandchristmastrees: /r/Aww Subreddit of the Week!,aww,t3_a7yh12,19,False,False,a7yh12,
2,Swan gives owner a loving hug,aww,t3_abjogt,155,False,False,abjogt,
3,hi i'm a husky too 🤭🤭,aww,t3_abinkl,104,False,False,abinkl,
4,happy boom boom terror night,aww,t3_abjlaz,115,False,False,abjlaz,
5,Service dog detects and responds to owners oncoming panic attack,aww,t3_abivui,366,True,False,abivui,
6,Fox with a hat!,aww,t3_abhkn4,366,False,False,abhkn4,
7,A happy new year to all of you!,aww,t3_abhlb1,126,True,False,abhlb1,
8,My brothers new cat is still a little wary of me,aww,t3_abhe2w,69,False,False,abhe2w,
9,Just brought home this little bright eyed boy,aww,t3_abj7li,24,False,False,abj7li,
10,Yep that’s the spot,aww,t3_abjz5j,29,True,False,abjz5j,
11,My almost 18 year old girl,aww,t3_abi1v2,43,False,False,abi1v2,
12,Reddit meet Flash! He's 18 years old and we just found out from the vet he's healthy as a horse!,aww,t3_abjf3u,37,False,False,abjf3u,
13,You have been greeted by a herd of alpacas!,aww,t3_abi8sd,49,True,False,abi8sd,
14,Our dog was afraid of the fireworks and so our cat kept him company in the bathroom,aww,t3_abhdke,63,False,False,abhdke,
15,Good girl.,aww,t3_abgo2e,241,False,False,abgo2e,
16,HOW CUTE HE IS!,aww,t3_abjte7,18,False,False,abjte7,
17,Cozy boye,aww,t3_abjhb7,31,False,False,abjhb7,
18,One year difference. Still best friends. My good boys. Happy New Year!,aww,t3_abgtqk,44,False,False,abgtqk,
19,"Meet my new puppy, Arlo!",aww,t3_abio52,27,False,False,abio52,
20,"Russian soldier on his way to Berlin (1944, colorised)",aww,t3_abhbbm,48,False,False,abhbbm,
21,"My girlfriend’s cat hates me. She has to follow me whenever I go, watching me from afar. But she is so beautiful",aww,t3_abicfg,39,False,False,abicfg,
22,This musical shark,aww,t3_abj175,31,False,False,abj175,
23,Starting the new year with this little guy.,aww,t3_abiu6g,14,False,False,abiu6g,
24,"Meet Hiccup, we've given him a home for Christmas",aww,t3_abk90b,33,False,False,abk90b,
25,"5 beds and about 10 comfy chairs in this house. So where do you sit? ON THE EGGS!""",aww,t3_abj4q1,30,False,False,abj4q1,
26,Wise,aww,t3_abjv1g,12,False,False,abjv1g,
27,Good boi enjoys a head scritch,aww,t3_abf41w,76,False,False,abf41w,
28,Mother cat is always there for her baby,aww,t3_abi7e9,9,False,False,abi7e9,
29,They didn't make it to midnight 😂,aww,t3_abi1f8,25,False,False,abi1f8,
30,"This baby cow is so fluffy, I want to hug it.",aww,t3_abi6up,14,False,False,abi6up,
31,Baby donkey in a hammock,aww,t3_abjbrf,8,False,False,abjbrf,
32,Kitty approves of violins,aww,t3_abjuqu,7,True,False,abjuqu,
33,Brothers and sisters :)),aww,t3_abgs7x,25,False,False,abgs7x,
34,Another year to spend with a loved one. Happy New Years,aww,t3_abf67c,38,False,False,abf67c,
35,"Bought my first house and adopted a kitten as my first pet. Reddit, meet Eredin",aww,t3_abj7lv,22,False,False,abj7lv,
36,"We just adopted this handsome fella. He was so terrified he refused to budge from the corner, &amp; kept his down while shaking. Gave him a treat &amp; caught a cute moment",aww,t3_abek2m,154,False,False,abek2m,
37,My blind dog was waiting for mom at the wrong door. Bless his heart.,aww,t3_abdw2m,375,False,False,abdw2m,
38,Cute pupper,aww,t3_abhx9y,1,False,False,abhx9y,
39,This little guy partied a bit too hard last night.,aww,t3_abkfb7,12,False,False,abkfb7,
40,My rare pupper needs a heckin lot of love,aww,t3_abjlmt,13,False,False,abjlmt,
41,Can I come in?,aww,t3_abji8q,14,False,False,abji8q,
42,Who doesn’t like cuddling a fuzzy ass,aww,t3_abjt1w,8,True,False,abjt1w,
43,very c o l d,aww,t3_abdrwf,146,False,False,abdrwf,
44,Cat hugging doll while sleeping,aww,t3_abiup9,2,True,False,abiup9,
45,"Meet my new puppy, Ezra!",aww,t3_abfoq6,51,False,False,abfoq6,
46,Jack's Strategy at the Vet: If I Can't See You You Can't See Me,aww,t3_abi59i,10,False,False,abi59i,
47,You lookin at me?!,aww,t3_abh590,24,True,False,abh590,
48,I drew the happiest possible use of a magical 3D printer :),aww,t3_abiypz,22,False,False,abiypz,
49,Who did this?!? Just received a package addressed to my dog Jack Jack and someone sent her a stuffed eyeball 😂😭,aww,t3_abddcz,152,False,False,abddcz,
50,Cutest thing I've ever seen! :),aww,t3_abczbq,261,True,False,abczbq,
51,can we get another ball,aww,t3_abhmsa,17,False,False,abhmsa,
52,This little kitten is adorable,aww,t3_abdq1k,61,False,False,abdq1k,
53,This swan hugs.,aww,t3_abk3yv,13,False,False,abk3yv,
54,Freedom for good boys only.,aww,t3_abjytp,8,False,False,abjytp,
55,Life as a cat owner,aww,t3_abideu,8,False,False,abideu,
56,Doggo was waiting for his master. Someone kissed him,aww,t3_abcqgf,153,False,False,abcqgf,
57,Blep,aww,t3_abiphb,4,False,False,abiphb,
58,"This is my cat, Bacon",aww,t3_abf3zb,37,False,False,abf3zb,
59,"My cat Snuggs, looking like he’s awkwardly posing for a school photo",aww,t3_abjif0,6,False,False,abjif0,
60,These melted panda cubs,aww,t3_abkbm6,3,False,False,abkbm6,
61,The cutest awoo ever,aww,t3_abc2rb,419,True,False,abc2rb,
62,Coworker's cat came back pregnant one day and I took it as a sign that it was finally time to adopt. Was certainly not expecting them to be this gorgeous,aww,t3_abid29,4,False,False,abid29,
63,So sweet and kind of him,aww,t3_abjgl6,7,False,False,abjgl6,
64,Our dog got freaked out by New Year's Eve firecrackers and refused to leave the kitchen. Found my dad on the kitchen floor like this...,aww,t3_abc0mv,200,False,False,abc0mv,
65,Snuggle Buddies,aww,t3_abjor2,2,False,False,abjor2,
66,"Reddit, meet Myrtle. She's a bit shy so is getting the purrito treatment.",aww,t3_abgek1,7,False,False,abgek1,
67,Cats Love!,aww,t3_abfqj0,11,True,False,abfqj0,
68,Partners in crime.,aww,t3_abbwzz,89,False,False,abbwzz,
69,Foxy does a boop,aww,t3_abirj3,4,False,False,abirj3,
70,Bamboozled again,aww,t3_abgkam,13,True,False,abgkam,
71,Me and my husband's first pet together. Its been almost six years now.,aww,t3_abj4tu,7,False,False,abj4tu,
72,What a whole year of TLC can do; this is Boomer’s before and after.,aww,t3_abkdro,13,False,False,abkdro,
73,I’m a glass artist and just finished a new studio to work from home in so now I get fresh biscuits everyday at work.,aww,t3_abjiwc,2,True,False,abjiwc,
74,First blep of the new year,aww,t3_abk028,5,False,False,abk028,
75,Beware of Spike! This vicious canine is known to lure its prey using extreme cuteness and mercilessly chew on their footwear.,aww,t3_abjcw9,2,False,False,abjcw9,
76,He’s so happy :),aww,t3_abkr8e,3,False,False,abkr8e,
77,My boy turns 17 pretty soon. Appreciating each Christmas with him,aww,t3_abbay1,125,False,False,abbay1,
78,"Today, this stray legally becomes ours after 2 weeks of looking for his owner! Happy Cake Day to Me, Best Present Ever! Meet Remi!",aww,t3_abhwuz,16,False,False,abhwuz,
79,She's 10 years old but will always be my baby.,aww,t3_abimrv,7,False,False,abimrv,
80,Nice hat Doggo,aww,t3_abjlbc,1,False,False,abjlbc,
81,"Mr Wicket (11 yr old dog) was told to get in his bed, and instead he jumped into Jasper’s (18 yr old cat) bed, this has never happened before and was too cute! My two grumpy old men!",aww,t3_abiazt,8,False,False,abiazt,
82,dinnertime,aww,t3_abi7e0,5,False,False,abi7e0,
83,My boss’s dog comes to get scratches. Benefits of working holidays.,aww,t3_abjdww,0,True,False,abjdww,
84,Trash Panda takes a bath.,aww,t3_abghyb,13,False,False,abghyb,
85,My mum rescued this little guy just over a week ago. Meet Smudge.,aww,t3_abj0e1,2,False,False,abj0e1,
86,A proud mumma,aww,t3_abgyvl,13,True,False,abgyvl,
87,"Dog wouldn’t walk in the middle of Shibuya, Tokyo.",aww,t3_abjyj4,11,True,False,abjyj4,
88,The most wholesome video I’ve seen today,aww,t3_abbry5,52,True,False,abbry5,
89,He thinks we're playing hide and seek.,aww,t3_aba0xg,913,False,False,aba0xg,
90,My wife works graveyard shift so she leaves this for me every year,aww,t3_abgczg,11,False,False,abgczg,
91,Happy 16th birthday to this guy!!,aww,t3_abc8p3,87,False,False,abc8p3,
92,"I was out of town for New Years so my friend watched my dogs, he sent me this",aww,t3_abkghk,1,False,False,abkghk,
93,"My emotional support dog, Cheese. He failed as a full service dog because he's too excitable.",aww,t3_abizdc,3,False,False,abizdc,
94,McDonald’s employees helping a disabled man to eat without having to be on his own.,aww,t3_abbk0m,174,False,False,abbk0m,
95,This is too good,aww,t3_abjss3,9,False,False,abjss3,
96,Blue streaks 👌🔥,aww,t3_abebv5,14,False,False,abebv5,
97,"Probably no one will see this, but this is Bailee. She’s 14, and I just wanted Reddit to know that she is the best of girls, and I love her very much.",aww,t3_abl2lm,2,False,False,abl2lm,
98,Ocelot #1,aww,t3_abhwml,13,False,False,abhwml,
99,My kitten's first trip to the vet. Reddit meet Salem!,aww,t3_abcqxv,42,False,False,abcqxv,
100,My puppy Aki’s (autumn in Japanese) first terrified visit to the vet,aww,t3_abj4lz,2,False,False,abj4lz,
101,This little girl loves the snow,aww,t3_abk9p5,0,False,False,abk9p5,
102,This is ma boi Nacho. He loves sitting on radiators (when they're hot) and chilling next to lit candles. He also has a thing for heating blankets.,aww,t3_abj2e3,9,False,False,abj2e3,
103,"I love our pupper, she's so photogenetic",aww,t3_abjjum,6,False,False,abjjum,
104,"Don't be Upset, Smile!",aww,t3_abbf72,69,True,False,abbf72,
105,waking up to snacks,aww,t3_aba8pv,118,True,False,aba8pv,
106,African wild dog pups,aww,t3_abjydh,4,False,False,abjydh,
107,"I was told to post this here... Proposed to my best friend in Chefchaouen, Morocco. Her brother caught the moment perfectly!",aww,t3_abacmn,174,True,False,abacmn,
108,LOL,aww,t3_abig77,7,False,False,abig77,
109,Lazy day on the couch to celebrate her 24th Birthday,aww,t3_abhukt,6,False,False,abhukt,
110,"I think I can, I think I can, I think I can get that bone.",aww,t3_abjjc1,4,True,False,abjjc1,
111,Widdle beans,aww,t3_abdaps,11,False,False,abdaps,
112,"My husband thinks I love animals too much. On top of our two dogs, we just adopted two hamsters today. This is Snacc, one of my two girls.",aww,t3_abdyhd,42,False,False,abdyhd,
113,Happy New Year Hugs,aww,t3_abkr6i,1,False,False,abkr6i,
114,Doggo Saves The day,aww,t3_abjrai,4,False,False,abjrai,
115,He protecc,aww,t3_abdv52,20,False,False,abdv52,
116,Happy goat says Happy New Year!,aww,t3_abk4al,2,False,False,abk4al,
117,From kitten to cat.,aww,t3_abig0a,2,False,False,abig0a,
118,Ear to ear smile,aww,t3_abhwlv,2,False,False,abhwlv,
119,dinnertime,aww,t3_abjpa9,5,False,False,abjpa9,
120,❣️,aww,t3_abjw7e,3,False,False,abjw7e,
121,The little guy is 14,aww,t3_abk1wr,5,True,False,abk1wr,
122,Zeus the German Shepherd was put in the other room while the spilled treats were cleaned up,aww,t3_ab9k7f,81,False,False,ab9k7f,
123,This white cat got into a mostly empty can of Spaghettios...,aww,t3_abisr4,6,False,False,abisr4,
124,The little guy frolicking on grass for the first time!,aww,t3_abjvrs,1,True,False,abjvrs,
125,Snuggles,aww,t3_abhw7n,0,False,False,abhw7n,
126,Jake is 13 soon and he always acts so happy to see you. Such a good golden boy.,aww,t3_abjbza,0,False,False,abjbza,
127,Where do you think you're going?,aww,t3_abhdbu,6,True,False,abhdbu,
128,This little guy is the runt in our new litter of foster kittens.,aww,t3_abg07c,30,True,False,abg07c,
129,"Am I a joke to you, Karen?",aww,t3_abbirp,21,False,False,abbirp,
130,Face swap done right,aww,t3_abhw6j,3,False,False,abhw6j,
131,"And here we go again,posing for a picture",aww,t3_abhvs5,1,False,False,abhvs5,
132,You are my best friend!,aww,t3_ab8ry9,67,True,False,ab8ry9,
133,Puppy-corn!,aww,t3_abjfgf,1,False,False,abjfgf,
134,I hear you guys like squirrels here. This is Chuck.,aww,t3_abkyyx,1,True,False,abkyyx,
135,Just a snake in a sock,aww,t3_abjkgo,10,False,False,abjkgo,
136,"My newest family member, Opal.",aww,t3_abjyx3,5,False,False,abjyx3,
137,"My boy Bear, 16 weeks old",aww,t3_abk5el,4,False,False,abk5el,
138,Big ears,aww,t3_abkwef,2,False,False,abkwef,
139,"I was baby sitting my nephew on New Years, so this good boy was my New Years date.",aww,t3_abkjt5,3,True,False,abkjt5,
140,I found Dumbo!,aww,t3_abdgpz,20,False,False,abdgpz,
141,For gawds sake Karen. 🤣🤣🤣,aww,t3_abkion,1,False,False,abkion,
142,Birthday Boy,aww,t3_abij0w,4,False,False,abij0w,
143,Just found out how much my puppy loves snow,aww,t3_abk21i,4,False,False,abk21i,
144,I think my brother broke my dog....,aww,t3_abkcjp,0,False,False,abkcjp,
145,"My blind girl, shes awsome!",aww,t3_abjn9l,8,False,False,abjn9l,
146,"Meet Ella . I adopted her yesterday. She's 1,5 years old and had never left the appartment. First time in the forest today! I'm going to show her so many new places to discover.",aww,t3_abichz,5,False,False,abichz,
147,She wasnt able to stay awake for the New Year,aww,t3_abiy3z,3,False,False,abiy3z,
148,This old lady.,aww,t3_abkqzh,1,False,False,abkqzh,
149,We just adopted Lucy!,aww,t3_abi19o,1,False,False,abi19o,
150,What do you want now?,aww,t3_abdt08,9,True,False,abdt08,
151,Maybe I snooze too,aww,t3_abjati,3,False,False,abjati,
152,sheep and a tire swing,aww,t3_abkmsd,5,False,False,abkmsd,
153,3 days in the NICU:/ First time holding my girl all healthy!,aww,t3_ab9b26,224,False,False,ab9b26,
154,"""Can we be friends?""",aww,t3_abkisg,6,False,False,abkisg,
155,In case you’re having a bad day,aww,t3_ab8y3y,113,True,False,ab8y3y,
156,Coming out of my cage and I'm doing just fine,aww,t3_ab8vb8,60,False,False,ab8vb8,
157,"Together ,we must sleep.",aww,t3_abjd7a,2,False,False,abjd7a,
158,Your highness must be carried,aww,t3_abhtym,0,False,False,abhtym,
159,"Reddit, meet our new puppy, Harry.",aww,t3_abjq7b,2,False,False,abjq7b,
160,Missing our girls while we're away for the weekend so we checked in. I think they miss us too.,aww,t3_ab7lr1,163,False,False,ab7lr1,
161,That’s the real question.,aww,t3_abkmox,0,False,False,abkmox,
162,NYE 2019: My dog is terrified of fireworks. Our drunk solution... but she stayed like this a while.,aww,t3_abf8cr,24,False,False,abf8cr,
163,This little dumpling.,aww,t3_abe4el,6,False,False,abe4el,
164,"My brother's dog gives me this look every time I tell him ""I have to go home""",aww,t3_ab7xhd,76,False,False,ab7xhd,
165,Moth: imma fite you *almost falls off*,aww,t3_abko73,3,True,False,abko73,
166,"He showed up the day after Christmas, hungry and cold. Thinking about keeping him! Need help picking out a name! Getting him checked out at the vet tomorrow.",aww,t3_abk19a,23,False,False,abk19a,
167,The cutest bunch of fur! 🐶🐶🐶😍,aww,t3_abjris,4,False,False,abjris,
168,My little guy back when he was 7 weeks old,aww,t3_abkji0,4,False,False,abkji0,
169,"No matter how hungry my doggo is, he always patiently waits for our elderly dog to eat first.",aww,t3_abax4c,45,False,False,abax4c,
170,You can use my hand as a pillow 💕,aww,t3_abkj49,3,True,False,abkj49,
171,"Rescue kitty Annie says “new year, same perfect me”. 🖤",aww,t3_abjma5,2,False,False,abjma5,
172,"7-year-old does not let Alopecia stop her from celebrating her school's ""Crazy Hair Day'",aww,t3_ab8mwh,99,False,False,ab8mwh,
173,Mishas in the SOCK OF SHAME that’s what you get if you don’t leave your stitches alone!,aww,t3_ab7oan,163,False,False,ab7oan,
174,This is the day after we brought her home. I think she's settling in okay.,aww,t3_abk6i9,0,False,False,abk6i9,
175,Now human give it now!,aww,t3_abjh0p,0,False,False,abjh0p,
176,Cat didn't like the Firework,aww,t3_abjgoj,2,False,False,abjgoj,
177,Tuckered out after his bath,aww,t3_abkafm,2,False,False,abkafm,
178,Cat falls asleep with an automatic toy going,aww,t3_abarhb,55,True,False,abarhb,
179,"Meet Oliver, our newest addition to the family.",aww,t3_ab9mtq,33,False,False,ab9mtq,
180,Adopted a rescue kitten recently. Three weeks later she looks really comfortable!,aww,t3_abi3qs,0,False,False,abi3qs,
181,This Cat bent the blinds to look outside too.,aww,t3_abhzyd,2,False,False,abhzyd,
182,Happy New Year from Finn!,aww,t3_abk4vz,2,False,False,abk4vz,
183,That Face!,aww,t3_abki88,3,False,False,abki88,
184,"She’s so spoiled, even our other cat pampers her.",aww,t3_ab7n4p,113,True,False,ab7n4p,
185,lottie is a model,aww,t3_abkktq,1,False,False,abkktq,
186,My new kitten just heard my two dogs howl for the first time and his mind is blown,aww,t3_abktlf,4,True,False,abktlf,
187,Leaf cutter bees are adorable,aww,t3_ab7mgw,353,False,False,ab7mgw,
188,When it's early in the morning and the kids are being needy..,aww,t3_ab97nz,22,False,False,ab97nz,
189,A baby Red Owl,aww,t3_abciom,20,False,False,abciom,
190,Dinner time. Can you tell which dog is blind?,aww,t3_abk5yh,3,False,False,abk5yh,
191,16 year old grumpy boy,aww,t3_abiln4,4,False,False,abiln4,
192,"Happy New Year! No matter how 2018 treated you, I wish you nothing but lots of treats and head pats in 2019",aww,t3_abjici,1,False,False,abjici,
193,ONE BIG MEOW MORNING ^~^,aww,t3_abkwpp,1,False,False,abkwpp,
194,Atticus ❤️,aww,t3_abklhz,0,False,False,abklhz,
195,Jenny loves butterflies 🦋,aww,t3_abizow,4,False,False,abizow,
196,I could use some of this today...,aww,t3_abky2l,1,True,False,abky2l,
197,"I went to go grocery shopping, but got stuck sitting on the porch for fifteen minutes. Meet Chips. He's not my cat, but I love him.",aww,t3_abir3t,3,True,False,abir3t,
198,Good Morning 01-01-2019,aww,t3_abjhlk,1,False,False,abjhlk,
199,13 and still going strong,aww,t3_abkjfk,1,False,False,abkjfk,
200,Who is a good boy?!,aww,t3_abjpev,3,False,False,abjpev,
201,"Hi, I’m Milo!",aww,t3_abjp5z,0,False,False,abjp5z,
202,Pupper Pong...my sis says he can do this for hours (he's better than me),aww,t3_abiz8k,6,True,False,abiz8k,
203,:},aww,t3_abjufu,4,False,False,abjufu,
204,Never a dull day,aww,t3_abjrfc,0,False,False,abjrfc,
205,My baby boy’s mouf 😍😍,aww,t3_abk3tp,3,True,False,abk3tp,
206,Whinnie the pup,aww,t3_abjy86,2,False,False,abjy86,
207,2018 as Cat owner,aww,t3_ab7zw0,65,False,False,ab7zw0,
208,For those asking about Bacon..She’s doing great! She and Nick are cuddle buddies,aww,t3_abaaa8,19,False,False,abaaa8,
209,Proud dad,aww,t3_ab6zix,92,False,False,ab6zix,
210,"Disturbing lack of bunnies here, have a pic of my little mans sister from when they were teeny",aww,t3_abl79s,4,False,False,abl79s,
211,Baby cow!,aww,t3_abb3mg,35,False,False,abb3mg,
212,We don’t deserve dogs,aww,t3_abardb,70,True,False,abardb,
213,Celine is not ready for January.,aww,t3_abkckr,0,False,False,abkckr,
214,Who's my daddy?,aww,t3_abie54,1,False,False,abie54,
215,Brotherly love,aww,t3_abk8vl,0,False,False,abk8vl,
216,When I finally get that dinner I like that no one wants.,aww,t3_abbb52,22,True,False,abbb52,
217,This made me say aww,aww,t3_abl2l7,0,False,False,abl2l7,
218,She's a good girl!,aww,t3_abklz6,0,False,False,abklz6,
219,Monch,aww,t3_abin3x,1,False,False,abin3x,
220,I found my kitten of 4 months sleeping like this. Meow.,aww,t3_abk6n9,0,False,False,abk6n9,
221,Moms New Puppy,aww,t3_abiwzo,0,False,False,abiwzo,
222,"Hey buds, time to come out for a breather.",aww,t3_abdd9k,4,False,False,abdd9k,
223,Meet River. Half Husky half Labrador Retriever,aww,t3_abl2nv,0,False,False,abl2nv,
224,Have you smiled today?,aww,t3_abl5uz,0,False,False,abl5uz,
225,The goodest boy,aww,t3_abim0k,3,True,False,abim0k,
226,a baby donkey relaxing. happy new year btw.,aww,t3_ab7dty,68,True,False,ab7dty,
227,My girl enjoying the late afternoon sun on the beach.,aww,t3_abk8xl,1,False,False,abk8xl,
228,My friend’s cat is old but has a big heart,aww,t3_abb4kj,5,False,False,abb4kj,
229,Dog and donkey friendship at Petra,aww,t3_abjslc,1,False,False,abjslc,
230,Her name is Bean,aww,t3_abjhjl,3,False,False,abjhjl,
231,Shy boy wanted to play catch while I was at work today,aww,t3_abgaa0,6,False,False,abgaa0,
232,Dinner time,aww,t3_abi9qj,1,False,False,abi9qj,
233,"Welcome our new rescue, Percy!",aww,t3_abi1pm,6,False,False,abi1pm,
234,My 2019 relationship goals; my friend and her 17 year old cat,aww,t3_abknax,0,False,False,abknax,
235,You can't separate these two.,aww,t3_abjsba,0,False,False,abjsba,
236,About that resolution you made last night....,aww,t3_abinju,1,False,False,abinju,
237,My dog is sad because we are taking down his christmas tree.,aww,t3_abk3ze,2,False,False,abk3ze,
238,First HAPPY NEW YEAR,aww,t3_abki8g,1,False,False,abki8g,
239,"Got this picture of one of my work's cats yesterday. Took it quickly on my phone, but it captured her eyes so well.",aww,t3_abdxo9,9,False,False,abdxo9,
240,Noodles welcomed us into the new year with a blep!,aww,t3_abjisd,1,False,False,abjisd,
241,Found this adorable picture and thought everyone here would enjoy it!,aww,t3_abd7dp,8,False,False,abd7dp,
242,They always know when we’re cooking,aww,t3_abkdoy,2,False,False,abkdoy,
243,"This fuzz ball, caught in action. . .",aww,t3_abk9wg,0,False,False,abk9wg,
244,Happy your 2019 is as happy as...,aww,t3_abjhit,1,False,False,abjhit,
245,My friend’s pup has beautiful eyes,aww,t3_abk198,2,False,False,abk198,
246,My view while cooking dinner everyday.... What are you doing mom??? Is that food I see??,aww,t3_abkrpe,0,False,False,abkrpe,
247,From nap time to dinner time in 15 seconds.,aww,t3_ab6rph,146,True,False,ab6rph,
248,"My majestic, derpy Husky (Iggy) enjoying the 6 degree weather, refusing to come inside - even for a bribe.",aww,t3_abkpwr,1,False,False,abkpwr,
249,Bye bye 2018,aww,t3_abjp9p,0,False,False,abjp9p,
250,Good girl,aww,t3_abjj8e,0,False,False,abjj8e,
251,Stop saying that to me Karen!,aww,t3_ab99zr,56,False,False,ab99zr,
252,Julia is so cute.Isn't she?,aww,t3_abj4lv,5,False,False,abj4lv,
253,Exploding kittens,aww,t3_abkslq,3,False,False,abkslq,
254,Since we’re sharing: Holding my son in the NICU,aww,t3_abbieh,43,False,False,abbieh,
255,First nap of 2019,aww,t3_abknfi,0,False,False,abknfi,
256,"My dad always said if we got pets he was naming them. Noodles, April 2014.",aww,t3_abjmwu,7,False,False,abjmwu,
257,Em isn’t rushing into 2019,aww,t3_abkhcz,0,False,False,abkhcz,
258,I got a little visitor today while at my friends house!,aww,t3_abkcyc,2,True,False,abkcyc,
259,Only such stories can restore my faith in humanity for a while.,aww,t3_ab6el8,607,True,False,ab6el8,
260,Happy New Year!,aww,t3_abi789,2,False,False,abi789,
261,I am darkness... They'll never find me here,aww,t3_ab7olq,21,False,False,ab7olq,
262,Some relationship can be define......,aww,t3_abkjls,4,False,False,abkjls,
263,YES! I know my EARS are big! My head is still growing,aww,t3_abkfav,2,False,False,abkfav,
264,Good morning!,aww,t3_abkskr,0,False,False,abkskr,
265,Lost in these eyes,aww,t3_abfuc3,7,False,False,abfuc3,
266,"My sleepy old girl, sapphire",aww,t3_abk6u7,0,False,False,abk6u7,
267,Old poor kitty needs some cuddles. Love this furball ♥️,aww,t3_abjpb0,0,False,False,abjpb0,
268,What are you sinking about?,aww,t3_abl1ro,0,False,False,abl1ro,
269,This made my day.,aww,t3_abghev,2,True,False,abghev,
270,This is Nessie. Nessie is a Golden Retriever. Needless to say Nessie is already very in tune with her retriever genes.,aww,t3_ab8e27,31,False,False,ab8e27,
271,"Please, Sir, I want some more pets",aww,t3_abi8gz,0,False,False,abi8gz,
272,I brought you dis. I brought you dis. I brought you dis.,aww,t3_ab7uhf,61,True,False,ab7uhf,
273,Got a bunny yesterday and I'm in love.,aww,t3_abi620,8,False,False,abi620,
274,"My new pupper, Zara",aww,t3_abhso6,2,False,False,abhso6,
275,So bear-ing cute!,aww,t3_abcszk,15,False,False,abcszk,
276,Happy New Years from Wednesday,aww,t3_abjw79,2,False,False,abjw79,
277,This curious little guy has been the best thing to happen to me in 2018.,aww,t3_abdzwl,6,False,False,abdzwl,
278,"Reddit, meet Keena. She is a lovable derp.",aww,t3_abkofs,0,False,False,abkofs,
279,"This is my 6 month old Kurilian Bobtail, his name is Octane.",aww,t3_abiz5q,7,True,False,abiz5q,
280,Adopted my first cat in March. Was originally going to get a young female cat. But this old gal stole my heart. She’ll be 13. She’s very healthy minus a little overweight and very anxious. Would adopt an elderly cat again.,aww,t3_abd608,37,False,False,abd608,
281,Was playing tug of war when..,aww,t3_abko5p,0,False,False,abko5p,
282,"She's been posted here before, but everyone say hello to Athena!",aww,t3_abjyn6,2,False,False,abjyn6,
283,"Spending new years with the love of my life, odin. We wish you all a happy new year!",aww,t3_abcj68,51,False,False,abcj68,
284,heheheheh,aww,t3_abks08,0,False,False,abks08,
285,20 years with this dude!,aww,t3_abig2o,6,False,False,abig2o,
286,This is Bella,aww,t3_abh3s3,2,False,False,abh3s3,
287,I had one stray. Now there are two.,aww,t3_abj1yv,7,False,False,abj1yv,
288,Almost 19 years old,aww,t3_abkhgi,3,False,False,abkhgi,
289,Evening good sir,aww,t3_abje4j,8,False,False,abje4j,
290,Not a lot changes in 3 years.,aww,t3_abl70w,1,False,False,abl70w,
291,Shiny boy,aww,t3_abkvod,3,False,False,abkvod,
292,Can you hear this fierce roar?,aww,t3_abl6og,1,False,False,abl6og,
293,Met this cutie pie yesterday.,aww,t3_abl5zo,1,False,False,abl5zo,
294,My mother-in-law's Maine Coon posing.,aww,t3_abl03q,0,False,False,abl03q,
295,Bath time for Nelly!! [OC],aww,t3_abism3,3,False,False,abism3,
296,Pup-A-Cola,aww,t3_abjvfn,0,False,False,abjvfn,
297,Making the bed,aww,t3_abiw3i,0,True,False,abiw3i,
298,"This is our cat, David Bowie.",aww,t3_abimnp,3,False,False,abimnp,
299,The chocolate family.,aww,t3_abikvj,8,False,False,abikvj,
300,Always Gonna Be a Lap Dog.,aww,t3_abkj63,1,False,False,abkj63,
301,Happy New Year Reddit from Sadie and I,aww,t3_abko0r,4,False,False,abko0r,
302,Our boy loves to sleep with his head smushed. Meet Yin!,aww,t3_abkyd5,0,False,False,abkyd5,
303,I think he's dreaming of when I'll take off that bow tie...,aww,t3_abjxox,0,False,False,abjxox,
304,Our maine coon looking majestic,aww,t3_abjto5,1,False,False,abjto5,
305,Alone with nature,aww,t3_abkxrl,1,False,False,abkxrl,
